form_type,filer_committee_id_number,transaction_id_number,back_reference_tran_id_number,back_reference_sched_name,entity_type,payee_organization_name,payee_last_name,payee_first_name,payee_middle_name,payee_prefix,payee_suffix,payee_street_1,payee_street_2,payee_city,payee_state,payee_zip_code,election_code,election_other_description,expenditure_date,expenditure_amount,semi_annual_refunded_bundled_amt,expenditure_purpose_descrip,category_code,beneficiary_committee_fec_id,beneficiary_committee_name,beneficiary_candidate_fec_id,beneficiary_candidate_last_name,beneficiary_candidate_first_name,beneficiary_candidate_middle_name,beneficiary_candidate_prefix,beneficiary_candidate_suffix,beneficiary_candidate_office,beneficiary_candidate_state,beneficiary_candidate_district,conduit_name,conduit_street_1,conduit_street_2,conduit_city,conduit_state,conduit_zip_code,memo_code,memo_text_description,reference_to_si_or_sl_system_code_that_identifies_the_account
SB23,C00615690,SB23.4622,,,CCM,A NEW DIRECTION PAC,,,,,,PO BOX 33079,,WASHINGTON,DC,20033,P2024,,2024-04-17,1000.00,,Contribution to leadership PAC affiliated with Jeanne Shaheen,,C00458570,A NEW DIRECTION PAC,,,,,,,S,NH,,,,,,,,,
SB23,C00615690,SB23.4634,,,CCM,FRIENDS OF NEAL DUNN,,,,,,PO BOX 10037,,TALLAHASSEE,FL,32302,P2024,,2024-05-14,500.00,,Contribution to campaign committee affiliated with Neal Dunn,,C00582304,FRIENDS OF NEAL DUNN,H6FL02208,DUNN,NEAL PATRICK,,,,H,FL,02,,,,,,,,
SB23,C00615690,SB23.4628,,,COM,GT FARM TEAM 2024,,,,,,PO BOX 30844,,BETHESDA,MD,20824,P2024,,2024-04-29,2500.00,,Contribution to joint fundraising committee affiliated with several candidates ,,C00805333,GT FARM TEAM 2024,,,,,,,,,,,,,,,,,
SB23,C00615690,SB23.4631,,,PAC,GUTHRIE VICTORY FUND,,,,,,P.O. 22401,,LOUISVILLE,KY,40252,P2024,,2024-06-17,2500.00,,Contribution to joint fundraising committee affiliated with Bret Guthrie,,C00871152,GUTHRIE VICTORY FUND,,,,,,,,,,,,,,,,,
SB23,C00615690,SB23.4641,,,CCM,JOHN CURTIS FOR UTAH,,,,,,PO BOX 296,,PROVO,UT,84603,P2024,,2024-06-25,2500.00,,contribution to campaign committee affiliated w Senate candidate John Curtis,,C00647339,JOHN CURTIS FOR UTAH,,,,,,,S,UT,00,,,,,,,,
SB23,C00615690,SB23.4625,,,CCM,LISA BLUNT ROCHESTER FOR SENATE,,,,,,P.O. BOX 9767,,WILMINGTON,DE,19809,P2024,,2024-04-17,1000.00,,Contribution to Lisa Blunt Rochester's Principal Campaign Committee,,C00843391,LISA BLUNT ROCHESTER FOR SENATE,,,,,,,S,DE,00,,,,,,,,
SB23,C00615690,SB23.4638,,,CCM,STUTZMAN FOR CONGRESS,,,,,,PO BOX 339,,HOWE,IN,46746,P2024,,2024-06-25,1000.00,,Contribution to campaign committee affiliated with House candidate Marlin Stutzman,,C00838110,STUTZMAN FOR CONGRESS,,,,,,,H,IN,03,,,,,,,,
