form_type,filer_committee_id_number,transaction_id_number,back_reference_tran_id_number,back_reference_sched_name,entity_type,payee_organization_name,payee_last_name,payee_first_name,payee_middle_name,payee_prefix,payee_suffix,payee_street_1,payee_street_2,payee_city,payee_state,payee_zip_code,election_code,election_other_description,expenditure_date,expenditure_amount,semi_annual_refunded_bundled_amt,expenditure_purpose_descrip,category_code,beneficiary_committee_fec_id,beneficiary_committee_name,beneficiary_candidate_fec_id,beneficiary_candidate_last_name,beneficiary_candidate_first_name,beneficiary_candidate_middle_name,beneficiary_candidate_prefix,beneficiary_candidate_suffix,beneficiary_candidate_office,beneficiary_candidate_state,beneficiary_candidate_district,conduit_name,conduit_street_1,conduit_street_2,conduit_city,conduit_state,conduit_zip_code,memo_code,memo_text_description,reference_to_si_or_sl_system_code_that_identifies_the_account
SB23,C00132092,SB23.16799,,,PAC,American Clean Power Association Cleanpower PAC,,,,,,1501 M Street NW,9th Floor,Washington,DC,20005,P2024,,2024-03-27,2500.00,,Contirbution,011,,,,,,,,,,,,,,,,,,,
SB23,C00132092,SB23.16790,,,PAC,AMERICAN GAS ASSOCIATION POLITICAL ACTION COMMITTEE,,,,,,"400 N. CAPITOL ST., N.W.","400 N. CAPITOL ST., N.W.",WASHINGTON,DC,20001,P2024,,2024-03-08,2500.00,,Contribution,011,C00007450,,,,,,,,,,,,,,,,,,
SB23,C00132092,SB23.16792,,,CCM,GARRET GRAVES FOR CONGRESS,,,,,,PO BOX 64845,,BATON ROUGE,LA,70896,P2024,,2024-02-14,1000.00,,Contribution,011,C00558486,GARRET GRAVES FOR CONGRESS,,,,,,,H,LA,06,,,,,,,,
SB23,C00132092,SB23.16798,,,COM,MILLER-MEEKS FOR CONGRESS,,,,,,PO BOX 33,,OTTUMWA,IA,52501,G2024,,2024-03-27,5000.00,,Contibution,011,,,,Miller-Meeks,Mariannette,Jane,,,H,IA,01,,,,,,,,
SB23,C00132092,SB23.16803,,,PAC,POWERPAC OF THE EDISON ELECTRIC INSTITUTE,,,,,,701 PENNSYLVANIA AVENUE NW,,WASHINGTON,DC,20004,P2024,,2024-03-08,5000.00,,Contribution,011,C00095869,,,,,,,,,,,,,,,,,,
SB23,C00132092,SB23.16795,,,CCM,"STEIL FOR WISCONSIN, INC.",,,,,,1818 MILTON AVE,# 1448,JANESVILLE,WI,53545,G2024,,2024-03-27,5000.00,,Contribution,011,C00677286,"STEIL FOR WISCONSIN, INC.",H8WI01156,STEIL,BRYAN GEORGE,,,,H,WI,01,,,,,,,,
SB23,C00132092,SB23.16806,,,CCM,TAMMY BALDWIN FOR SENATE,,,,,,P.O. BOX 696,,MADISON,WI,53701,P2024,,2024-03-08,1500.00,,Contribution,011,C00326801,TAMMY BALDWIN FOR SENATE,,,,,,,S,WI,00,,,,,,,,
