form_type,filer_committee_id_number,transaction_id_number,back_reference_tran_id_number,back_reference_sched_name,entity_type,payee_organization_name,payee_last_name,payee_first_name,payee_middle_name,payee_prefix,payee_suffix,payee_street_1,payee_street_2,payee_city,payee_state,payee_zip_code,election_code,election_other_description,expenditure_date,expenditure_amount,semi_annual_refunded_bundled_amt,expenditure_purpose_descrip,category_code,beneficiary_committee_fec_id,beneficiary_committee_name,beneficiary_candidate_fec_id,beneficiary_candidate_last_name,beneficiary_candidate_first_name,beneficiary_candidate_middle_name,beneficiary_candidate_prefix,beneficiary_candidate_suffix,beneficiary_candidate_office,beneficiary_candidate_state,beneficiary_candidate_district,conduit_name,conduit_street_1,conduit_street_2,conduit_city,conduit_state,conduit_zip_code,memo_code,memo_text_description,reference_to_si_or_sl_system_code_that_identifies_the_account
SB23,C00214981,11865256,,,ORG,TEXAS FARM BUREAU,,,,,,P. O. BOX 2689,,WACO,TX,767022689,R2024,2024 RUNOFF PRIMARY,2024-05-14,17.58,0.00,In Kind Contribution PAC Website Endorsement,011,C00855528,Craig Goldman For Congress,H4TX12065,Goldman,Craig,,,,H,TX,12,,,,,,,,In Kind Contribution PAC Website Endorsement
SB23,C00214981,11865257,,,ORG,TEXAS FARM BUREAU,,,,,,P. O. BOX 2689,,WACO,TX,767022689,R2024,2024 RUNOFF PRIMARY,2024-05-14,17.58,0.00,In Kind Contribution PAC Website Endorsement,011,C00706614,Tony Gonzales For Congress,H0TX35015,Gonzales,Tony,,,II,H,TX,23,,,,,,,,In Kind Contribution PAC Website Endorsement
SB23,C00214981,11869174,,,CCM,Brandon Gill For Texas,,,,,,P.O. Box 827,,Arlington,VA,22216,G2024,,2024-05-30,4800.00,0.00,Campaign Contribution,011,C00857359,Brandon Gill For Texas,H4TX26149,Gill,Brandon,,,,H,TX,26,,,,,,,,Campaign Contribution
SB23,C00214981,11871744,,,CCM,Andy Harris For Congress,,,,,,PO Box 6,,Cambridge,MD,21613,P2024,,2024-05-29,-5000.00,0.00,Campaign Contribution - Voided check from 2/29/2024,011,C00435974,Andy Harris For Congress,H8MD01094,Harris,Andy,,Rep.,"USNR, M.D.",H,MD,01,,,,,,,,Campaign Contribution - Voided check from 2/29/2024
SB23,C00214981,11871745,,,CCM,Sanford Bishop For Congress,,,,,,P O Box 909,,Columbus,GA,31902,P2024,,2024-05-29,-5000.00,0.00,Campaign Contribution - Voided check from 2/29/2024,011,C00266940,Sanford Bishop For Congress,H2GA02031,Bishop,Sanford,D.,,Jr.,H,GA,02,,,,,,,,Campaign Contribution - Voided check from 2/29/2024
