form_type,filer_committee_id_number,transaction_id_number,back_reference_tran_id_number,back_reference_sched_name,entity_type,payee_organization_name,payee_last_name,payee_first_name,payee_middle_name,payee_prefix,payee_suffix,payee_street_1,payee_street_2,payee_city,payee_state,payee_zip_code,election_code,election_other_description,expenditure_date,expenditure_amount,semi_annual_refunded_bundled_amt,expenditure_purpose_descrip,category_code,beneficiary_committee_fec_id,beneficiary_committee_name,beneficiary_candidate_fec_id,beneficiary_candidate_last_name,beneficiary_candidate_first_name,beneficiary_candidate_middle_name,beneficiary_candidate_prefix,beneficiary_candidate_suffix,beneficiary_candidate_office,beneficiary_candidate_state,beneficiary_candidate_district,conduit_name,conduit_street_1,conduit_street_2,conduit_city,conduit_state,conduit_zip_code,memo_code,memo_text_description,reference_to_si_or_sl_system_code_that_identifies_the_account
SB29,C00072967,SB29.11185,,,CCM,Alex Riley for State Representative,,,,,,3555 South Parkhill Avenue,,Springfield,MO,65807,P2024,,2023-09-06,250.00,,MO State Rep - Dist. 134,011,,Alex Riley for State Representative,,Riley,Alex,,,,H,MO,13,,,,,,,,
SB29,C00072967,SB29.11168,,,CCM,Daniela Velazquez for Saint Louis,,,,,,4110 Cleveland Ave,,St. Louis,MO,63110,P2025,,2023-09-06,1000.00,,Saint Louis Alderman - Dist. 6,011,,Daniela Velazquez for Saint Louis,,Velazquez,Daniela,,,,,MO,06,,,,,,,,
SB29,C00072967,SB29.11188,,,CCM,Friends of Bret Narayan,,,,,,6731 Wise Ave,,St. Louis,MO,63139,P2025,,2023-09-06,500.00,,St. Louis Alderman - Dist. 4,011,,Friends of Bret Narayan,,Narayan,Bret,,Mr.,,,MO,04,,,,,,,,
SB29,C00072967,SB29.11191,,,PAC,Friends of Growing Manchester: Our Future Together,,,,,,1015 Grupp Road,PO Box 3154,St. Louis,MO,63131,O2023,County,2023-09-21,500.00,,"City of Manchester, MO annexation campaign",011,,,,,,,,,,,,,,,,,,,
SB29,C00072967,SB29.11169,,,CCM,Page for Missouri,,,,,,17 Windsor Terrace Lane,,Creve Couer,MO,63141,P2026,,2023-09-07,2500.00,,St. Louis County Executive,011,,Page for Missouri,,Page,Sam,,,,,MO,,,,,,,,,
SB29,C00072967,SB29.11181,,,CCM,Pereles for Missouri,,,,,,PO Box 6641,,Chesterfield,MO,63006,P2024,,2023-09-06,500.00,,MO State Senate - Dist. 15,011,,Pereles for Missouri,,Pereles,Joe,,,,S,MO,15,,,,,,,,
SB29,C00072967,SB29.11167,,,CCM,Tishaura O. Jones for Mayor,,,,,,PO Box 56538,,St. Louis,MO,63156,P2025,,2023-09-06,1250.00,,Mayor - City of St. Louis,011,,Tishaura O. Jones for Mayor,,Jones,Tishaura,,,,,,,,,,,,,,
