form_type,filer_committee_id_number,transaction_id_number,back_reference_tran_id_number,back_reference_sched_name,entity_type,payee_organization_name,payee_last_name,payee_first_name,payee_middle_name,payee_prefix,payee_suffix,payee_street_1,payee_street_2,payee_city,payee_state,payee_zip_code,election_code,election_other_description,expenditure_date,expenditure_amount,semi_annual_refunded_bundled_amt,expenditure_purpose_descrip,category_code,beneficiary_committee_fec_id,beneficiary_committee_name,beneficiary_candidate_fec_id,beneficiary_candidate_last_name,beneficiary_candidate_first_name,beneficiary_candidate_middle_name,beneficiary_candidate_prefix,beneficiary_candidate_suffix,beneficiary_candidate_office,beneficiary_candidate_state,beneficiary_candidate_district,conduit_name,conduit_street_1,conduit_street_2,conduit_city,conduit_state,conduit_zip_code,memo_code,memo_text_description,reference_to_si_or_sl_system_code_that_identifies_the_account
SB23,C00200865,B-37706,,,CCM,Don Bacon for Congress,,,,,,PO Box 391368,,Omaha,NE,68139,P2024,,2023-05-01,1000.00,5000.00,Contribution,011,C00575167,Don Bacon for Congress,H6NE02125,Bacon,Donald,J,,,H,NE,02,,,,,,,,
SB23,C00200865,B-37709,,,CCM,Buchanan For Congress,,,,,,PO Box 48928,,Sarasota,FL,34236,P2024,,2023-05-03,1000.00,1000.00,Contribution,011,C00412759,Buchanan For Congress,H6FL13148,Buchanan,Vern,,,,H,FL,16,,,,,,,,
SB23,C00200865,B-37711,,,CCM,Kean for Congress Inc,,,,,,PO Box 999,,Edison,NJ,08818,P2024,,2023-05-05,1000.00,1000.00,Contribution,011,C00703058,Kean for Congress Inc,H0NJ07261,Kean,Thomas,H.,,Jr.,H,NJ,07,,,,,,,,
SB23,C00200865,B-37716,,,CCM,Cory Mills For Congress,,,,,,"501 N. Orlando Avenue Suite 313, P",,Winter Park,FL,32789,P2024,,2023-05-15,1000.00,1000.00,Contribution,011,C00774943,Cory Mills For Congress,H2FL07156,Mills,Cory,,,,H,FL,07,,,,,,,,
SB23,C00200865,B-37714,,,PAC,Seal PAC Supporting Electing American Leaders PAC,,,,,,1155 15th St NW,,Washington,DC,20005,,,2023-05-15,1500.00,1500.00,Contribution,011,C00570226,Seal PAC Supporting Electing American Leaders PAC,,,,,,,,,,,,,,,,,
SB23,C00200865,B-37720,,,PAC,Seal PAC Supporting Electing American Leaders PAC,,,,,,1155 15th St NW,,Washington,DC,20005,,,2023-05-16,1000.00,2500.00,Contribution,011,C00570226,Seal PAC Supporting Electing American Leaders PAC,,,,,,,,,,,,,,,,,
SB23,C00200865,B-37724,,,CCM,Self for Congress,,,,,,PO Box 1920,,Mckinney,TX,75070,P2024,,2023-05-22,1000.00,1000.00,Contribution,011,C00791293,Self for Congress,H2TX03290,Self,Keith,Alan,MR,,H,TX,03,,,,,,,,
