form_type,filer_committee_id_number,transaction_id_number,back_reference_tran_id_number,back_reference_sched_name,entity_type,payee_organization_name,payee_last_name,payee_first_name,payee_middle_name,payee_prefix,payee_suffix,payee_street_1,payee_street_2,payee_city,payee_state,payee_zip_code,election_code,election_other_description,expenditure_date,expenditure_amount,semi_annual_refunded_bundled_amt,expenditure_purpose_descrip,category_code,beneficiary_committee_fec_id,beneficiary_committee_name,beneficiary_candidate_fec_id,beneficiary_candidate_last_name,beneficiary_candidate_first_name,beneficiary_candidate_middle_name,beneficiary_candidate_prefix,beneficiary_candidate_suffix,beneficiary_candidate_office,beneficiary_candidate_state,beneficiary_candidate_district,conduit_name,conduit_street_1,conduit_street_2,conduit_city,conduit_state,conduit_zip_code,memo_code,memo_text_description,reference_to_si_or_sl_system_code_that_identifies_the_account
SB29,C00330233,SB29.14459,,,CCM,Committee to Re-Elect Craig Blair,,,,,,47 Wasser Drive,,Martinsburg,WV,25403,P2024,,2024-02-26,2000.00,,Contribution,,,Committee to Re-Elect Craig Blair,,Blair,Craig,,,,S,WV,15,,,,,,,,
SB29,C00330233,SB29.14460,,,CCM,Haley Bunne For WV,,,,,,"300 Summers St., Suite 100",,Charleston,WV,25301,P2024,,2024-02-26,1000.00,,Contribution for West Virginia Supreme Court Justice,,,Haley Bunne For WV,,Bunn,Haley,,,,,WV,00,,,,,,,,
SB29,C00330233,SB29.14461,,,CCM,J.T. Payne for State Representative,,,,,,PO Box 1503,,Henderson,KY,42420,P2024,,2024-02-26,250.00,,Contribution,,,J.T. Payne for State Representative,,Payne,J.T.,,,,H,KY,11,,,,,,,,
SB29,C00330233,SB29.14462,,,CCM,Mike for WV Committee,,,,,,11 Southcove Lane,,South Charleston,WV,25309,P2024,,2024-02-26,2500.00,,Contribution for Office of West Virginia Attorney General,,,Mike for WV Committee,,Stuart,Mike,,,,,WV,00,,,,,,,,
SB29,C00330233,SB29.14463,,,CCM,Rupie for Senate,,,,,,PO Box 194,,Lorado,WV,25630,P2024,,2024-02-26,1000.00,,Contribution,,,Rupie for Senate,,Phillips,Rupert,,,,S,WV,07,,,,,,,,
