form_type,filer_committee_id_number,transaction_id_number,back_reference_tran_id_number,back_reference_sched_name,entity_type,payee_organization_name,payee_last_name,payee_first_name,payee_middle_name,payee_prefix,payee_suffix,payee_street_1,payee_street_2,payee_city,payee_state,payee_zip_code,election_code,election_other_description,expenditure_date,expenditure_amount,semi_annual_refunded_bundled_amt,expenditure_purpose_descrip,category_code,beneficiary_committee_fec_id,beneficiary_committee_name,beneficiary_candidate_fec_id,beneficiary_candidate_last_name,beneficiary_candidate_first_name,beneficiary_candidate_middle_name,beneficiary_candidate_prefix,beneficiary_candidate_suffix,beneficiary_candidate_office,beneficiary_candidate_state,beneficiary_candidate_district,conduit_name,conduit_street_1,conduit_street_2,conduit_city,conduit_state,conduit_zip_code,memo_code,memo_text_description,reference_to_si_or_sl_system_code_that_identifies_the_account
SB29,C00346403,SB29.4434,,,PAC,Arizona Police Officers Association PAC,,,,,,,,,,,,,2024-01-02,1300.00,,,,,,,,,,,,,,,,,,,,,,
SB29,C00346403,SB29.4441,,,CCM,Committee to Elect David Marshall,,,,,,,,,,,,,2024-01-09,400.00,,,,,,,,,,,,,,,,,,,,,,
SB29,C00346403,SB29.4439,,,CCM,John Gillette for State Representative,,,,,,,,,,,,,2024-01-09,250.00,,,,,,,,,,,,,,,,,,,,,,
SB29,C00346403,SB29.4446,,,CCM,John Kavanagh for Senate,,,,,,,,,,,,,2024-01-18,250.00,,,,,,,,,,,,,,,,,,,,,,
SB29,C00346403,SB29.4436,,,CCM,Julie Willoughby for State Representative,,,,,,,,,,,,,2024-01-09,500.00,,,,,Jennifer Pawlik for AZ House,,,,,,,,,,,,,,,,,
SB29,C00346403,SB29.4445,,,CCM,Martinez for Arizona,,,,,,??,,Casa Grande,AZ,85193,,,2024-01-09,500.00,,,,,,,,,,,,,,,,,,,,,,
SB29,C00346403,SB29.4443,,,CCM,Pena for Arizona House,,,,,,,,,,,,,2024-01-09,250.00,,,,,,,,,,,,,,,,,,,,,,
SB29,C00346403,SB29.4435,,,CCM,Quang Nguyen for State Rep,,,,,,,,,,,,,2024-01-03,250.00,,,,,,,,,,,,,,,,,,,,,,
