form_type,filer_committee_id_number,transaction_id_number,back_reference_tran_id_number,back_reference_sched_name,entity_type,payee_organization_name,payee_last_name,payee_first_name,payee_middle_name,payee_prefix,payee_suffix,payee_street_1,payee_street_2,payee_city,payee_state,payee_zip_code,election_code,election_other_description,expenditure_date,expenditure_amount,semi_annual_refunded_bundled_amt,expenditure_purpose_descrip,category_code,beneficiary_committee_fec_id,beneficiary_committee_name,beneficiary_candidate_fec_id,beneficiary_candidate_last_name,beneficiary_candidate_first_name,beneficiary_candidate_middle_name,beneficiary_candidate_prefix,beneficiary_candidate_suffix,beneficiary_candidate_office,beneficiary_candidate_state,beneficiary_candidate_district,conduit_name,conduit_street_1,conduit_street_2,conduit_city,conduit_state,conduit_zip_code,memo_code,memo_text_description,reference_to_si_or_sl_system_code_that_identifies_the_account
SB23,C00711549,23-02-01828-02743,,,CCM,Whitney Fox for Congress,,,,,,PO Box 49344,,St. Petersburg,FL,33743,P2024,,2024-07-02,1000.00,,Contribution,,C00854307,Whitney Fox for Congress,H4FL13200,Fox,Whitney,,,,H,FL,13,,,,,,,,
SB23,C00711549,23-02-01874-02806,,,CCM,Maggie for Congress,,,,,,131 Daniel Webster Hwy Box #949,,Nashua,NH,03060,P2024,,2024-08-13,5000.00,,Contribution,,C00878454,Maggie for Congress,H4NH02399,Goodlander,Maggie,,,,H,NH,02,,,,,,,,
SB23,C00711549,23-02-01892-02826,,,CCM,Whitney Fox for Congress,,,,,,PO Box 49344,,St. Petersburg,FL,33743,G2024,,2024-08-27,1000.00,,Contribution,,C00854307,Whitney Fox for Congress,H4FL13200,Fox,Whitney,,,,H,FL,13,,,,,,,,
SB23,C00711549,23-00-00216-00216,,,PAC,DMA PAC,,,,,,814 Main Street,,Paris,KY,40361,,,2024-09-29,70042.16,,"Inkind: Software, Rent, Overhead, Compliance and Fundraising Services",,C00762666,DMA PAC,,,,,,,,,,,,,,,,,
SB23,C00711549,23-00-00224-00224,,,PAC,American SOS Project PAC,,,,,,814 Main Street,,Paris,KY,40361,,,2024-09-29,262.50,,"Inkind: Software, Rent, Overhead, Compliance and Fundraising Services",,C00809095,American SOS Project PAC,,,,,,,,,,,,,,,,,
SB23,C00711549,23-00-00218-00218,,,PAC,Operation Saving Democracy,,,,,,814 Main Street,,Paris,KY,40361,,,2024-09-29,7544.63,,"Inkind: Software, Rent, Overhead, Compliance and Fundraising Services",,C00842575,Operation Saving Democracy,,,,,,,,,,,,,,,,,
SB23,C00711549,23-00-00207-00207,,,PAC,DMA PAC,,,,,,814 Main Street,,Paris,KY,40361,,,2024-09-30,29548.64,,Inkind: Payroll,,C00762666,DMA PAC,,,,,,,,,,,,,,,,,
SB23,C00711549,23-00-00211-00211,,,PAC,Operation Saving Democracy,,,,,,814 Main Street,,Paris,KY,40361,,,2024-09-30,897.10,,Inkind: Payroll,,C00842575,Operation Saving Democracy,,,,,,,,,,,,,,,,,
