form_type,filer_committee_id_number,transaction_id_number,back_reference_tran_id_number,back_reference_sched_name,entity_type,payee_organization_name,payee_last_name,payee_first_name,payee_middle_name,payee_prefix,payee_suffix,payee_street_1,payee_street_2,payee_city,payee_state,payee_zip_code,election_code,election_other_description,expenditure_date,expenditure_amount,semi_annual_refunded_bundled_amt,expenditure_purpose_descrip,category_code,beneficiary_committee_fec_id,beneficiary_committee_name,beneficiary_candidate_fec_id,beneficiary_candidate_last_name,beneficiary_candidate_first_name,beneficiary_candidate_middle_name,beneficiary_candidate_prefix,beneficiary_candidate_suffix,beneficiary_candidate_office,beneficiary_candidate_state,beneficiary_candidate_district,conduit_name,conduit_street_1,conduit_street_2,conduit_city,conduit_state,conduit_zip_code,memo_code,memo_text_description,reference_to_si_or_sl_system_code_that_identifies_the_account
SB23,C00371336,SB23.4400,,,CCM,FRIENDS FOR DREW MACEWEN,,,,,,320 E DALBY RD STE D,,UNION,WA,98592,G2024,,2024-09-25,1500.00,,,,C00858142,FRIENDS FOR DREW MACEWEN,,,,,,,H,WA,06,,,,,,,,
SB23,C00371336,SB23.4386,,,CCM,FRIENDS OF HILARY FRANZ,,,,,,PO BOX 7437,,TACOMA,WA,98417,P2024,,2024-07-17,1000.00,,,,C00856344,FRIENDS OF HILARY FRANZ,,,,,,,H,WA,06,,,,,,,,
SB23,C00371336,SB23.4388,,,CCM,LORI CHAVEZ-DEREMER FOR CONGRESS,,,,,,13203 SE 172ND AVE,STE 166 #399,HAPPY VALLEY,OR,97086,G2024,,2024-08-02,3000.00,,,,C00784520,LORI CHAVEZ-DEREMER FOR CONGRESS,,,,,,,H,OR,05,,,,,,,,
SB23,C00371336,SB23.4398,,,CCM,MARIE FOR CONGRESS,,,,,,PO BOX 1164,,WASHOUGAL,WA,98671,G2024,,2024-09-25,2500.00,,,,C00806174,MARIE FOR CONGRESS,,,,,,,H,WA,03,,,,,,,,
SB23,C00371336,SB23.4394,,,CCM,TIM SHEEHY FOR MONTANA,,,,,,PO BOX 7209,,HELENA,MT,59604,G2024,,2024-09-25,4000.00,,,,C00844159,TIM SHEEHY FOR MONTANA,,,,,,,S,MT,00,,,,,,,,
SB23,C00371336,SB23.4389,,,CCM,VAL HOYLE FOR CONGRESS,,,,,,PO BOX 657,,SPRINGFIELD,OR,97477,G2024,,2024-08-13,3000.00,,,,C00796144,VAL HOYLE FOR CONGRESS,,,,,,,H,OR,04,,,,,,,,
SB23,C00371336,SB23.4396,,,CCM,VOTE BAUMGARTNER FOR CONGRESS,,,,,,PO BOX 8508,,SPOKANE,WA,99203,G2024,,2024-09-25,3000.00,,,,C00870758,,,,,,,,H,WA,05,,,,,,,,
SB23,C00371336,SB23.4393,,,CCM,ZINKE FOR CONGRESS,,,,,,704C 13TH ST E,STE 260,WHITEFISH,MT,59937,G2024,,2024-09-25,4000.00,,,,C00778159,ZINKE FOR CONGRESS,,,,,,,H,MT,01,,,,,,,,
