form_type,filer_committee_id_number,transaction_id_number,back_reference_tran_id_number,back_reference_sched_name,entity_type,payee_organization_name,payee_last_name,payee_first_name,payee_middle_name,payee_prefix,payee_suffix,payee_street_1,payee_street_2,payee_city,payee_state,payee_zip_code,election_code,election_other_description,expenditure_date,expenditure_amount,semi_annual_refunded_bundled_amt,expenditure_purpose_descrip,category_code,beneficiary_committee_fec_id,beneficiary_committee_name,beneficiary_candidate_fec_id,beneficiary_candidate_last_name,beneficiary_candidate_first_name,beneficiary_candidate_middle_name,beneficiary_candidate_prefix,beneficiary_candidate_suffix,beneficiary_candidate_office,beneficiary_candidate_state,beneficiary_candidate_district,conduit_name,conduit_street_1,conduit_street_2,conduit_city,conduit_state,conduit_zip_code,memo_code,memo_text_description,reference_to_si_or_sl_system_code_that_identifies_the_account
SB23,C00450056,B7D73A5F5433C4A509BF,,,CCM,DONALD NORCROSS FOR CONGRESS,,,,,,PO BOX 160,,COLLINGSWOOD,NJ,08108,P2024,,2023-04-18,2900.00,,Contribution to Fed. Comm.,,C00558320,DONALD NORCROSS FOR CONGRESS,H4NJ01084,Norcross,Donald,,Rep.,,H,NJ,01,,,,,,,,,
SB23,C00450056,B83D0D40DF3EA42F3916,,,CCM,KATHERINE CLARK FOR CONGRESS,,,,,,PO BOX 361,,MALDEN,MA,02148,P2024,,2023-06-08,1000.00,,Contribution to Fed. Comm.,,C00541888,KATHERINE CLARK FOR CONGRESS,H4MA05084,Clark,Katherine,,Rep.,,H,MA,05,,,,,,,,,
SB23,C00450056,B46EC87EB08CA4AE7AC2,,,CCM,CHRISSY HOULAHAN FOR CONGRESS,,,,,,PO BOX 222,,Devon,PA,193330222,P2024,,2023-05-30,1500.00,,Contribution to Fed. Comm.,,C00637371,CHRISSY HOULAHAN FOR CONGRESS,H8PA06087,Houlahan,Chrissy,,Rep.,,H,PA,06,,,,,,,,,
SB23,C00450056,B1D3EBFAABB5B4DE4B6A,,,PTY,Democratic Congressional Campaign Committee (DCCC),,,,,,430 S. Capitol Street SE,Floor 2,Washington,DC,200034024,O2023,Other,2023-06-22,1000.00,,Contribution to Fed. Comm.,,,,,,,,,,,,,,,,,,,,,
SB23,C00450056,BBAC4F82A5180463AA35,,,CCM,Brian Fitzpatrick for All of Us,,,,,,1152 Mae Street,Suite #129,Hummelstown,PA,170369185,P2024,,2023-06-08,2500.00,,Contribution to Fed. Comm.,,C00607416,Brian Fitzpatrick for All of Us,H6PA08277,Fitzpatrick,Brian,,Rep.,,H,PA,01,,,,,,,,,
SB23,C00450056,B140482A8B26F43E0819,,,CCM,SCANLON FOR CONGRESS,,,,,,PO BOX 263,,Swarthmore,PA,190810263,P2024,,2023-05-30,2500.00,,Contribution to Fed. Comm.,,C00669358,SCANLON FOR CONGRESS,H8PA07200,Scanlon,Mary,Gay,Rep.,,H,PA,05,,,,,,,,,
SB23,C00450056,B327C8AA8D1804467B85,,,CCM,MONTANANS FOR TESTER,,,,,,PO BOX 1135,,Helena,MT,596241135,G2024,,2023-05-18,1000.00,,Contribution to Fed. Comm.,,C00412304,MONTANANS FOR TESTER,S6MT00162,Tester,Jon,,Sen.,,S,MT,,,,,,,,,,
SB23,C00450056,B6CECE1A1298F4786B50,,,CCM,PA Democratic Party - Federal PAC,,,,,,229 STATE ST,,Harrisburg,PA,171011110,O2022,Other,2023-04-06,-1000.00,,Void disbursement dated 12/5/2022,,C00167130,PA Democratic Party - Federal PAC,,,,,,,,,,,,,,,,,,
SB23,C00450056,B8F93E0D445AF4C50A35,,,CCM,LISA BLUNT ROCHESTER FOR CONGRESS,,,,,,PO BOX 9767,,WILMINGTON,DE,19809,P2024,,2023-06-08,1000.00,,Contribution to Fed. Comm.,,C00590778,LISA BLUNT ROCHESTER FOR CONGRESS,H6DE00206,Blunt Rochester,Lisa,,Rep.,,H,DE,01,,,,,,,,,
SB23,C00450056,B343FBA7D731B450F9C1,,,CCM,VAN DREW FOR CONGRESS,,,,,,PO BOX 671,,CAPE MAY COURT HOU,NJ,08210,P2024,,2023-06-08,1000.00,,Contribution to Fed. Comm.,,C00661868,VAN DREW FOR CONGRESS,H8NJ02166,Van Drew,Jefferson,,Rep.,,H,NJ,02,,,,,,,,,
SB23,C00450056,B384A0EBD75A9410493B,,,CCM,MIKE BOST FOR CONGRESS COMMITTEE,,,,,,PO BOX 1212,,MURPHYSBORO,IL,62966,P2024,,2023-03-28,1000.00,,Contribution to Fed. Comm.,,C00546499,MIKE BOST FOR CONGRESS COMMITTEE,H4IL12060,Bost,Mike,,Rep.,,H,IL,12,,,,,,,,,
SB23,C00450056,BAE5AFEB226EA436BB1C,,,CCM,TEAM JOYCE FOR PENNSYLVANIA,,,,,,824 S MILLEDGE AVE,SUITE 101,Athens,GA,30606,O2023,Other,2023-05-16,2500.00,,Contribution to Fed. Comm.,,C00747220,TEAM JOYCE FOR PENNSYLVANIA,,,,,,,,,,,,,,,,,,
SB23,C00450056,B02D4D0265E4B4964AF2,,,CCM,SCANLON FOR CONGRESS,,,,,,PO BOX 263,,Swarthmore,PA,190810263,P2024,,2023-03-28,1000.00,,Contribution to Fed. Comm.,,C00669358,SCANLON FOR CONGRESS,H8PA07200,Scanlon,Mary,Gay,Rep.,,H,PA,05,,,,,,,,,
SB23,C00450056,B23BE21A55E3143DDABD,,,CCM,EMMER FOR CONGRESS,,,,,,PO BOX 998,,ANOKA,MN,55303,P2024,,2023-06-22,1000.00,,Contribution to Fed. Comm.,,C00545749,EMMER FOR CONGRESS,H4MN06087,Emmer,Tom,,Rep.,Jr.,H,MN,06,,,,,,,,,
SB23,C00450056,B90C5C247E7F24C01AFD,,,CCM,DONALD NORCROSS FOR CONGRESS,,,,,,PO BOX 160,,COLLINGSWOOD,NJ,08108,P2024,,2023-02-09,1000.00,,Contribution to Fed. Comm.,,C00558320,DONALD NORCROSS FOR CONGRESS,H4NJ01084,Norcross,Donald,,Rep.,,H,NJ,01,,,,,,,,,
SB23,C00450056,B5CE3C99B906B49A5AC4,,,CCM,Brian Fitzpatrick for All of Us,,,,,,1152 Mae Street,Suite #129,Hummelstown,PA,170369185,P2024,,2023-02-28,1500.00,,Contribution to Fed. Comm.,,C00607416,Brian Fitzpatrick for All of Us,H6PA08277,Fitzpatrick,Brian,,Rep.,,H,PA,01,,,,,,,,,
SB23,C00450056,B3C0D462C8CE24E6CA70,,,CCM,JOSH GOTTHEIMER FOR CONGRESS,,,,,,PO BOX 584,,Ridgewood,NJ,074510584,P2024,,2023-02-09,2500.00,,Contribution to Fed. Comm.,,C00573949,JOSH GOTTHEIMER FOR CONGRESS,H6NJ05171,Gottheimer,Josh,,Rep.,,H,NJ,05,,,,,,,,,
SB23,C00450056,B6C6EDBF2E3574B47851,,,CCM,MIKIE SHERRILL FOR CONGRESS,,,,,,P.O. BOX 43032,,Montclair,NJ,070430032,P2024,,2023-05-30,1000.00,,Contribution to Fed. Comm.,,C00640003,MIKIE SHERRILL FOR CONGRESS,H8NJ11142,Sherrill,Mikie,,Rep.,,H,NJ,11,,,,,,,,,
SB23,C00450056,B62BBD08D108A467A930,,,CCM,Brian Fitzpatrick for All of Us,,,,,,1152 Mae Street,Suite #129,Hummelstown,PA,170369185,G2024,,2023-06-08,1500.00,,Contribution to Fed. Comm.,,C00607416,Brian Fitzpatrick for All of Us,H6PA08277,Fitzpatrick,Brian,,Rep.,,H,PA,01,,,,,,,,,
SB23,C00450056,BD607F633AD3B4518BDA,,,CCM,Brian Fitzpatrick for All of Us,,,,,,1152 Mae Street,Suite #129,Hummelstown,PA,170369185,P2024,,2023-02-09,1000.00,,Contribution to Fed. Comm.,,C00607416,Brian Fitzpatrick for All of Us,H6PA08277,Fitzpatrick,Brian,,Rep.,,H,PA,01,,,,,,,,,
SB23,C00450056,B188B6F2B7A884DA7A02,,,CCM,GREG STEUBE FOR CONGRESS,,,,,,5317 FRUITVILLE RD,# 102,SARASOTA,FL,342326402,P2024,,2023-03-28,1000.00,,Contribution to Fed. Comm.,,C00671891,GREG STEUBE FOR CONGRESS,H8FL17053,Steube,Greg,,Rep.,,H,FL,17,,,,,,,,,
SB23,C00450056,B321BE6C6A6E8463699E,,,CCM,CHRISSY HOULAHAN FOR CONGRESS,,,,,,PO BOX 222,,Devon,PA,193330222,P2024,,2023-05-16,1000.00,,Contribution to Fed. Comm.,,C00637371,CHRISSY HOULAHAN FOR CONGRESS,H8PA06087,Houlahan,Chrissy,,Rep.,,H,PA,06,,,,,,,,,
SB23,C00450056,B5EB19B3B8FE7483CB16,,,PTY,The Pennsylvania Democratic Party,,,,,,229 State Street,,Harrisburg,PA,17101,O2023,Other,2023-03-30,5000.00,,Contribution to Fed. Comm.,,,,,,,,,,,,,,,,,,,,,
SB23,C00450056,B26F545CBC8ED4599B12,,,CCM,KEAN FOR CONGRESS INC,,,,,,PO BOX 999,,EDISON,NJ,08818,P2024,,2023-01-26,2500.00,,Contribution to Fed. Comm.,,C00703058,KEAN FOR CONGRESS INC,H0NJ07261,Kean,Tom,,Rep.,Jr.,H,NJ,07,,,,,,,,,
SB23,C00450056,BCF36C70594184EACB08,,,PAC,BRINGING AMERICA TOGETHER PAC,,,,,,PO BOX 30844,,BETHESDA,MD,20824,O2023,Other,2023-06-08,1000.00,,Contribution to Fed. Comm.,,C00647354,BRINGING AMERICA TOGETHER PAC,,,,,,,,,,,,,,,,,,
SB23,C00450056,BF73610D5E70C46218B2,,,PAC,VOTEVETS,,,,,,"1831 BAY STREET, SE",,WASHINGTON,DC,20003,O2023,Other,2023-06-22,2500.00,,Contribution to Fed. Comm.,,C00418897,VOTEVETS,,,,,,,,,,,,,,,,,,
SB23,C00450056,B282F99D2CC3C4C2A8FF,,,PAC,A Woman's Place PAC,,,,,,PO Box 15320,,Washington,DC,200030320,G2022,,2023-04-06,-1000.00,,Void disbursement dated 9/20/2022,,C00699421,A Woman's Place PAC,,,,,,,,,,,,,,,,,,
SB23,C00450056,B2D43284FD2754208BF4,,,PAC,HOLDING ONTO OREGON'S PRIORITIES,,,,,,PO Box 3498,,Portland,OR,972083498,O2023,Other,2023-02-28,2500.00,,Contributions to Fed. Comms.,,C00392738,HOLDING ONTO OREGON'S PRIORITIES,,,,,,,,,,,,,,,,,,
SB23,C00450056,B0A00AAA30A5644C18C1,,,PAC,Innovation PAC,,,,,,228 S Washington St,Ste 115,Alexandria,VA,223145404,O2023,Other,2023-06-08,2500.00,,Contribution to Fed. Comm.,,C00540187,Innovation PAC,,,,,,,,,,,,,,,,,,
SB23,C00450056,B89905997E1FD40088E0,,,PAC,Mr Southern Missourian in the House,,,,,,PO BOX 30844,,Bethesda,MD,208240844,O2023,Other,2023-02-28,2500.00,,Contributions to Fed. Comms.,,C00563726,Mr Southern Missourian in the House,,,,,,,,,,,,,,,,,,
SB23,C00450056,BBBF634B0AFE9426B83B,,,PAC,WASHINGTON STATE DEMOCRATIC CENTRAL COMMITTEE,,,,,,P O BOX 4027,,SEATTLE,WA,98194,O2023,Other,2023-04-20,1000.00,,Contribution to Fed. Comm.,,C00114439,WASHINGTON STATE DEMOCRATIC CENTRAL COMMITTEE,,,,,,,,,,,,,,,,,,
