form_type,filer_committee_id_number,transaction_id_number,back_reference_tran_id_number,back_reference_sched_name,entity_type,payee_organization_name,payee_last_name,payee_first_name,payee_middle_name,payee_prefix,payee_suffix,payee_street_1,payee_street_2,payee_city,payee_state,payee_zip_code,election_code,election_other_description,expenditure_date,expenditure_amount,semi_annual_refunded_bundled_amt,expenditure_purpose_descrip,category_code,beneficiary_committee_fec_id,beneficiary_committee_name,beneficiary_candidate_fec_id,beneficiary_candidate_last_name,beneficiary_candidate_first_name,beneficiary_candidate_middle_name,beneficiary_candidate_prefix,beneficiary_candidate_suffix,beneficiary_candidate_office,beneficiary_candidate_state,beneficiary_candidate_district,conduit_name,conduit_street_1,conduit_street_2,conduit_city,conduit_state,conduit_zip_code,memo_code,memo_text_description,reference_to_si_or_sl_system_code_that_identifies_the_account
SB23,C00729574,B-3041,,,PAC,Campaign for Democracy Group,,,,,,"1787 Tribute Road, Suite K",,Sacramento,CA,95815,,,2024-05-14,5000.00,5000.00,Non-contribution account,011,C00836338,Campaign for Democracy Group,,,,,,,,,,,,,,,,,Non-Contribution Account
SB23,C00729574,B-3039,,,PAC,Campaign for Democracy PAC,,,,,,"1787 Tribute Road, Suite K",,Sacramento,CA,95815,,,2024-05-14,5000.00,5000.00,Contribution,011,C00836320,Campaign for Democracy PAC,,,,,,,,,,,,,,,,,
SB23,C00729574,B-3048,,,PAC,Congressional Black Caucus PAC,,,,,,PO Box 75357,,Washington,DC,20013,,,2024-05-15,5000.00,5000.00,Contribution,011,C00147512,Congressional Black Caucus PAC,,,,,,,,,,,,,,,,,
SB23,C00729574,B-2992,,,CCM,Connolly for Congress,,,,,,PO Box 563,,Merrifield,VA,22116,P2024,,2024-04-13,5000.00,5000.00,Contribution,011,,Connolly for Congress,H8VA11062,Connolly,Gerald,Edward,,,H,VA,11,,,,,,,,
SB23,C00729574,B-3054,,,CCM,George Latimer for Congress,,,,,,P.o. Box 789,,White Plains,NY,10602,P2024,,2024-05-20,5000.00,5000.00,Contribution,011,,George Latimer for Congress,H4NY16087,Latimer,George,,,,H,NY,16,,,,,,,,
