form_type,filer_committee_id_number,transaction_id_number,back_reference_tran_id_number,back_reference_sched_name,entity_type,payee_organization_name,payee_last_name,payee_first_name,payee_middle_name,payee_prefix,payee_suffix,payee_street_1,payee_street_2,payee_city,payee_state,payee_zip_code,election_code,election_other_description,expenditure_date,expenditure_amount,semi_annual_refunded_bundled_amt,expenditure_purpose_descrip,category_code,beneficiary_committee_fec_id,beneficiary_committee_name,beneficiary_candidate_fec_id,beneficiary_candidate_last_name,beneficiary_candidate_first_name,beneficiary_candidate_middle_name,beneficiary_candidate_prefix,beneficiary_candidate_suffix,beneficiary_candidate_office,beneficiary_candidate_state,beneficiary_candidate_district,conduit_name,conduit_street_1,conduit_street_2,conduit_city,conduit_state,conduit_zip_code,memo_code,memo_text_description,reference_to_si_or_sl_system_code_that_identifies_the_account
SB29,C00514026,B001076S000001L29,,,COM,BISHOP FOR NC,,,,,,PO BOX 1285,,WAXHAW,NC,28173,G2024,,2024-08-14,1500.00,,NC ATTORNEY GENERAL CANDIDATE,011,,,,BISHOP,DAN,,,,,NC,,,,,,,,,
SB29,C00514026,B001077S000003L29,,,COM,FRIENDS OF MATT BRADFORD,,,,,,PO BOX 349,,NORRISTOWN,PA,19404,G2024,,2024-08-28,2500.00,,PA STATE REP/MAJORITY LEADER DISTRICT 70,011,,,,BRADFORD,MATT,,,,H,PA,70,,,,,,,,
SB29,C00514026,B001072S000002L29,,,COM,FRIENDS OF SEAN KERTES,,,,,,422 ARCH STREET,,GREENSBURG,PA,15601,G2024,,2024-08-06,3500.00,,"WESTMORELAND COUNTY, PA COMMISSIONER",011,,,,KERTES,SEAN,,,,,PA,,,,,,,,,
SB29,C00514026,B001072S000001L29,,,COM,FRIENDS OF SEAN KERTES,,,,,,422 ARCH STREET,,GREENSBURG,PA,15601,G2024,,2024-08-06,-3500.00,,CHECK VOIDED & RE-ISSUED VIA CHECK #1609,011,,,,KERTES,SEAN,,,,,PA,,,,,,,,,
SB29,C00514026,B001077S000001L29,,,COM,LANGERHOLC FOR SENATE COMMITTEE,,,,,,311 SALMON AVENUE,,JOHNSTOWN,PA,15904,G2024,,2024-08-28,750.00,,PA STATE SENATE DISTRICT 35,011,,,,LANGERHOLC,WAYNE,,,JR,S,PA,35,,,,,,,,
SB29,C00514026,B001073S000001L29,,,COM,REPUBLICANS UNITED,,,,,,980 VALLEY ROAD,% MARIA DIESEL,BLUE BELL,PA,19422,O2024,ANNUAL/OTHER,2024-08-01,1000.00,,LEADERSHIP PAC OF AG CAND. DAVE SUNDAY,011,,,,,,,,,,PA,,,,,,,,,
SB29,C00514026,B001074S000001L29,,,PTY,ROBINSON TOWNSHIP DEMOCRAT COMMITTEE,,,,,,85 FOREST GROVE ROAD,,CORAOPOLIS,PA,15108,O2024,ANNUAL/OTHER,2024-08-06,1000.00,,2024 ANNUAL/OTHER,011,,,,,,,,,,PA,,,,,,,,,
SB29,C00514026,B001077S000002L29,,,COM,FRIENDS OF ERIC WEAKNECHT,,,,,,980 VALLEY ROAD,,BLUE BELL,PA,19422,G2024,,2024-08-28,1000.00,,PA STATE REPRESENTATIVE DISTRICT 5,011,,,,WEAKNECHT,ERIC,,,,H,PA,05,,,,,,,,
