form_type,filer_committee_id_number,transaction_id_number,back_reference_tran_id_number,back_reference_sched_name,entity_type,payee_organization_name,payee_last_name,payee_first_name,payee_middle_name,payee_prefix,payee_suffix,payee_street_1,payee_street_2,payee_city,payee_state,payee_zip_code,election_code,election_other_description,expenditure_date,expenditure_amount,semi_annual_refunded_bundled_amt,expenditure_purpose_descrip,category_code,beneficiary_committee_fec_id,beneficiary_committee_name,beneficiary_candidate_fec_id,beneficiary_candidate_last_name,beneficiary_candidate_first_name,beneficiary_candidate_middle_name,beneficiary_candidate_prefix,beneficiary_candidate_suffix,beneficiary_candidate_office,beneficiary_candidate_state,beneficiary_candidate_district,conduit_name,conduit_street_1,conduit_street_2,conduit_city,conduit_state,conduit_zip_code,memo_code,memo_text_description,reference_to_si_or_sl_system_code_that_identifies_the_account
SB29,C00688606,B851852,,,CCM,Nick Sherman for Washington Co Commissioners,,,,,,2073 Majestic Dr,,Canonsburg,PA,15317,G2023,,2023-07-28,2500.00,,G-2023 Co. Comm. Washington Co-AL PA,011,,,,Sherman,Nick,,,,,PA, ,,,,,,,,
SB29,C00688606,B851855,,,CCM,Friends of Martina White,,,,,,15019 Peyton St.,,Philadelphia,PA,19116,P2024,,2023-07-28,2500.00,,P-2024 State House 170 PA,011,,,,White,Martina,,,,H,PA,17,,,,,,,,
SB29,C00688606,B855083,,,CCM,Friends of Electra Janis,,,,,,PO Box 914,,McMurray,PA,15317,G2023,,2023-09-20,2500.00,,G-2023 Co. Bd. of Comm.  PA,011,,,,Janis,Electra,,,,,PA, ,,,,,,,,
SB29,C00688606,B855082,,,CCM,Friends of Kristin Marcell,,,,,,1111 Swamp Road,,Furlong,PA,18925,P2024,,2023-09-20,1000.00,,P-2024 State House 178 PA,011,,,,Marcell,Kristin,,,,H,PA,17,,,,,,,,
SB29,C00688606,B859382,,,PTY,House Republican Campaign Cmte,,,,,,P.O. Box 11787,,Harrisburg,PA,17108,O2023,Not Applicable,2023-11-13,5000.00,,State Party Cmte,011,,,,,,,,,,, ,,,,,,,,
SB29,C00688606,B861533,,,CCM,Committee to Elect Judge Stephanie Abraham,,,,,,PO Box 11257,,Charleston,WV,25339,P2024,,2023-12-07,2800.00,,P-2024 Judge  WV,011,,,,Abraham,Stephanie,,,,,WV, ,,,,,,,,
SB29,C00688606,B862881,,,CCM,Committee to Elect JB McCuskey,,,,,,PO Box 11359,,Charleston,WV,25361,P2024,,2023-12-20,2800.00,,P-2024 State Att. General  WV,011,,,,McCuskey,John,B,,,,WV, ,,,,,,,,
