form_type,filer_committee_id_number,transaction_id_number,back_reference_tran_id_number,back_reference_sched_name,entity_type,payee_organization_name,payee_last_name,payee_first_name,payee_middle_name,payee_prefix,payee_suffix,payee_street_1,payee_street_2,payee_city,payee_state,payee_zip_code,election_code,election_other_description,expenditure_date,expenditure_amount,semi_annual_refunded_bundled_amt,expenditure_purpose_descrip,category_code,beneficiary_committee_fec_id,beneficiary_committee_name,beneficiary_candidate_fec_id,beneficiary_candidate_last_name,beneficiary_candidate_first_name,beneficiary_candidate_middle_name,beneficiary_candidate_prefix,beneficiary_candidate_suffix,beneficiary_candidate_office,beneficiary_candidate_state,beneficiary_candidate_district,conduit_name,conduit_street_1,conduit_street_2,conduit_city,conduit_state,conduit_zip_code,memo_code,memo_text_description,reference_to_si_or_sl_system_code_that_identifies_the_account
SB23,C00306449,11887579,,,CCM,Richard E Neal For Congress Committee,,,,,,76 Magnolia Terrace,,Springfield,MA,01108,P2024,,2024-07-11,1000.00,0.00,Contribution to Federal Candidate,011,C00226522,Richard E Neal For Congress Committee,H8MA02041,Neal,Richard,,Rep.,,H,MA,01,,,,,,,,Contribution to Federal Candidate
SB23,C00306449,11887581,,,CCM,Lori Trahan For Congress Committee,,,,,,PO Box 1161,,Lowell,MA,01853,P2024,,2024-07-11,1000.00,0.00,Contribution to Federal Candidate,011,C00655647,Lori Trahan For Congress Committee,H8MA03106,Trahan,Lori,,Rep.,,H,MA,03,,,,,,,,Contribution to Federal Candidate
SB23,C00306449,11887582,,,CCM,Caraveo For Congress,,,,,,PO Box 953,,Eastlake,CO,80614,G2024,,2024-07-11,1000.00,0.00,Contribution to Federal Candidate,011,C00787788,Caraveo For Congress,H2CO08020,Caraveo,Yadira,,Rep.,Dr.,H,CO,08,,,,,,,,Contribution to Federal Candidate
SB23,C00306449,11887584,,,CCM,Mike Thompson For Congress,,,,,,5445 Madison Avenue,,Sacramento,CA,95841,G2024,,2024-07-11,1500.00,0.00,Contribution to Federal Candidate,011,C00326363,Mike Thompson For Congress,H8CA01109,Thompson,Mike,,Rep.,,H,CA,04,,,,,,,,Contribution to Federal Candidate
SB23,C00306449,11887585,,,CCM,Debbie Dingell For Congress,,,,,,PO Box 972480,,Ypsilanti,MI,48197,P2024,,2024-07-11,1000.00,0.00,Contribution to Federal Candidate,011,C00558213,Debbie Dingell For Congress,H4MI12079,Dingell,Debbie,,Rep.,,H,MI,06,,,,,,,,Contribution to Federal Candidate
SB23,C00306449,11887673,,,PAC,Continuing America's Strength and Security PAC,,,,,,"2308 Mount Vernon Ave., #707",,Alexandria,VA,22301,,,2024-07-11,1000.00,0.00,Contribution to Federal PACS/Committees,011,C00480228,,,,,,,,,,,,,,,,,,Contribution to Federal PACS/Committees
SB23,C00306449,11916241,,,CCM,Onder For Congress,,,,,,"101 West Argonne Drive, #265",,Kirkwood,MO,63122,P2024,,2024-07-16,1000.00,0.00,Contribution to Federal Candidate,011,C00870238,Onder For Congress,H4MO03221,Onder,Bob,,Sen.,,H,MO,03,,,,,,,,Contribution to Federal Candidate
