form_type,filer_committee_id_number,transaction_id_number,back_reference_tran_id_number,back_reference_sched_name,entity_type,payee_organization_name,payee_last_name,payee_first_name,payee_middle_name,payee_prefix,payee_suffix,payee_street_1,payee_street_2,payee_city,payee_state,payee_zip_code,election_code,election_other_description,expenditure_date,expenditure_amount,semi_annual_refunded_bundled_amt,expenditure_purpose_descrip,category_code,beneficiary_committee_fec_id,beneficiary_committee_name,beneficiary_candidate_fec_id,beneficiary_candidate_last_name,beneficiary_candidate_first_name,beneficiary_candidate_middle_name,beneficiary_candidate_prefix,beneficiary_candidate_suffix,beneficiary_candidate_office,beneficiary_candidate_state,beneficiary_candidate_district,conduit_name,conduit_street_1,conduit_street_2,conduit_city,conduit_state,conduit_zip_code,memo_code,memo_text_description,reference_to_si_or_sl_system_code_that_identifies_the_account
SB23,C00268904,B57EABAB61FAD42B885A,,,CCM,Jason Smith for Congress,,,,,,PO Box 1324,,Cape Girardeau,MO,637021324,P2024,,2023-03-13,5000.00,,Contribution to Committee,,C00541862,Jason Smith for Congress,H4MO08162,Smith,Jason,,Rep.,,H,MO,08,,,,,,,,,
SB23,C00268904,B28CDF81B06D24AC2955,,,CCM,Roger Williams for US Congress Committee,,,,,,10 N. CADDO ST.,PMB #174,Cleburne,TX,760315540,P2024,,2023-03-13,2000.00,,Contribution to Committee,,C00498121 ,Roger Williams for US Congress Committee,H2TX33040,Williams,Roger,,Rep.,,H,TX,25,,,,,,,,,
SB23,C00268904,BF722FF11EBF9459AA87,,,CCM,JAKE ELLZEY FOR CONGRESS,,,,,,"1005 CONGRESS AVENUE, SUITE 400",,Austin,TX,787041726,P2024,,2023-03-13,2000.00,,Contribution to Committee,,C00770438,JAKE ELLZEY FOR CONGRESS,H8TX06266,Ellzey,Jake,,Rep.,,H,TX,06,,,,,,,,,
SB23,C00268904,B367C8A951A6544A6A7B,,,CCM,PETE AGUILAR FOR CONGRESS,,,,,,PO BOX 10954,,San Bernardino,CA,924230954,P2024,,2023-03-13,5000.00,,Contribution to Committee,,C00510461,PETE AGUILAR FOR CONGRESS,H2CA31125,Aguilar,Pete,,Rep.,,H,CA,33,,,,,,,,,
SB23,C00268904,B38254EF0B8354A29819,,,CCM,TEXANS FOR HENRY CUELLAR CONGRESSIONAL CAMPAIGN,,,,,,1519 WASHINGTON STREET,SUITE 200,Laredo,TX,780404412,P2024,,2023-03-13,5000.00,,Contribution to Committee,,C00371302,TEXANS FOR HENRY CUELLAR CONGRESSIONAL CAMPAIGN,H2TX23082,Cuellar,Henry,,Rep.,,H,TX,28,,,,,,,,,
