form_type,filer_committee_id_number,transaction_id_number,back_reference_tran_id_number,back_reference_sched_name,entity_type,payee_organization_name,payee_last_name,payee_first_name,payee_middle_name,payee_prefix,payee_suffix,payee_street_1,payee_street_2,payee_city,payee_state,payee_zip_code,election_code,election_other_description,expenditure_date,expenditure_amount,semi_annual_refunded_bundled_amt,expenditure_purpose_descrip,category_code,beneficiary_committee_fec_id,beneficiary_committee_name,beneficiary_candidate_fec_id,beneficiary_candidate_last_name,beneficiary_candidate_first_name,beneficiary_candidate_middle_name,beneficiary_candidate_prefix,beneficiary_candidate_suffix,beneficiary_candidate_office,beneficiary_candidate_state,beneficiary_candidate_district,conduit_name,conduit_street_1,conduit_street_2,conduit_city,conduit_state,conduit_zip_code,memo_code,memo_text_description,reference_to_si_or_sl_system_code_that_identifies_the_account
SB29,C00488387,500139049,,,IND,,Dickstein Sudolsky,Marcia,,,,445 Park Ave,,New York,NY,100222606,,,2023-11-01,6250.00,0.00,Non Contribution Account PAC Administrative Services,,,,,,,,,,,,,,,,,,,,
SB29,C00488387,500139026,,,IND,,Dickstein Sudolsky,Marcia,,,,445 Park Ave,,New York,NY,100222606,,,2023-11-07,37.50,0.00,Non Contribution Account PAC Reimbursement - See Below if Itemized,,,,,,,,,,,,,,,,,,,,
SB29,C00488387,500139027,500139026,SB29,IND,,Sudolsky,Brian,,,,131 E 93Rd St,Apt 1CD,New York,NY,101281606,,,2023-11-07,37.50,0.00,Non Contribution Account PAC Event Staffing,,,,,,,,,,,,,,,,,,,X,*
SB29,C00488387,500139050,,,IND,,Dickstein Sudolsky,Marcia,,,,445 Park Ave,,New York,NY,100222606,,,2023-11-10,6250.00,0.00,Non Contribution Account PAC Administrative Services,,,,,,,,,,,,,,,,,,,,
SB29,C00488387,500139028,,,IND,,Dickstein Sudolsky,Marcia,,,,445 Park Ave,,New York,NY,100222606,,,2023-11-20,255.00,0.00,Non Contribution Account PAC Reimbursement - See Below if Itemized,,,,,,,,,,,,,,,,,,,,
SB29,C00488387,500139056,,,ORG,"Political Compliance Management Services, LLC",,,,,,910 17Th St NW Ste 925,,Washington,DC,200062641,,,2023-11-07,501.26,0.00,Non Contribution Account PAC Accounting Services,,,,,,,,,,,,,,,,,,,,
SB29,C00488387,500139046,,,IND,,Stanton,James,,,,235 E 22Nd St,# 15HI,New York,NY,100104616,,,2023-11-14,150.00,0.00,Non Contribution Account PAC Graphic Design,,,,,,,,,,,,,,,,,,,,
