form_type,filer_committee_id_number,transaction_id_number,back_reference_tran_id_number,back_reference_sched_name,entity_type,payee_organization_name,payee_last_name,payee_first_name,payee_middle_name,payee_prefix,payee_suffix,payee_street_1,payee_street_2,payee_city,payee_state,payee_zip_code,election_code,election_other_description,expenditure_date,expenditure_amount,semi_annual_refunded_bundled_amt,expenditure_purpose_descrip,category_code,beneficiary_committee_fec_id,beneficiary_committee_name,beneficiary_candidate_fec_id,beneficiary_candidate_last_name,beneficiary_candidate_first_name,beneficiary_candidate_middle_name,beneficiary_candidate_prefix,beneficiary_candidate_suffix,beneficiary_candidate_office,beneficiary_candidate_state,beneficiary_candidate_district,conduit_name,conduit_street_1,conduit_street_2,conduit_city,conduit_state,conduit_zip_code,memo_code,memo_text_description,reference_to_si_or_sl_system_code_that_identifies_the_account
SB23,C00188177,3EBB2194BF74AED55B6,,,PAC,Blue Dog Political Action Committee,,,,,,PO Box 83142,,Gaithersburg,MD,20883,O2024,Contribution,2024-03-04,5000.00,,2024 Contribution,011,C00305318,Blue Dog Political Action Committee,,,,,,,,,,,,,,,,,
SB23,C00188177,67B21F7DE54F24997DF,,,PAC,CHC BOLD PAC,,,,,,PO Box 33079,,Washington,DC,20033,O2024,Contribution,2024-03-04,5000.00,,2024 Contribution,011,C00365536,CHC BOLD PAC,,,,,,,,,,,,,,,,,
SB23,C00188177,F39AD6F7801AAD8A84D,,,CCM,Clarke For Congress,,,,,,PO Box 250200,,Brooklyn,NY,11225,P2024,,2024-03-28,1500.00,,2024 Primary,011,C00415331,,H4NY11138,Clarke,Yvette,Diana,,,H,NY,09,,,,,,,,
SB23,C00188177,21A8EF65A0C177540F5,,,PAC,Congressional Black Caucus PAC,,,,,,413 New Jersey Ave SE,,Washington,DC,20003,O2024,Contribution,2024-03-04,5000.00,,2024 Contribution,011,C00147512,Congressional Black Caucus PAC,,,,,,,,,,,,,,,,,
SB23,C00188177,0C651CAE31E346C94D5,,,PAC,Equality PAC,,,,,,PO Box 15337,,Washington,DC,20003,O2024,Contribution,2024-03-04,2500.00,,2024 Contribution,011,C00550970,Equality PAC,,,,,,,,,,,,,,,,,
SB23,C00188177,4B8099B2D7459F2A846,,,CCM,Friends Of Dusty Johnson,,,,,,PO Box 278,,Mitchell,SD,57301,P2024,,2024-03-28,2000.00,,2024 Primary,011,C00628917,,H8SD01055,Johnson,Dusty,,,,H,SD,01,,,,,,,,
SB23,C00188177,3F17996800610B14046,,,PAC,Generation Go Leadership PAC,,,,,,600 Pennsylvania Ave SE,Unit 15180,Washington,DC,20003,O2024,Contribution,2024-03-28,3500.00,,2024 Contribution,011,C00683250,Generation Go Leadership PAC,,,,,,,,,,,,,,,,,
SB23,C00188177,A37A6E9B8FA08DEF5E5,,,PAC,Giving Willingly Empowering Nationally PAC,,,,,,PO Box 33079,,Washington,DC,20033,O2024,Contribution,2024-03-28,2500.00,,2024 Contribution,011,C00431478,Giving Willingly Empowering Nationally PAC,,,,,,,,,,,,,,,,,
SB23,C00188177,F522E3CA761EB524BBC,,,CCM,Hern For Congress,,,,,,9521B Riverside Pkwy,# 350,Tulsa,OK,74137,P2024,,2024-03-28,2000.00,,2024 Primary,011,C00636092,,H8OK01157,Hern,Kevin,R.,,,H,OK,01,,,,,,,,
SB23,C00188177,2B5DD562972B178DE8D,,,PAC,Johnson Leadership Fund,,,,,,C/O 228 S. WASHINGTON ST.,STE. 115,ALEXANDRIA,VA,22314,O2024,Contribution,2024-03-04,10000.00,,2024 Contribution,011,C00771246,Johnson Leadership Fund,,,,,,,,,,,,,,,,,
SB23,C00188177,C6957AB8F9462C8EF91,,,PTY,NRCC,,,,,,320 1st St SE,,Washington,DC,20003,O2024,Contribution,2024-03-04,10000.00,,Funds allocated from contribution to Johnson Leadership Fund C00771246,011,C00075820,NRCC,,,,,,,,,,,,,,,,X,
SB23,C00188177,E731C1CEDAFD1AB944B,,,CCM,"Lawler For Congress, Inc.",,,,,,PO Box 87,,South Salem,NY,10590,P2024,,2024-03-04,2500.00,,2024 Primary,011,C00815415,,H2NY17162,Lawler,Michael,V.,,,H,NY,17,,,,,,,,
SB23,C00188177,8474932A9D03DA32173,,,CCM,Marc Veasey Congressional Campaign Committee,,,,,,PO Box 50084,,Fort Worth,TX,76105,P2024,,2024-03-02,1000.00,,2024 Primary,011,C00506832,,H2TX33073,Veasey,Marc,A.,,,H,TX,33,,,,,,,,
SB23,C00188177,DA01F53899B3EFC8E09,,,PAC,New Democrat Coalition Action Fund,,,,,,600 Pennsylvania Ave SE,Ste 410,Washington,DC,20003,O2024,Contribution,2024-03-04,5000.00,,2024 Contribution,011,C00409730,New Democrat Coalition Action Fund,,,,,,,,,,,,,,,,,
SB23,C00188177,76A76182EDC4057AEB3,,,PAC,Republican Governance Group/Tuesday Group PAC,,,,,,610 S Boulevard,,Tampa,FL,33606,O2024,Contribution,2024-03-04,5000.00,,2024 Contribution,011,C00433060,Republican Governance Group/Tuesday Group PAC,,,,,,,,,,,,,,,,,
SB23,C00188177,F163B80A30141CEC6D6,,,PAC,Republican Mainstreet Partnership PAC,,,,,,411 1st St SE,,Washington,DC,20003,O2024,Contribution,2024-03-04,5000.00,,2024 Contribution,011,C00165159,Republican Mainstreet Partnership PAC,,,,,,,,,,,,,,,,,
SB23,C00188177,9D751538680C9540724,,,CCM,Robin Kelly For Congress,,,,,,PO Box 101199,,Chicago,IL,60610,P2024,,2024-03-04,1500.00,,2024 Primary,011,C00539866,,H2IL02172,Kelly,Robin,Lynne,,,H,IL,02,,,,,,,,
SB23,C00188177,D739D1EA074E69AEDE6,,,PAC,Scalise Leadership Fund 2024,,,,,,320 1st St SE,,Washington,DC,20003,O2024,Contribution,2024-03-04,2500.00,,2024 Contribution,011,C00857144,Scalise Leadership Fund 2024,,,,,,,,,,,,,,,,,
SB23,C00188177,5BBDBF6577881CFADF9,,,PTY,NRCC,,,,,,320 1st St SE,,Washington,DC,20003,O2024,Contribution,2024-03-04,1250.00,,Funds allocated from contribution to Scalise Leadership Fund 2024 C00857144,011,C00075820,NRCC,,,,,,,,,,,,,,,,X,
SB23,C00188177,8C9723814AB35DA0EC9,,,PAC,The Eye Of The Tiger Political Action Committee,,,,,,PO Box 9891,,Arlington,VA,222190485,O2024,Contribution,2024-03-04,1250.00,,Funds allocated from contribution to Scalise Leadership Fund 2024 C00857144,011,C00467431,The Eye Of The Tiger Political Action Committee,,,,,,,,,,,,,,,,X,
SB23,C00188177,B39FEB64937F92F2A9C,,,PAC,Team Hill,,,,,,PO Box 7244,,Little Rock,AR,72217,O2024,Contribution,2024-03-28,1002.00,,2024 Contribution,011,C00773903,Team Hill,,,,,,,,,,,,,,,,,
SB23,C00188177,589ABBBD463CF1A4ADF,,,CCM,French Hill For Arkansas,,,,,,PO Box 7841,,Little Rock,AR,72217,G2024,,2024-03-28,1002.00,,Funds allocated from contribution to Team Hill C00773903,011,C00551275,,H4AR02141,Hill,J. French,,,,H,AR,02,,,,,,,X,
SB23,C00188177,VD8A7351E6FE7F187E65,,,ORG,The Oorbeek Memmott Group,,,,,,3905 N Dumbarton St,,Arlington,VA,22207,P2024,,2024-03-07,750.00,,In-Kind: Fundraising Event Expenses,011,C00551275,French Hill For Arkansas,H4AR02141,Hill,J. French,,,,H,AR,02,,,,,,,,In-Kind
