form_type,filer_committee_id_number,transaction_id_number,back_reference_tran_id_number,back_reference_sched_name,entity_type,payee_organization_name,payee_last_name,payee_first_name,payee_middle_name,payee_prefix,payee_suffix,payee_street_1,payee_street_2,payee_city,payee_state,payee_zip_code,election_code,election_other_description,expenditure_date,expenditure_amount,semi_annual_refunded_bundled_amt,expenditure_purpose_descrip,category_code,beneficiary_committee_fec_id,beneficiary_committee_name,beneficiary_candidate_fec_id,beneficiary_candidate_last_name,beneficiary_candidate_first_name,beneficiary_candidate_middle_name,beneficiary_candidate_prefix,beneficiary_candidate_suffix,beneficiary_candidate_office,beneficiary_candidate_state,beneficiary_candidate_district,conduit_name,conduit_street_1,conduit_street_2,conduit_city,conduit_state,conduit_zip_code,memo_code,memo_text_description,reference_to_si_or_sl_system_code_that_identifies_the_account
SB29,C00525055,18351787,,,COM,Josh Kassmier for Senate,,,,,,PO Box 876,,Fort Benton,MT,59442,,,2024-09-05,200.00,0.00,"Joshua Kassmier, STATE SENATE 13th MT",011,,,,Kassmier,Joshua,,MT Rep.,,,,,,,,,,,,"Joshua Kassmier, STATE SENATE 13th MT"
SB29,C00525055,18351788,,,COM,Gary Parry for HD 35,,,,,,PO Box 455,,Colstrip,MT,59323,,,2024-09-05,100.00,0.00,"Gary Parry, STATE HOUSE 35th MT",011,,,,Parry,Gary,W.,MT Rep.,,,,,,,,,,,,"Gary Parry, STATE HOUSE 35th MT"
SB29,C00525055,18351789,,,COM,Schillinger for Legislature,,,,,,PO Box 147,,Circle,MT,59215,,,2024-09-05,100.00,0.00,"Jerry Schillinger, STATE HOUSE 34th MT",011,,,,Schillinger,Jerry,L.,MT Rep.,,,,,,,,,,,,"Jerry Schillinger, STATE HOUSE 34th MT"
SB29,C00525055,18352894,,,COM,Thiel for Richland,,,,,,120 E Main St,,Sidney,MT,59270,,,2024-09-10,100.00,0.00,"Morgan Thiel, STATE HOUSE 30th MT",011,,,,Thiel,Morgan,,Ms.,,,,,,,,,,,,"Morgan Thiel, STATE HOUSE 30th MT"
SB29,C00525055,18395532,,,COM,Duey for Senate,,,,,,2428 Covered Bridge Road,,Saukville,WI,53080,,,2024-09-20,500.00,0.00,"Duey Stroebel, STATE SENATE 8th WI",011,,,,Stroebel,Duey,,WI Sen.,,,,,,,,,,,,"Duey Stroebel, STATE SENATE 8th WI"
SB29,C00525055,18395533,,,COM,Friends of Julian Bradley,,,,,,PO Box 320641,,Franklin,WI,53132,,,2024-09-20,500.00,0.00,"Marc Bradley, STATE SENATE 28th WI",011,,,,Bradley,Marc,Julian,WI Sen.,,,,,,,,,,,,"Marc Bradley, STATE SENATE 28th WI"
SB29,C00525055,18398222,,,COM,ND Oil PAC,,,,,,PO Box 1395,,Bismarck,ND,58502,,,2024-09-27,200.00,0.00,Contribution,011,,,,,,,,,,,,,,,,,,,Contribution
