form_type,filer_committee_id_number,transaction_id_number,back_reference_tran_id_number,back_reference_sched_name,entity_type,payee_organization_name,payee_last_name,payee_first_name,payee_middle_name,payee_prefix,payee_suffix,payee_street_1,payee_street_2,payee_city,payee_state,payee_zip_code,election_code,election_other_description,expenditure_date,expenditure_amount,semi_annual_refunded_bundled_amt,expenditure_purpose_descrip,category_code,beneficiary_committee_fec_id,beneficiary_committee_name,beneficiary_candidate_fec_id,beneficiary_candidate_last_name,beneficiary_candidate_first_name,beneficiary_candidate_middle_name,beneficiary_candidate_prefix,beneficiary_candidate_suffix,beneficiary_candidate_office,beneficiary_candidate_state,beneficiary_candidate_district,conduit_name,conduit_street_1,conduit_street_2,conduit_city,conduit_state,conduit_zip_code,memo_code,memo_text_description,reference_to_si_or_sl_system_code_that_identifies_the_account
SB29,C00693390,SB29.5529,,,CCM,Committee to Elect Kristin Alfheim (WI 0106506),,,,,,PO Box 644,,Appleton,WI,549120644,,,2024-09-07,1000.00,,Non Federal Political Contribution,011,,,,,,,,,,,,,,,,,,,
SB29,C00693390,SB29.5533,,,CCM,Friends of Eric Wimberger (WI 0105594),,,,,,311 South Jefferson Street,,Green Bay,WI,54301,,,2024-09-07,1000.00,,non-federal political contribution,011,,,,,,,,,,,,,,,,,,,
SB29,C00693390,SB29.5535,,,CCM,Friends of Julian Bradley (WI 0104858),,,,,,PO Box 320641,,Franklin,WI,53132,,,2024-09-07,1000.00,,non federal policital contribution,011,,,,,,,,,,,,,,,,,,,
SB29,C00693390,SB29.5537,,,CCM,Kaufert for Assembly (WI 0102571),,,,,,1360 Alpine Lane,,Neenah,WI,54956,,,2024-09-07,1000.00,,non federal political contribution,011,,,,,,,,,,,,,,,,,,,
SB29,C00693390,SB29.5532,,,CCM,Testin for Senate (WI 0105360),,,,,,5369 Fairview Dr,,Stevens Point,WI,54482,,,2024-09-07,1000.00,,non-federal political contribution,011,,,,,,,,,,,,,,,,,,,
SB29,C00693390,SB29.5540,,,CCM,Zimmerman for Wisconsin (WI 0105714),,,,,,429 Jefferson St,,River Falls,WI,54022,,,2024-09-07,1000.00,,non federal political contribution,011,,,,,,,,,,,,,,,,,,,
