form_type,filer_committee_id_number,transaction_id_number,back_reference_tran_id_number,back_reference_sched_name,entity_type,payee_organization_name,payee_last_name,payee_first_name,payee_middle_name,payee_prefix,payee_suffix,payee_street_1,payee_street_2,payee_city,payee_state,payee_zip_code,election_code,election_other_description,expenditure_date,expenditure_amount,semi_annual_refunded_bundled_amt,expenditure_purpose_descrip,category_code,beneficiary_committee_fec_id,beneficiary_committee_name,beneficiary_candidate_fec_id,beneficiary_candidate_last_name,beneficiary_candidate_first_name,beneficiary_candidate_middle_name,beneficiary_candidate_prefix,beneficiary_candidate_suffix,beneficiary_candidate_office,beneficiary_candidate_state,beneficiary_candidate_district,conduit_name,conduit_street_1,conduit_street_2,conduit_city,conduit_state,conduit_zip_code,memo_code,memo_text_description,reference_to_si_or_sl_system_code_that_identifies_the_account
SB29,C00363879,4680530,,,COM,Friends of Cameron Henry,,,,,,P.O. Box 55399,,Metairie,LA,70055,,,2024-08-19,4000.00,0.00,"Cameron Henry, STATE SENATE 9th LA",011,,,,Henry,Cameron,,,,,,,,,,,,,,"Cameron Henry, STATE SENATE 9th LA"
SB29,C00363879,4680719,,,COM,Dustin Burrows Campaign,,,,,,P.O. Box 2569,,Lubbock,TX,79408,,,2024-08-26,2000.00,0.00,"Dustin Burrows, STATE HOUSE 83rd TX",011,,,,Burrows,Dustin,,TX Rep.,,,,,,,,,,,,"Dustin Burrows, STATE HOUSE 83rd TX"
SB29,C00363879,4680722,,,COM,Matthew Willard Campaign,,,,,,4701 St. Roch Ave,,New Orleans,LA,70122,,,2024-08-27,500.00,0.00,"Matthew Willard, STATE HOUSE  LA",011,,,,Willard,Matthew,,,,,,,,,,,,,,"Matthew Willard, STATE HOUSE  LA"
SB29,C00363879,4680723,,,COM,Chris Turner Campaign,,,,,,PO Box 825,,Ruston,LA,71273,,,2024-08-27,1000.00,0.00,"Chris Turner, STATE HOUSE 12th LA",011,,,,Turner,Chris,,,,,,,,,,,,,,"Chris Turner, STATE HOUSE 12th LA"
SB29,C00363879,4681278,,,ORG,Black Pearl Catering Co. L.L.C.,,,,,,8132 Hampson Street,,New Orleans,LA,70118,,,2024-08-27,535.50,0.00,,011,,,,,,,,,,,,,,,,,,,
SB29,C00363879,4681284,,,COM,Cameron PAC,,,,,,P.O. Box 23173,,Jefferson,LA,70183,,,2024-08-29,5000.00,0.00,,011,,,,,,,,,,,,,,,,,,,
SB29,C00363879,4681286,,,COM,Texans for Charles Schwertner,,,,,,P.O. Box 2448,,Georgetown,TX,78627,,,2024-08-29,10000.00,0.00,"Charles Schwertner, STATE SENATE 20th TX",011,,,,Schwertner,Charles,,Dr.,,,,,,,,,,,,"Charles Schwertner, STATE SENATE 20th TX"
