form_type,filer_committee_id_number,transaction_id_number,back_reference_tran_id_number,back_reference_sched_name,entity_type,payee_organization_name,payee_last_name,payee_first_name,payee_middle_name,payee_prefix,payee_suffix,payee_street_1,payee_street_2,payee_city,payee_state,payee_zip_code,election_code,election_other_description,expenditure_date,expenditure_amount,semi_annual_refunded_bundled_amt,expenditure_purpose_descrip,category_code,beneficiary_committee_fec_id,beneficiary_committee_name,beneficiary_candidate_fec_id,beneficiary_candidate_last_name,beneficiary_candidate_first_name,beneficiary_candidate_middle_name,beneficiary_candidate_prefix,beneficiary_candidate_suffix,beneficiary_candidate_office,beneficiary_candidate_state,beneficiary_candidate_district,conduit_name,conduit_street_1,conduit_street_2,conduit_city,conduit_state,conduit_zip_code,memo_code,memo_text_description,reference_to_si_or_sl_system_code_that_identifies_the_account
SB23,C00333534,B193BEB182335474C951,,,PTY,MN House Republican Campaign Committee,,,,,,PO Box 17400,,Saint Paul,MN,551170400,O2024,Other,2024-12-05,500.00,,Contribution to Committee,,C00487678,MN House Republican Campaign Committee,,,,,,,,,,,,,,,,,,
SB23,C00333534,B459B1C83C9F94DA59B6,,,PTY,Minnesota DFL Senate Caucus,,,,,,PO Box 7307,,Saint Paul,MN,551070307,O2024,Other,2024-12-05,500.00,,Contribution to Committee,,C00380352,Minnesota DFL Senate Caucus,,,,,,,,,,,,,,,,,,
SB23,C00333534,B977AD046B75E465989E,,,PTY,MN House Republican Campaign Committee,,,,,,PO Box 17400,,Saint Paul,MN,551170400,O2024,Other,2024-12-05,1000.00,,Contribution to Committee,,C00487678,MN House Republican Campaign Committee,,,,,,,,,,,,,,,,,,
SB23,C00333534,B2396DD25CA9F435BBC7,,,PAC,MN Senate Victory PAC,,,,,,161 St. Anthony Ave.,Suite 902,Saint Paul,MN,551032459,O2024,Other,2024-12-05,500.00,,Contribution to Committee,,C00506410,MN Senate Victory PAC,,,,,,,,,,,,,,,,,,
SB23,C00333534,B1FBC4062F7574C6582B,,,PAC,Minnesota House DFL Caucus,,,,,,255 East Plato Blvd.,,Saint Paul,MN,55107,O2024,Other,2024-12-05,500.00,,Contribution to Committee,,C00361139,Minnesota House DFL Caucus,,,,,,,,,,,,,,,,,,
SB23,C00333534,B0C81C852D18F475D918,,,PAC,MN Senate Victory PAC,,,,,,161 St. Anthony Ave.,Suite 902,Saint Paul,MN,551032459,O2024,Other,2024-12-05,1000.00,,Contribution to Committee,,C00506410,MN Senate Victory PAC,,,,,,,,,,,,,,,,,,
