form_type,filer_committee_id_number,transaction_id_number,back_reference_tran_id_number,back_reference_sched_name,entity_type,payee_organization_name,payee_last_name,payee_first_name,payee_middle_name,payee_prefix,payee_suffix,payee_street_1,payee_street_2,payee_city,payee_state,payee_zip_code,election_code,election_other_description,expenditure_date,expenditure_amount,semi_annual_refunded_bundled_amt,expenditure_purpose_descrip,category_code,beneficiary_committee_fec_id,beneficiary_committee_name,beneficiary_candidate_fec_id,beneficiary_candidate_last_name,beneficiary_candidate_first_name,beneficiary_candidate_middle_name,beneficiary_candidate_prefix,beneficiary_candidate_suffix,beneficiary_candidate_office,beneficiary_candidate_state,beneficiary_candidate_district,conduit_name,conduit_street_1,conduit_street_2,conduit_city,conduit_state,conduit_zip_code,memo_code,memo_text_description,reference_to_si_or_sl_system_code_that_identifies_the_account
SB23,C00796862,SB23.4262,,,PAC,ALAMO PAC,,,,,,919 CONGRESS AVE,SUITE 1400,AUSTIN,TX,78701,O2023,,2023-11-16,5000.00,,Contribution,011,C00387464,ALAMO PAC,,,,,,,,,,,,,,,,,
SB23,C00796862,SB23.4282,,,CCM,BETH VAN DUYNE FOR CONGRESS,,,,,,PO BOX 630167,,IRVING,TX,75063,P2024,,2023-11-16,2500.00,,Contribution,011,C00714865,BETH VAN DUYNE FOR CONGRESS,,,,,,,H,TX,24,,,,,,,,
SB23,C00796862,SB23.4268,,,CCM,CATHERINE CORTEZ MASTO FOR SENATE,,,,,,600 PENNSYLVANIA AVE SE,#15180,WASHINGTON,DC,20003,P2028,,2023-11-16,1500.00,,Contribution,011,C00575548,CATHERINE CORTEZ MASTO FOR SENATE,,,,,,,S,NV,00,,,,,,,,
SB23,C00796862,SB23.4264,,,CCM,KATHERINE CLARK FOR CONGRESS,,,,,,600 PENNSYLVANIA AVE SE #15180,,WASHINGTON,DC,20003,P2024,,2023-11-16,1500.00,,Contribution,011,C00541888,KATHERINE CLARK FOR CONGRESS,,,,,,,H,MA,05,,,,,,,,
SB23,C00796862,SB23.4277,,,CCM,LISA BLUNT ROCHESTER FOR SENATE,,,,,,P.O. BOX 9767,,WILMINGTON,DE,19809,P2024,,2023-11-16,1500.00,,Contribution,011,C00843391,LISA BLUNT ROCHESTER FOR SENATE,,,,,,,S,DE,00,,,,,,,,
SB23,C00796862,SB23.4267,,,CCM,MIKE KELLY FOR CONGRESS,,,,,,PO BOX 476,,LYNDORA,PA,16045,P2024,,2023-11-16,1500.00,,Contribution,011,C00474189,MIKE KELLY FOR CONGRESS,,,,,,,H,PA,16,,,,,,,,
SB23,C00796862,SB23.4271,,,CCM,RICHARD E NEAL FOR CONGRESS COMMITTEE,,,,,,76 MAGNOLIA TERRACE,,SPRINGFIELD,MA,01108,P2024,,2023-11-16,1500.00,,Contribution,011,C00226522,RICHARD E NEAL FOR CONGRESS COMMITTEE,,,,,,,H,MA,01,,,,,,,,
SB23,C00796862,SB23.4279,,,CCM,TERRI SEWELL FOR CONGRESS,,,,,,PO BOX 1964,,BIRMINGHAM,AL,35201,P2024,,2023-11-16,1000.00,,Contribution,011,C00458976,TERRI SEWELL FOR CONGRESS,,,,,,,H,AL,07,,,,,,,,
