form_type,filer_committee_id_number,transaction_id_number,back_reference_tran_id_number,back_reference_sched_name,entity_type,payee_organization_name,payee_last_name,payee_first_name,payee_middle_name,payee_prefix,payee_suffix,payee_street_1,payee_street_2,payee_city,payee_state,payee_zip_code,election_code,election_other_description,expenditure_date,expenditure_amount,semi_annual_refunded_bundled_amt,expenditure_purpose_descrip,category_code,beneficiary_committee_fec_id,beneficiary_committee_name,beneficiary_candidate_fec_id,beneficiary_candidate_last_name,beneficiary_candidate_first_name,beneficiary_candidate_middle_name,beneficiary_candidate_prefix,beneficiary_candidate_suffix,beneficiary_candidate_office,beneficiary_candidate_state,beneficiary_candidate_district,conduit_name,conduit_street_1,conduit_street_2,conduit_city,conduit_state,conduit_zip_code,memo_code,memo_text_description,reference_to_si_or_sl_system_code_that_identifies_the_account
SB29,C00846683,SB29.4723,,,ORG,Louisiana Federation for Children PAC,,,,,,228 S Washington St Ste 115,,Alexandria,VA,22314,,,2024-12-30,4000.00,,Nonfederal Contribution,,,,,,,,,,,,,,,,,,,,
SB29,C00846683,SB29.4725,,,ORG,Oklahoma Federation for Children Action Fund,,,,,,201 Robert S Kerr Ave,,Oklahoma City,OK,73102,,,2024-12-30,2500.00,,Nonfederal Contribution,,,,,,,,,,,,,,,,,,,,
SB29,C00846683,SB29.4726,,,ORG,Tennessee Federation for Children PAC,,,,,,10440 Little Patuxent Pkwy Ste. 30,,Columbia,MD,21044,,,2024-12-30,5000.00,,Nonfederal Contribution,,,,,,,,,,,,,,,,,,,,
SB29,C00846683,SB29.4722,,,ORG,Thomas Graphics Inc.,,,,,,PO Box 14226,,Austin,TX,78714,,,2024-12-12,19805.49,,Nonfederal IE-Mail,,,,,,,,,,,,,,,,,,,,
SB29,C00846683,SB29.4718,,,ORG,Victory Enterprises,,,,,,5200 30th St SW,,Davenport,IA,52802,,,2024-12-11,19897.71,,Nonfederal IE-Mail and Digital,,,,,,,,,,,,,,,,,,,,
