form_type,filer_committee_id_number,transaction_id_number,back_reference_tran_id_number,back_reference_sched_name,entity_type,payee_organization_name,payee_last_name,payee_first_name,payee_middle_name,payee_prefix,payee_suffix,payee_street_1,payee_street_2,payee_city,payee_state,payee_zip_code,election_code,election_other_description,expenditure_date,expenditure_amount,semi_annual_refunded_bundled_amt,expenditure_purpose_descrip,category_code,beneficiary_committee_fec_id,beneficiary_committee_name,beneficiary_candidate_fec_id,beneficiary_candidate_last_name,beneficiary_candidate_first_name,beneficiary_candidate_middle_name,beneficiary_candidate_prefix,beneficiary_candidate_suffix,beneficiary_candidate_office,beneficiary_candidate_state,beneficiary_candidate_district,conduit_name,conduit_street_1,conduit_street_2,conduit_city,conduit_state,conduit_zip_code,memo_code,memo_text_description,reference_to_si_or_sl_system_code_that_identifies_the_account
SB23,C00711549,23-00-00207-00207,,,PAC,Operation Saving Democracy,,,,,,PO Box 95,,Lexington,KY,40588,,,2023-12-27,74553.14,,Inkind: Payroll,,C00842575,Operation Saving Democracy,,,,,,,,,,,,,,,,,
SB23,C00711549,23-00-00211-00211,,,ORG,Democratic Majority Action PAC,,,,,,PO Box 95,,Lexington,KY,40588,,,2023-12-27,10710.17,,Inkind: Payroll,,,,,,,,,,,,,,,,,,,,
SB23,C00711549,23-00-00216-00216,,,ORG,Democratic Majority Action PAC,,,,,,PO Box 95,,Lexington,KY,40588,,,2023-12-28,31760.20,,"Inkind: Software, Rent, Overhead, Compliance and Fundraising Services",,,,,,,,,,,,,,,,,,,,
SB23,C00711549,23-00-00218-00218,,,PAC,Operation Saving Democracy,,,,,,PO Box 95,,Lexington,KY,40588,,,2023-12-28,164411.39,,"Inkind: Software, Rent, Overhead, Compliance and Fundraising Services",,C00842575,Operation Saving Democracy,,,,,,,,,,,,,,,,,
SB23,C00711549,23-00-00224-00224,,,PAC,American SOS Project PAC,,,,,,PO Box 95,,Lexington,KY,40588,,,2023-12-28,1200.00,,"Inkind: Software, Rent, Overhead, Compliance and Fundraising Services",,C00809095,American SOS Project PAC,,,,,,,,,,,,,,,,,
SB23,C00711549,23-02-01363-02147,,,ORG,Sarah Klee Hood for NY,,,,,,PO Box 415,,Syracuse,NY,13214,P2024,,2023-08-03,5000.00,,Contribution,,C00793950,Sarah Klee Hood for NY,H2NY24150,Klee Hood,Sarah,,,,H,NY,24,,,,,,,,
SB23,C00711549,23-02-01362-02146,,,CCM,Ehasz for Congress,,,,,,1800 Byberry Rd #1336,,Bensalem,PA,19020,P2024,,2023-08-03,5000.00,,Contribution,,C00791335,Ehasz for Congress,H2PA01099,Ehasz,Ashley,,,,H,PA,01,,,,,,,,
