form_type,filer_committee_id_number,transaction_id_number,back_reference_tran_id_number,back_reference_sched_name,entity_type,payee_organization_name,payee_last_name,payee_first_name,payee_middle_name,payee_prefix,payee_suffix,payee_street_1,payee_street_2,payee_city,payee_state,payee_zip_code,election_code,election_other_description,expenditure_date,expenditure_amount,semi_annual_refunded_bundled_amt,expenditure_purpose_descrip,category_code,beneficiary_committee_fec_id,beneficiary_committee_name,beneficiary_candidate_fec_id,beneficiary_candidate_last_name,beneficiary_candidate_first_name,beneficiary_candidate_middle_name,beneficiary_candidate_prefix,beneficiary_candidate_suffix,beneficiary_candidate_office,beneficiary_candidate_state,beneficiary_candidate_district,conduit_name,conduit_street_1,conduit_street_2,conduit_city,conduit_state,conduit_zip_code,memo_code,memo_text_description,reference_to_si_or_sl_system_code_that_identifies_the_account
SB23,C00080135,EB7012,,,COM,"Calvert for Congress Committee, Ken",,,,,,PO Box 2438,,Corona,CA,92878,G2024,,2024-09-04,2500.00,,Political Contribution,011,C00257337,"Calvert for Congress Committee, Ken",,Calvert,Ken,,,,H,CA,41,,,,,,,,
SB23,C00080135,EB7000,,,COM,Duarte Victory Fund,,,,,,4202 H Street,,Sacramento,CA,95819,G2024,,2024-08-15,2000.00,,Political Contribution,011,C00819573,Duarte Victory Fund,,Duarte,John,,,,H,CA,13,,,,,,,,
SB23,C00080135,EB7001,,,COM,Duarte Victory Fund,,,,,,4202 H Street,,Sacramento,CA,95819,G2024,,2024-08-15,1000.00,,Political Contribution,011,C00819573,Duarte Victory Fund,,Duarte,John,,,,H,CA,13,,,,,,,,
SB23,C00080135,EB6999,,,COM,"Fong for Congress, Vince",,,,,,"2201 Francisco Drive, Suite 140-18",,El Dorado Hills,CA,95762,G2024,,2024-07-15,3300.00,,Political Contribution,011,C00859892,"Fong for Congress, Vince",,Fong,Vince,,,,H,CA,20,,,,,,,,
SB23,C00080135,EB7239,,,CCM,"Harder for Congress, Josh",,,,,,P.O. Box 4220,,Manteca,CA,95337,G2024,,2024-09-15,2500.00,,Political Contribution,011,C00639146,"Harder for Congress, Josh",,Harder,Josh,,,,H,CA,10,,,,,,,,
SB23,C00080135,EB7086,,,COM,"Harris for Congress, Andy",,,,,,107 S West Street #176,,Alexandria,VA,22314,G2024,,2024-09-26,2500.00,,Political Contribution,011,C00435974,"Harris for Congress, Andy",,Harris,Andy,,,,H,MD,01,,,,,,,,
SB23,C00080135,EB7087,,,COM,"Panetta for Congress, Jimmy",,,,,,"412 First Street SE, Suite 100",,Washington,DC,20003,G2024,,2024-09-26,1500.00,,Political Contribution,011,C00592154,"Panetta for Congress, Jimmy",,Panetta,Jimmy,,,,H,CA,20,,,,,,,,
SB23,C00080135,EB6998,,,COM,Rural America Counts PAC,,,,,,"700 Pennsylvania Avenue SE, Suite ",,Washington,DC,20003,,,2024-07-08,1000.00,,Political Contribution,011,C00570770,Rural America Counts PAC,,PAC,Rural America Counts,,,,,,,,,,,,,,
