form_type,filer_committee_id_number,transaction_id_number,back_reference_tran_id_number,back_reference_sched_name,entity_type,payee_organization_name,payee_last_name,payee_first_name,payee_middle_name,payee_prefix,payee_suffix,payee_street_1,payee_street_2,payee_city,payee_state,payee_zip_code,election_code,election_other_description,expenditure_date,expenditure_amount,semi_annual_refunded_bundled_amt,expenditure_purpose_descrip,category_code,beneficiary_committee_fec_id,beneficiary_committee_name,beneficiary_candidate_fec_id,beneficiary_candidate_last_name,beneficiary_candidate_first_name,beneficiary_candidate_middle_name,beneficiary_candidate_prefix,beneficiary_candidate_suffix,beneficiary_candidate_office,beneficiary_candidate_state,beneficiary_candidate_district,conduit_name,conduit_street_1,conduit_street_2,conduit_city,conduit_state,conduit_zip_code,memo_code,memo_text_description,reference_to_si_or_sl_system_code_that_identifies_the_account
SB23,C00003764,18399183,,,CCM,Deb Fischer For US Senate,,,,,,"5555 South St, Ste. 200",,Lincoln,NE,68506,G2024,,2024-10-01,2500.00,0.00,,011,C00498907,Deb Fischer For US Senate,S2NE00094,Fischer,Deb,,Sen.,,S,NE,,,,,,,,,
SB23,C00003764,18399780,,,CCM,Hogan For Maryland Inc.,,,,,,2077 Somerville Road,Suite 206,Annapolis,MD,21401,G2024,,2024-10-02,2500.00,0.00,,011,C00869016,Hogan For Maryland Inc.,S4MD00483,Hogan,Larry,,Mr.,,S,MD,,,,,,,,,
SB23,C00003764,18404750,,,CCM,Lisa Blunt Rochester For Senate,,,,,,P.O. Box 9767,,Wilmington,DE,19809,G2024,,2024-10-15,5000.00,0.00,,011,C00843391,Lisa Blunt Rochester For Senate,S4DE00060,Blunt Rochester,Lisa,,Rep.,,S,DE,,,,,,,,,
SB23,C00003764,18404826,,,PAC,Tuesday Group Political Action Committee,,,,,,610 S. Boulevard,,Tampa,FL,33606,,,2024-10-15,-5000.00,0.00,Original contribution was made on 5/7/24,011,C00433060,,,,,,,,,,,,,,,,,,Original contribution was made on 5/7/24
SB23,C00003764,18404827,,,PAC,Tuesday Group Political Action Committee,,,,,,610 S. Boulevard,,Tampa,FL,33606,,,2024-10-15,5000.00,0.00,,011,C00433060,,,,,,,,,,,,,,,,,,
