form_type,filer_committee_id_number,transaction_id_number,back_reference_tran_id_number,back_reference_sched_name,entity_type,payee_organization_name,payee_last_name,payee_first_name,payee_middle_name,payee_prefix,payee_suffix,payee_street_1,payee_street_2,payee_city,payee_state,payee_zip_code,election_code,election_other_description,expenditure_date,expenditure_amount,semi_annual_refunded_bundled_amt,expenditure_purpose_descrip,category_code,beneficiary_committee_fec_id,beneficiary_committee_name,beneficiary_candidate_fec_id,beneficiary_candidate_last_name,beneficiary_candidate_first_name,beneficiary_candidate_middle_name,beneficiary_candidate_prefix,beneficiary_candidate_suffix,beneficiary_candidate_office,beneficiary_candidate_state,beneficiary_candidate_district,conduit_name,conduit_street_1,conduit_street_2,conduit_city,conduit_state,conduit_zip_code,memo_code,memo_text_description,reference_to_si_or_sl_system_code_that_identifies_the_account
SB23,C00785899,SB23.5766,,,CCM,Becca Balint for Vermont,,,,,,PO Box 291,,Burlington,VT,05402,G2024,,2024-06-27,3000.00,,Contribution,,C00797175,Becca Balint for Vermont,H2VT01076,Balint,Becca,,,,H,VT,01,,,,,,,,
SB23,C00785899,SB23.5767,,,CCM,Emily Randall for Congress,,,,,,PO Box 1883,,Port Orchard,WA,98366,P2024,,2024-06-17,3500.00,,Contribution,,C00857094,Emily Randall for Congress,H4WA06117,Randall,Emily,,,,H,WA,06,,,,,,,,
SB23,C00785899,SB23.5768,,,CCM,Emily Randall for Congress,,,,,,PO Box 1883,,Port Orchard,WA,98366,G2024,,2024-06-17,1500.00,,Contribution,,C00857094,Emily Randall for Congress,H4WA06117,Randall,Emily,,,,H,WA,06,,,,,,,,
SB23,C00785899,SB23.5765,,,CCM,Eric Sorensen for Illinois,,,,,,PO Box 1172,,Moline,IL,61265,G2024,,2024-06-24,3000.00,,Contribution,,C00793935,Eric Sorensen for Illinois,H2IL17147,Sorensen,Eric,,,,H,IL,17,,,,,,,,
SB23,C00785899,SB23.5769,,,CCM,Evan Low for Congress,,,,,,1700 Tribute Rd,Suite 201,Sacramento,CA,95815,G2024,,2024-06-17,5000.00,,Contribution,,C00858969,Evan Low for Congress,H4CA16239,Low,Evan,,,,H,CA,16,,,,,,,,
