form_type,filer_committee_id_number,transaction_id_number,back_reference_tran_id_number,back_reference_sched_name,entity_type,payee_organization_name,payee_last_name,payee_first_name,payee_middle_name,payee_prefix,payee_suffix,payee_street_1,payee_street_2,payee_city,payee_state,payee_zip_code,election_code,election_other_description,expenditure_date,expenditure_amount,semi_annual_refunded_bundled_amt,expenditure_purpose_descrip,category_code,beneficiary_committee_fec_id,beneficiary_committee_name,beneficiary_candidate_fec_id,beneficiary_candidate_last_name,beneficiary_candidate_first_name,beneficiary_candidate_middle_name,beneficiary_candidate_prefix,beneficiary_candidate_suffix,beneficiary_candidate_office,beneficiary_candidate_state,beneficiary_candidate_district,conduit_name,conduit_street_1,conduit_street_2,conduit_city,conduit_state,conduit_zip_code,memo_code,memo_text_description,reference_to_si_or_sl_system_code_that_identifies_the_account
SB29,C00002469,27198480,,,COM,"Pamela G Beidle, Senate President",,,,,,11 Bladen Street,,Annapolis,MD,21401,,,2024-01-05,2000.00,0.00,"Pamela Beidle, STATE SENATE 32nd MD",011,,,,Beidle,Pamela,,MD Sen.,,,,,,,,,,,,"Pamela Beidle, STATE SENATE 32nd MD"
SB29,C00002469,27199277,,,COM,"Adrienne Jones, Speaker of the House",,,,,,2 West Rolling Crossroads,,Catonsville,MD,21228,,,2024-01-08,3000.00,0.00,"Adrienne Jones, STATE HOUSE 10th MD",011,,,,Jones,Adrienne,,MD Del.,,,,,,,,,,,,"Adrienne Jones, STATE HOUSE 10th MD"
SB29,C00002469,27199278,,,COM,Del. Jared Solomon,,,,,,6 Bladen Street,,Annapolis,MD,21401,,,2024-01-08,2000.00,0.00,"Jared Solomon, STATE HOUSE 18th MD",011,,,,Solomon,Jared,,MD Del.,,,,,,,,,,,,"Jared Solomon, STATE HOUSE 18th MD"
SB29,C00002469,27199279,,,COM,"Bill Ferguson, MD Senate President",,,,,,101 N Haven Street,,Baltimore,MD,21224,,,2024-01-08,3000.00,0.00,"Bill Ferguson, STATE SENATE 46th MD",011,,,,Ferguson,Bill,,MD Sen.,,,,,,,,,,,,"Bill Ferguson, STATE SENATE 46th MD"
SB29,C00002469,27216856,,,ORG,Texas AFL-CIO,,,,,,1106 Lavaca St,#200,Austin,TX,78701,,,2024-01-23,5000.00,0.00,,011,,,,,,,,,,,,,,,,,,,
