form_type,filer_committee_id_number,transaction_id_number,back_reference_tran_id_number,back_reference_sched_name,entity_type,payee_organization_name,payee_last_name,payee_first_name,payee_middle_name,payee_prefix,payee_suffix,payee_street_1,payee_street_2,payee_city,payee_state,payee_zip_code,election_code,election_other_description,expenditure_date,expenditure_amount,semi_annual_refunded_bundled_amt,expenditure_purpose_descrip,category_code,beneficiary_committee_fec_id,beneficiary_committee_name,beneficiary_candidate_fec_id,beneficiary_candidate_last_name,beneficiary_candidate_first_name,beneficiary_candidate_middle_name,beneficiary_candidate_prefix,beneficiary_candidate_suffix,beneficiary_candidate_office,beneficiary_candidate_state,beneficiary_candidate_district,conduit_name,conduit_street_1,conduit_street_2,conduit_city,conduit_state,conduit_zip_code,memo_code,memo_text_description,reference_to_si_or_sl_system_code_that_identifies_the_account
SB23,C00017525,B58B39A31D67C4CC3990,,,PTY,DEMOCRATIC CONGRESSIONAL CAMPAIGN COMMITTEE,,,,,,430 S Capitol SE,,Washington,DC,200034024,O2024,Other,2024-03-21,5000.00,,Contribution to Committee,,c00000935,DEMOCRATIC CONGRESSIONAL CAMPAIGN COMMITTEE,,,,,,,,,,,,,,,,,,
SB23,C00017525,BEED42E4BD29548D3B87,,,PTY,DEMOCRATIC SENATORIAL CAMPAIGN COMMITTEE,,,,,,120 Maryland Ave,,Washington,DC,200025610,O2024,Other,2024-03-21,5000.00,,Contribution to Committee,,c00042366,DEMOCRATIC SENATORIAL CAMPAIGN COMMITTEE,,,,,,,,,,,,,,,,,,
SB23,C00017525,BA97DF23F4D4E4A1AA80,,,CCM,HUDSON FOR CONGRESS,,,,,,PO BOX 5053,,CONCORD,NC,280271500,P2024,,2024-03-14,1000.00,,Contribution to Committee,,C00504522,HUDSON FOR CONGRESS,H2NC08185,Hudson,Richard,,Rep.,,H,NC,09,,,,,,,,,
SB23,C00017525,B3CD006A55C2C4441882,,,PAC,I GOT YOUR BACK PAC,,,,,,122 C STREET NW,SUITE 360,WASHINGTON,DC,20001,O2024,Other,2024-03-21,5000.00,,Contribution to Committee,,C00633156,I GOT YOUR BACK PAC,,,,,,,,,,,,,,,,,,
SB23,C00017525,B9746AFA53C2D465A91E,,,PTY,National Republican Senatorial Committee,,,,,,425 2nd St NE,,Washington,DC,200024914,O2024,Other,2024-03-21,5000.00,,Contribution to Committee,,c00027466,National Republican Senatorial Committee,,,,,,,,,,,,,,,,,,
