form_type,filer_committee_id_number,transaction_id_number,back_reference_tran_id_number,back_reference_sched_name,entity_type,payee_organization_name,payee_last_name,payee_first_name,payee_middle_name,payee_prefix,payee_suffix,payee_street_1,payee_street_2,payee_city,payee_state,payee_zip_code,election_code,election_other_description,expenditure_date,expenditure_amount,semi_annual_refunded_bundled_amt,expenditure_purpose_descrip,category_code,beneficiary_committee_fec_id,beneficiary_committee_name,beneficiary_candidate_fec_id,beneficiary_candidate_last_name,beneficiary_candidate_first_name,beneficiary_candidate_middle_name,beneficiary_candidate_prefix,beneficiary_candidate_suffix,beneficiary_candidate_office,beneficiary_candidate_state,beneficiary_candidate_district,conduit_name,conduit_street_1,conduit_street_2,conduit_city,conduit_state,conduit_zip_code,memo_code,memo_text_description,reference_to_si_or_sl_system_code_that_identifies_the_account
SB21b,C00030718,BDADBAD5241E944C68C9,,,ORG,Wells Fargo Merchant Services,,,,,,1200 Montego,,Walnut Creek,CA,945982820,,,2024-10-16,937.38,,Merchant credit card fees,,,,,,,,,,,,,,,,,,,,,
SB21b,C00030718,B723E5C6F6E1F42C89AA,,,ORG,Meath Media Group,,,,,,4441 Klingle St NW,,Washington,DC,200163578,,,2024-10-04,-77230.00,,Trsfr to Line 24 (See memo text for detailed explanation),,,,,,,,,,,,,,,,,,,,,
SB21b,C00030718,B4801E7D3454F424F96B,,,ORG,Meath Media Group,,,,,,4441 Klingle St NW,,Washington,DC,200163578,,,2024-10-10,23500.00,,Advance payment for online video production costs,,,,,,,,,,,,,,,,,,,,,
SB21b,C00030718,B098EE5F8D8DE405C9E0,,,ORG,Meath Media Group,,,,,,4441 Klingle St NW,,Washington,DC,200163578,,,2024-10-14,-41180.00,,Trsfr to Line 24 (See memo text for detailed explanation),,,,,,,,,,,,,,,,,,,,,
SB21b,C00030718,B6DBE954380644A5C944,,,ORG,A-D Strategies LLC,,,,,,PO Box 6551,,Arlington,VA,222060551,,,2024-10-14,800.00,,Advance payment for digital ad buy,,,,,,,,,,,,,,,,,,,,,
