form_type,filer_committee_id_number,transaction_id_number,back_reference_tran_id_number,back_reference_sched_name,entity_type,payee_organization_name,payee_last_name,payee_first_name,payee_middle_name,payee_prefix,payee_suffix,payee_street_1,payee_street_2,payee_city,payee_state,payee_zip_code,election_code,election_other_description,expenditure_date,expenditure_amount,semi_annual_refunded_bundled_amt,expenditure_purpose_descrip,category_code,beneficiary_committee_fec_id,beneficiary_committee_name,beneficiary_candidate_fec_id,beneficiary_candidate_last_name,beneficiary_candidate_first_name,beneficiary_candidate_middle_name,beneficiary_candidate_prefix,beneficiary_candidate_suffix,beneficiary_candidate_office,beneficiary_candidate_state,beneficiary_candidate_district,conduit_name,conduit_street_1,conduit_street_2,conduit_city,conduit_state,conduit_zip_code,memo_code,memo_text_description,reference_to_si_or_sl_system_code_that_identifies_the_account
SB29,C00266585,27402132,,,COM,Landon Dais for NY,,,,,,1952 Williamsbridge Rd.,,Bronx,NY,10461,,,2024-06-12,500.00,0.00,"Landon Dais, STATE HOUSE 77th NY-Political Contribution",011,,,,Dais,Landon,,,,,,,,,,,,,,"Landon Dais, STATE HOUSE 77th NY-Political Contribution"
SB29,C00266585,27402134,,,ORG,Greenberg Traurig,,,,,,54 State Street,6th Floor,Albany,NY,12207,,,2024-06-12,225.00,0.00,In-Kind Contribution For 6/12 Event,011,,,,Seawright,Rebecca,,,,,,,,,,,,,,In-Kind Contribution For 6/12 Event
SB29,C00266585,27403649,,,COM,Re-Elect Addabbo for Senate,,,,,,21-58 45th Street,,Astoria,NY,11105,,,2024-06-17,-2000.00,0.00,Void - Addabbo for Senate- Original Check Date 5/6/24,011,,,,Addabbo,Joseph,,,Jr.,,,,,,,,,,,Void - Addabbo for Senate- Original Check Date 5/6/24
SB29,C00266585,27403651,,,COM,Re-Elect Addabbo for Senate,,,,,,21-58 45th Street,,Astoria,NY,11105,,,2024-06-17,2000.00,0.00,"Joseph Addabbo, STATE SENATE 15th NY-Political Contribution",011,,,,Addabbo,Joseph,,,Jr.,,,,,,,,,,,"Joseph Addabbo, STATE SENATE 15th NY-Political Contribution"
SB29,C00266585,27403656,,,COM,Lynn for NYC 2025,,,,,,21-18 41st Street,1st Floor,New York,NY,11105,,,2024-06-17,500.00,0.00,"Lynn Schulman, New York City Council  NY-Political Contribution",011,,,,Schulman,Lynn,,,,,,,,,,,,,,"Lynn Schulman, New York City Council  NY-Political Contribution"
SB29,C00266585,27403963,,,COM,Julian Ramirez Campaign,,,,,,PO Box 925631,,Houston,TX,77292,,,2024-06-18,1000.00,0.00,"Julian Ramirez, Houston City Council  TX-Political Contribution",011,,,,Ramirez,Julian,,,,,,,,,,,,,,"Julian Ramirez, Houston City Council  TX-Political Contribution"
SB29,C00266585,27404406,,,PTY,Nassau County Republican Committee,,,,,,164 Post Ave.,,Westbury,NY,11590,,,2024-06-20,2500.00,0.00,Political Contribution,011,,,,,,,,,,,,,,,,,,,Political Contribution
SB29,C00266585,27407469,,,COM,Amy Peck Campaign,,,,,,"7941 Katy Freeway, #108",,Houston,TX,77024,,,2024-06-24,500.00,0.00,"Amy Peck, Houston City Council  TX-Political Contribution",011,,,,Peck,Amy,,,,,,,,,,,,,,"Amy Peck, Houston City Council  TX-Political Contribution"
