form_type,filer_committee_id_number,transaction_id_number,back_reference_tran_id_number,back_reference_sched_name,entity_type,payee_organization_name,payee_last_name,payee_first_name,payee_middle_name,payee_prefix,payee_suffix,payee_street_1,payee_street_2,payee_city,payee_state,payee_zip_code,election_code,election_other_description,expenditure_date,expenditure_amount,semi_annual_refunded_bundled_amt,expenditure_purpose_descrip,category_code,beneficiary_committee_fec_id,beneficiary_committee_name,beneficiary_candidate_fec_id,beneficiary_candidate_last_name,beneficiary_candidate_first_name,beneficiary_candidate_middle_name,beneficiary_candidate_prefix,beneficiary_candidate_suffix,beneficiary_candidate_office,beneficiary_candidate_state,beneficiary_candidate_district,conduit_name,conduit_street_1,conduit_street_2,conduit_city,conduit_state,conduit_zip_code,memo_code,memo_text_description,reference_to_si_or_sl_system_code_that_identifies_the_account
SB29,C00435321,EB50111,,,PAC,CALVERT FOR COMMISSIONER CAMPAIGN,,,,,,P.O. BOX 15571,,San Antonio,TX,78212,P2026,,2023-04-04,5000.00,,NON-FEDERAL CONTRIBUTION,011,,CALVERT FOR COMMISSIONER CAMPAIGN,,CALVERT,TOMMY,,,,,TX,,,,,,,,,
SB29,C00435321,EB50624,,,PAC,KYLE KACAL CAMPAIGN,,,,,,P.O. BOX 6628,,College Station,TX,77805,P2024,,2023-04-06,-500.00,,"NON-FEDERAL CONTRIBUTION, VOIDED CHECK ORIGINALLY ISSUED 12/7/2022",011,,KYLE KACAL CAMPAIGN,,KACAL,KYLE,,,,,TX,,,,,,,,,
SB29,C00435321,EB50112,,,PAC,JUSTIN RODRIGUEZ CAMPAIGN,,,,,,P.O. BOX 100153,,San Antonio,TX,78201,P2026,,2023-04-12,5000.00,,NON-FEDERAL CONTRIBUTION,011,,JUSTIN RODRIGUEZ CAMPAIGN,,RODRIGUEZ,JUSTIN,,,,,TX,,,,,,,,,
SB29,C00435321,EB50113,,,PAC,SAN ANTONIO EQUITY ALLIANCE,,,,,,PO BOX 15751,,San Antonio,TX,78212,,,2023-04-13,5000.00,,NON-FEDERAL CONTRIBUTION,011,,SAN ANTONIO EQUITY ALLIANCE,,,,,,,,TX,,,,,,,,,
SB29,C00435321,EB50117,,,PAC,GLENN WAGUESPACK CAMPAIGN COMMITTEE,,,,,,P.O. Box 305,,Vacherie,LA,70090,P2023,,2023-04-25,1000.00,,,011,,GLENN WAGUESPACK CAMPAIGN COMMITTEE,,WAGUESPACK,GLENN,,,,,LA,,,,,,,,,
SB29,C00435321,EB50114,,,PAC,TEXAS PIPELINE ASSOCIATION POLITICAL ACTION COMMITTEE,,,,,,604 W. 14 STREET,,Austin,TX,78701,,,2023-04-25,5000.00,,NON-FEDERAL CONTRIBUTION,011,,TEXAS PIPELINE ASSOCIATION POLITICAL ACTION COMMITTEE,,,,,,,,TX,,,,,,,,,
