form_type,filer_committee_id_number,transaction_id_number,back_reference_tran_id_number,back_reference_sched_name,entity_type,payee_organization_name,payee_last_name,payee_first_name,payee_middle_name,payee_prefix,payee_suffix,payee_street_1,payee_street_2,payee_city,payee_state,payee_zip_code,election_code,election_other_description,expenditure_date,expenditure_amount,semi_annual_refunded_bundled_amt,expenditure_purpose_descrip,category_code,beneficiary_committee_fec_id,beneficiary_committee_name,beneficiary_candidate_fec_id,beneficiary_candidate_last_name,beneficiary_candidate_first_name,beneficiary_candidate_middle_name,beneficiary_candidate_prefix,beneficiary_candidate_suffix,beneficiary_candidate_office,beneficiary_candidate_state,beneficiary_candidate_district,conduit_name,conduit_street_1,conduit_street_2,conduit_city,conduit_state,conduit_zip_code,memo_code,memo_text_description,reference_to_si_or_sl_system_code_that_identifies_the_account
SB29,C00158576,11949622,,,COM,Friends of Peter Chico,,,,,,13501 S Mackinaw Ave,,Chicago,IL,60633,,,2024-09-06,1000.00,0.00,"Peter Chico, ALDERMAN, IL",011,,,,Chico,Peter,,,,,,,,,,,,,,"Peter Chico, ALDERMAN, IL"
SB29,C00158576,11952310,,,COM,Darrell Apffel Campaign,,,,,,P.O. Box 3082,,League City,TX,77574,,,2024-09-12,5000.00,0.00,"Darrell Apffel, Galveston County Commissioner Precinct 1, TX",011,,,,Apffel,Darrell,,,,,,,,,,,,,,"Darrell Apffel, Galveston County Commissioner Precinct 1, TX"
SB29,C00158576,11953982,,,ORG,Joseph M Sanzari Family Foundation Inc,,,,,,C/O Randy Steinberg,100 W Franklin St,Hackensack,NJ,07601,,,2024-09-18,5000.00,0.00,Contribution to 501(c)(3),012,,,,,,,,,,,,,,,,,,,Contribution to 501(c)(3)
SB29,C00158576,11953984,,,COM,Quijano For Assembly,,,,,,311 West Henry Street,,Linden,NJ,07036,,,2024-09-18,8200.00,0.00,Contribution,011,,,,Quijano,Annette,,NJ Asm.,,,,,,,,,,,,Contribution
SB29,C00158576,11953985,,,ORG,"Coalition of Black Trade Unionists Region III, Inc.",,,,,,P.O Box 8303,,Fort Lauderdale,FL,33310,,,2024-09-18,6500.00,0.00,Contribution to 501(c)(5),012,,,,,,,,,,,,,,,,,,,Contribution to 501(c)(5)
SB29,C00158576,11953988,,,COM,Friends of Chester for Chatham,,,,,,714 Barton Street,,Savannah,GA,31415,,,2024-09-18,3300.00,0.00,"Chester Ellis, County Commission Chair - Chatham County, GA",011,,,,Ellis,Chester,,,,,,,,,,,,,,"Chester Ellis, County Commission Chair - Chatham County, GA"
SB29,C00158576,11956534,,,ORG,Joseph M Sanzari Family Foundation Inc,,,,,,C/O Randy Steinberg,100 W Franklin St,Hackensack,NJ,07601,,,2024-09-25,15000.00,0.00,Contribution to 501(c)(3),012,,,,,,,,,,,,,,,,,,,Contribution to 501(c)(3)
SB29,C00158576,11956537,,,ORG,Andreyev/Freeman Election Fund,,,,,,12 North State Route 17,Suite 320,Paramus,NJ,07652,,,2024-09-25,5000.00,0.00,Contribution,012,,,,,,,,,,,,,,,,,,,Contribution
