form_type,filer_committee_id_number,transaction_id_number,back_reference_tran_id_number,back_reference_sched_name,entity_type,payee_organization_name,payee_last_name,payee_first_name,payee_middle_name,payee_prefix,payee_suffix,payee_street_1,payee_street_2,payee_city,payee_state,payee_zip_code,election_code,election_other_description,expenditure_date,expenditure_amount,semi_annual_refunded_bundled_amt,expenditure_purpose_descrip,category_code,beneficiary_committee_fec_id,beneficiary_committee_name,beneficiary_candidate_fec_id,beneficiary_candidate_last_name,beneficiary_candidate_first_name,beneficiary_candidate_middle_name,beneficiary_candidate_prefix,beneficiary_candidate_suffix,beneficiary_candidate_office,beneficiary_candidate_state,beneficiary_candidate_district,conduit_name,conduit_street_1,conduit_street_2,conduit_city,conduit_state,conduit_zip_code,memo_code,memo_text_description,reference_to_si_or_sl_system_code_that_identifies_the_account
SB23,C00009936,27004360,,,CCM,Lisa Blunt Rochester For Senate,,,,,,"415 New Jersey Avenue, SE",,Washington,DC,20003,G2024,,2023-08-01,5000.00,0.00,"Lisa Blunt Rochester, US HOUSE D-S2-DE",011,C00590778,Lisa Blunt Rochester For Senate,H6DE00206,Blunt Rochester,Lisa,,Rep.,,H,DE,02,,,,,,,,"Lisa Blunt Rochester, US HOUSE D-S2-DE"
SB23,C00009936,27004361,,,CCM,Peters For Michigan,,,,,,PO Box 15854,,Washington,DC,20003,P2026,,2023-08-01,1000.00,0.00,"Gary Peters, US SENATE D-S2-MI",011,C00437889,Peters For Michigan,S4MI00355,Peters,Gary,,,,S,MI,,,,,,,,,"Gary Peters, US SENATE D-S2-MI"
SB23,C00009936,27004362,,,PTY,DCCC Building Fund,,,,,,430 South Capitol Street SE,2nd Floor,Washington,DC,20003,,,2023-08-01,5000.00,0.00,federal contribution,011,C00000935,,,,,,,,,,,,,,,,,,federal contribution
SB23,C00009936,27043143,,,CCM,Chuy Garcia for Congress,,,,,,137 N 14th AVe,,Melrose Park,IL,60160,P2024,,2023-08-15,1000.00,0.00,"Jesus Garcia, US HOUSE D-04-IL",011,C00661777,Chuy Garcia for Congress,,Garcia,Jesus,,,,H,IL,04,,,,,,,,"Jesus Garcia, US HOUSE D-04-IL"
SB23,C00009936,27043144,,,CCM,Friends Of Bennie Thompson,,,,,,"413 New Jersey Ave, SE",,Washington,DC,20003,P2024,,2023-08-15,1500.00,0.00,"Bennie Thompson, US HOUSE D-02-MS",011,C00279851,Friends Of Bennie Thompson,H4MS02068,Thompson,Bennie,,,,H,MS,02,,,,,,,,"Bennie Thompson, US HOUSE D-02-MS"
SB23,C00009936,27043153,,,CCM,Bonamici For Congress,,,,,,"499 South Capitol St, SW",Ste 420,Washington,DC,20003,P2024,,2023-08-15,1000.00,0.00,"Suzanne Bonamici, US HOUSE D-01-OR",011,C00500421,Bonamici For Congress,H2OR01133,Bonamici,Suzanne,,Ms.,,H,OR,01,,,,,,,,"Suzanne Bonamici, US HOUSE D-01-OR"
SB23,C00009936,27043154,,,CCM,Higgins for Congress,,,,,,PO Box 28,,Buffalo,NY,14220,P2024,,2023-08-15,500.00,0.00,"Brian Higgins, US HOUSE D-26-NY",011,C00401034,Higgins for Congress,,Higgins,Brian,,,,H,NY,26,,,,,,,,"Brian Higgins, US HOUSE D-26-NY"
SB23,C00009936,27043157,,,PAC,Pineapple PAC,,,,,,c/o The Kauffman Group,"323 7th street, SE",Washington,DC,20003,,,2023-08-15,1000.00,0.00,federal contribution,011,C00539601,,,,,,,,,,,,,,,,,,federal contribution
SB23,C00009936,27043158,,,CCM,Jasmine For Us,,,,,,"122 C Street, NW",Suite 360,Washington,DC,20001,P2024,,2023-08-15,1000.00,0.00,"Jasmine Crockett, US HOUSE D-30-TX",011,C00795450,Jasmine For Us,H2TX30178,Crockett,Jasmine,,Rep.,,H,TX,30,,,,,,,,"Jasmine Crockett, US HOUSE D-30-TX"
SB23,C00009936,27043159,,,CCM,Friends of Rosa DeLauro,,,,,,6129 Long Meadow Road,,McLean,VA,22101,P2024,,2023-08-15,1000.00,0.00,"Rosa DeLauro, US HOUSE D-03-CT",011,C00238865,Friends of Rosa DeLauro,,DeLauro,Rosa,,,,H,CT,03,,,,,,,,"Rosa DeLauro, US HOUSE D-03-CT"
SB23,C00009936,27043160,,,CCM,Friends of Sherrod Brown,,,,,,"323 7th Street, SE",,Washington,DC,20003,G2024,,2023-08-15,5000.00,0.00,"Sherrod Brown, US SENATE D-S1-OH",011,C00264697,Friends of Sherrod Brown,S6OH00163,Brown,Sherrod,,,,S,OH,,,,,,,,,"Sherrod Brown, US SENATE D-S1-OH"
SB23,C00009936,27044923,,,CCM,Angie Craig For Congress,,,,,,PO Box 22116,,Eagan,MN,55122,P2024,,2023-08-17,2500.00,0.00,"Angie Craig, US HOUSE D-02-MN",011,C00575209,Angie Craig For Congress,H6MN02131,Craig,Angela,,,,H,MN,02,,,,,,,,"Angie Craig, US HOUSE D-02-MN"
SB23,C00009936,27044924,,,CCM,Mark Takano For Congress,,,,,,"211 S. Street, NW",,Washington,DC,20001,G2024,,2023-08-17,2500.00,0.00,"Mark Takano, US HOUSE D-41-CA",011,C00498667,Mark Takano For Congress,H2CA43245,Takano,Mark,,Mr.,,H,CA,41,,,,,,,,"Mark Takano, US HOUSE D-41-CA"
SB23,C00009936,27045809,,,CCM,Chris Deluzio For Congress,,,,,,PO Box 16210,,Pittsburgh,PA,15242,P2024,,2023-08-17,3000.00,0.00,"Chris Deluzio, US HOUSE D-17-PA",011,C00787648,Chris Deluzio For Congress,H2PA17103,Deluzio,Christopher,,,,H,PA,17,,,,,,,,"Chris Deluzio, US HOUSE D-17-PA"
SB23,C00009936,27045891,,,CCM,Chris Deluzio For Congress,,,,,,PO Box 16210,,Pittsburgh,PA,15242,G2024,,2023-08-17,2000.00,0.00,"Chris Deluzio, US HOUSE D-17-PA",011,C00787648,Chris Deluzio For Congress,H2PA17103,Deluzio,Christopher,,,,H,PA,17,,,,,,,,"Chris Deluzio, US HOUSE D-17-PA"
SB23,C00009936,27045902,,,CCM,Jared Moskowitz For Congress,,,,,,660 Pennsylvania Ave,suite 202,Washington,DC,20003,P2024,,2023-08-17,1000.00,0.00,"Jared Moskowitz, US HOUSE D-23-FL",011,C00807628,Jared Moskowitz For Congress,H2FL22171,Moskowitz,Jared,,Rep.,,H,FL,23,,,,,,,,"Jared Moskowitz, US HOUSE D-23-FL"
SB23,C00009936,27046626,,,CCM,Clarke For Congress,,,,,,PO Box 250200,,Brooklyn,NY,11225,P2024,,2023-08-22,1000.00,0.00,"Yvette Clarke, US HOUSE D-09-NY",011,C00415331,Clarke For Congress,H4NY11138,Clarke,Yvette,,,,H,NY,09,,,,,,,,"Yvette Clarke, US HOUSE D-09-NY"
SB23,C00009936,27047170,,,CCM,Barragan For Congress,,,,,,PO Box 15096,c/o Strathdee Group,Washington,DC,20003,P2024,,2023-08-24,1500.00,0.00,"Nannette Barragan, US HOUSE D-44-CA",011,C00577353,Barragan For Congress,H6CA44103,Barragan,Nanette,,Rep.,,H,CA,44,,,,,,,,"Nannette Barragan, US HOUSE D-44-CA"
SB23,C00009936,27047173,,,CCM,Becca Balint For Vermont,,,,,,"211 S Street, NW",,Washington,DC,20001,P2024,,2023-08-24,1000.00,0.00,"Becca Balint, US HOUSE D-AL-VT",011,C00797175,Becca Balint For Vermont,H2VT01076,Balint,Becca,,Rep.,,H,VT,01,,,,,,,,"Becca Balint, US HOUSE D-AL-VT"
SB23,C00009936,27048161,,,CCM,Pete Aguilar For Congress,,,,,,"499 S Capitol St, SW",Suite 420,Washington,DC,20003,P2024,,2023-08-25,2500.00,0.00,"Peter Aguilar, US HOUSE D-31-CA",011,C00510461,Pete Aguilar For Congress,H2CA31125,Aguilar,Pete,,,,H,CA,31,,,,,,,,"Peter Aguilar, US HOUSE D-31-CA"
SB23,C00009936,27048162,,,CCM,Robert Garcia for Congress,,,,,,"211 S Street, NW",,Washington,DC,20001,P2024,,2023-08-25,1000.00,0.00,"Robert Garcia, US HOUS D-42-CA",011,C00797795,Robert Garcia for Congress,H2CA47188,Garcia,Robert,,,,H,CA,42,,,,,,,,"Robert Garcia, US HOUS D-42-CA"
SB23,C00009936,27048163,,,PAC,Rock Island County Democratic Party,,,,,,218 18th St,,Rock Island,IL,61201,,,2023-08-25,200.00,0.00,2023 Labor Day Picnic and Raffle Drawing,011,C00408203,,,,,,,,,,,,,,,,,,2023 Labor Day Picnic and Raffle Drawing
SB23,C00009936,27048164,,,CCM,Citizens for Eleanor Holmes Norton,,,,,,PO Box 70626,,Washington,DC,20024,P2024,,2023-08-25,1500.00,0.00,"Eleanor Holmes Norton, US HOUSE D-DL-DC",011,C00244335,Citizens for Eleanor Holmes Norton,H0DC00058,Norton,Eleanor Holmes,,,,H,DC,00,,,,,,,,"Eleanor Holmes Norton, US HOUSE D-DL-DC"
SB23,C00009936,27057960,,,PAC,Arizona Democratic Party - Federal Account,,,,,,PO Box 36123,,Pheonix,AZ,85067,,,2023-08-31,5000.00,0.00,federal contribution,011,C00166710,,,,,,,,,,,,,,,,,,federal contribution
SB23,C00009936,27057961,,,PAC,Cambria County Democratic Committee,,,,,,104 S Center Street,Suite 205,Ebensburg,PA,15931,,,2023-08-31,1000.00,0.00,federal contribution,011,C00768739,,,,,,,,,,,,,,,,,,federal contribution
