form_type,filer_committee_id_number,transaction_id_number,back_reference_tran_id_number,back_reference_sched_name,entity_type,payee_organization_name,payee_last_name,payee_first_name,payee_middle_name,payee_prefix,payee_suffix,payee_street_1,payee_street_2,payee_city,payee_state,payee_zip_code,election_code,election_other_description,expenditure_date,expenditure_amount,semi_annual_refunded_bundled_amt,expenditure_purpose_descrip,category_code,beneficiary_committee_fec_id,beneficiary_committee_name,beneficiary_candidate_fec_id,beneficiary_candidate_last_name,beneficiary_candidate_first_name,beneficiary_candidate_middle_name,beneficiary_candidate_prefix,beneficiary_candidate_suffix,beneficiary_candidate_office,beneficiary_candidate_state,beneficiary_candidate_district,conduit_name,conduit_street_1,conduit_street_2,conduit_city,conduit_state,conduit_zip_code,memo_code,memo_text_description,reference_to_si_or_sl_system_code_that_identifies_the_account
SB23,C00258228,SB23.9405,,,CCM,Carey for Congress,,,,,,PO Box 16032,,Columbus,OH,43216,P2024,,2023-02-22,1000.00,,Contribution to Carey for Congress campaign,,,,,,,,,,,,,,,,,,,,
SB23,C00258228,SB23.9418,,,CCM,Citizens for Blessing,,,,,,3378 Dolomar Drive,,Cincinnati,OH,45239,P2024,,2023-06-09,250.00,,Contribution to the Citizens for Blessing campaign,,,,,,,,,,,,,,,,,,,,
SB23,C00258228,SB23.9413,,,CCM,Friends of Sherrod Brown,,,,,,"323 7th Street, SE",,Washington,DC,20003,P2024,,2023-05-25,5000.00,,Contribution to Friends of Sherrod Brown campaign,,,,,,,,,,,,,,,,,,,,
SB23,C00258228,SB23.9415,,,CCM,JOHNSON FOR CONGRESS,,,,,,3834 Ridgewood Drive,,Hilliard,OH,43026,P2024,,2023-06-01,1000.00,,Contribution to the Bill Johnson campaign,,,,,,,,,,,,,,,,,,,,
SB23,C00258228,SB23.9420,,,CCM,Protect the House 2024,,,,,,3834 Ridgewood Drive,,Hilliard,OH,43026,P2024,,2023-06-27,10000.00,,Protect the House 2024 campaign,,,,,,,,,,,,,,,,,,,,
