form_type,filer_committee_id_number,transaction_id_number,back_reference_tran_id_number,back_reference_sched_name,entity_type,payee_organization_name,payee_last_name,payee_first_name,payee_middle_name,payee_prefix,payee_suffix,payee_street_1,payee_street_2,payee_city,payee_state,payee_zip_code,election_code,election_other_description,expenditure_date,expenditure_amount,semi_annual_refunded_bundled_amt,expenditure_purpose_descrip,category_code,beneficiary_committee_fec_id,beneficiary_committee_name,beneficiary_candidate_fec_id,beneficiary_candidate_last_name,beneficiary_candidate_first_name,beneficiary_candidate_middle_name,beneficiary_candidate_prefix,beneficiary_candidate_suffix,beneficiary_candidate_office,beneficiary_candidate_state,beneficiary_candidate_district,conduit_name,conduit_street_1,conduit_street_2,conduit_city,conduit_state,conduit_zip_code,memo_code,memo_text_description,reference_to_si_or_sl_system_code_that_identifies_the_account
SB23,C00307249,88599620,,,CCM,Garbarino For Congress,,,,,,PO Box 101,,Bayport,NY,11705,P2024,,2024-03-12,2500.00,0.00,Contribution: Andrew Garbarino (D-2nd NY),011,C00729954,Garbarino For Congress,H0NY02234,Garbarino,Andrew,,Rep.,,H,NY,02,,,,,,,,Contribution: Andrew Garbarino (D-2nd NY)
SB23,C00307249,88599722,,,CCM,Friends Of Sherrod Brown,,,,,,4471 Sexton Rd,,Cleveland,OH,44105,G2024,,2024-03-15,2000.00,0.00,Contribution: Sherrod Brown (D-OH),011,C00264697,Friends Of Sherrod Brown,S6OH00163,Brown,Sherrod,,Sen.,,S,OH,,,,,,,,,Contribution: Sherrod Brown (D-OH)
SB23,C00307249,88599723,,,CCM,Magaziner For Congress,,,,,,"One Park Row, 5th Floor",,Providence,RI,02903,P2024,,2024-03-25,1000.00,0.00,Contribution: Seth Magaziner (D-2nd RI),011,C00802504,Magaziner For Congress,H2RI02184,Magaziner,Seth,,Rep.,,H,RI,02,,,,,,,,Contribution: Seth Magaziner (D-2nd RI)
SB23,C00307249,88599724,,,CCM,Magaziner For Congress,,,,,,"One Park Row, 5th Floor",,Providence,RI,02903,P2024,,2024-03-26,1000.00,0.00,Contribution: Seth Magaziner (D-2nd RI),011,C00802504,Magaziner For Congress,H2RI02184,Magaziner,Seth,,Rep.,,H,RI,02,,,,,,,,Contribution: Seth Magaziner (D-2nd RI)
SB23,C00307249,88599776,,,CCM,Brian Fitzpatrick For All Of Us,,,,,,PO Box 939,,Langhorne,PA,19047,P2024,,2024-03-26,1000.00,0.00,Contribution: Brian Fitzpatrick (R-1st PA),011,C00607416,Brian Fitzpatrick For All Of Us,H6PA08277,Fitzpatrick,Brian,,Rep.,,H,PA,01,,,,,,,,Contribution: Brian Fitzpatrick (R-1st PA)
