form_type,filer_committee_id_number,transaction_id_number,back_reference_tran_id_number,back_reference_sched_name,entity_type,payee_organization_name,payee_last_name,payee_first_name,payee_middle_name,payee_prefix,payee_suffix,payee_street_1,payee_street_2,payee_city,payee_state,payee_zip_code,election_code,election_other_description,expenditure_date,expenditure_amount,semi_annual_refunded_bundled_amt,expenditure_purpose_descrip,category_code,beneficiary_committee_fec_id,beneficiary_committee_name,beneficiary_candidate_fec_id,beneficiary_candidate_last_name,beneficiary_candidate_first_name,beneficiary_candidate_middle_name,beneficiary_candidate_prefix,beneficiary_candidate_suffix,beneficiary_candidate_office,beneficiary_candidate_state,beneficiary_candidate_district,conduit_name,conduit_street_1,conduit_street_2,conduit_city,conduit_state,conduit_zip_code,memo_code,memo_text_description,reference_to_si_or_sl_system_code_that_identifies_the_account
SB23,C00586859,SB23.10159,,,CCM,BLAINE FOR CONGRESS,,,,,,3410 Alabama Ave.,,Alexandria,VA,22305,P2024,,2023-05-15,2000.00,,Support,011,C00458679,BLAINE FOR CONGRESS,H8MO09153,LUETKEMEYER,W BLAINE,,,,H,MO,03,,,,,,,,
SB23,C00586859,SB23.10174,,,CCM,BRIAN FITZPATRICK FOR ALL OF US,,,,,,PO BOX 939,,LANGHORNE,PA,19047,P2024,,2023-05-08,2000.00,,Support,011,C00607416,BRIAN FITZPATRICK FOR ALL OF US,H6PA08277,FITZPATRICK,BRIAN,,,,H,PA,01,,,,,,,,
SB23,C00586859,SB23.10158,,,CCM,BYRON DONALDS FOR CONGRESS,,,,,,8616 Buckboard Dr,,Alexandria,VA,22308,P2024,,2023-05-08,1000.00,,Support,011,C00733329,BYRON DONALDS FOR CONGRESS,H2FL14186,DONALDS,BYRON,,,,H,FL,19,,,,,,,,
SB23,C00586859,SB23.10170,,,CCM,DREW FERGUSON FOR CONGRESS INC.,,,,,,PO BOX 71067,,NEWNAN,GA,30271,P2024,,2023-05-15,1500.00,,Support,,C00607838,DREW FERGUSON FOR CONGRESS INC.,H6GA03113,FERGUSON,ANDERSON DREW IV,,,,H,GA,03,,,,,,,,
SB23,C00586859,SB23.10157,,,CCM,SCOTT FITZGERALD FOR CONGRESS,,,,,,PO Box 5048,,Elm Grove,WI,53122,P2024,,2023-05-08,2500.00,,Support,011,C00720011,SCOTT FITZGERALD FOR CONGRESS,H0WI05113,FITZGERALD,SCOTT L,,,,H,WI,05,,,,,,,,
