form_type,filer_committee_id_number,transaction_id_number,back_reference_tran_id_number,back_reference_sched_name,entity_type,payee_organization_name,payee_last_name,payee_first_name,payee_middle_name,payee_prefix,payee_suffix,payee_street_1,payee_street_2,payee_city,payee_state,payee_zip_code,election_code,election_other_description,expenditure_date,expenditure_amount,semi_annual_refunded_bundled_amt,expenditure_purpose_descrip,category_code,beneficiary_committee_fec_id,beneficiary_committee_name,beneficiary_candidate_fec_id,beneficiary_candidate_last_name,beneficiary_candidate_first_name,beneficiary_candidate_middle_name,beneficiary_candidate_prefix,beneficiary_candidate_suffix,beneficiary_candidate_office,beneficiary_candidate_state,beneficiary_candidate_district,conduit_name,conduit_street_1,conduit_street_2,conduit_city,conduit_state,conduit_zip_code,memo_code,memo_text_description,reference_to_si_or_sl_system_code_that_identifies_the_account
SB29,C00701961,EB25,,,ORG,You Are Safe Here,,,,,,P.O. Box 3,,Columbia,CA,95310,,,2024-08-01,250.00,,Contribution,012,,,,,,,,,,,,,,,,,,,
SB29,C00701961,EB32,,,PAC,HUEBNER FOR CITY COUNCIL 2024,,,,,,4801 Airport Plaza Dr.,,Long Beach,CA,90815,,,2024-09-27,1372.00,,Local Contribution,011,,HUEBNER FOR CITY COUNCIL 2024,,ID#1469930,Rudy Huebner,,,,,,,,,,,,,,
SB29,C00701961,EB34,,,PAC,ARIANA ARESTEGUI FOR CITY COUNCIL 2024 ID#1469963,,,,,,1400 N. Harbor Blvd. Ste 550,,Fullerton,CA,92835,,,2024-09-29,600.00,,Local Contribution,011,,ARIANA ARESTEGUI FOR CITY COUNCIL 2024 ID#1469963,,Arestegui,Ariana,,,,,,,,,,,,,,
SB29,C00701961,EB35,,,PAC,Carlos Franco for Buena Park City Council 2022  ID#1440627,,,,,,6262 Marshall Ave.,,Buena Park,CA,90621,,,2024-09-29,475.00,,Local Contribution,011,,Carlos Franco for Buena Park City Council 2022  ID#1440627,,Franco,Carlos,,,,,,,,,,,,,,
SB29,C00701961,EB36,,,PAC,Frances Marquez for Orange County Supervisor 2024 ID#1460254,,,,,,16633 Ventura Blvd Ste 1008,,Encino,CA,91436,,,2024-09-29,300.00,,Local Contribution,011,,Frances Marquez for Orange County Supervisor 2024 ID#1460254,,Marquez,Frances,,,,,,,,,,,,,,
SB29,C00701961,EB37,,,PAC,Sherine Smith for Capistrano Unified School Board 2024  ID#1463551,,,,,,1400 N. Harbor Blvd. Ste 550,,Fullerton,CA,92835,,,2024-09-30,300.00,,Local Contribution,011,,Sherine Smith for Capistrano Unified School Board 2024  ID#1463551,,Smith,Sherine,,,,,,,,,,,,,,
