form_type,filer_committee_id_number,transaction_id_number,back_reference_tran_id_number,back_reference_sched_name,entity_type,payee_organization_name,payee_last_name,payee_first_name,payee_middle_name,payee_prefix,payee_suffix,payee_street_1,payee_street_2,payee_city,payee_state,payee_zip_code,election_code,election_other_description,expenditure_date,expenditure_amount,semi_annual_refunded_bundled_amt,expenditure_purpose_descrip,category_code,beneficiary_committee_fec_id,beneficiary_committee_name,beneficiary_candidate_fec_id,beneficiary_candidate_last_name,beneficiary_candidate_first_name,beneficiary_candidate_middle_name,beneficiary_candidate_prefix,beneficiary_candidate_suffix,beneficiary_candidate_office,beneficiary_candidate_state,beneficiary_candidate_district,conduit_name,conduit_street_1,conduit_street_2,conduit_city,conduit_state,conduit_zip_code,memo_code,memo_text_description,reference_to_si_or_sl_system_code_that_identifies_the_account
SB23,C00427427,SB23.4099,,,PAC,COLORADO BANKERS ASSOCIATION POLITICAL ACTION COMMITTEE,,,,,,"140 E. 19TH AVENUE, #400",,DENVER,CO,80203,P2023,,2023-04-25,600.00,,,,C00102731,,,,,,,,,,,,,,,,,,
SB23,C00427427,SB23.4223,,,PAC,CONCERNED AMERICANS FOR FREEDOM & OPPORTUNITY PAC (CAFO PAC),,,,,,228 S WASHINGTON ST STE 115,,ALEXANDRIA,VA,22314,P2024,,2023-06-07,5000.00,,,,C00481176,CONCERNED AMERICANS FOR FREEDOM & OPPORTUNITY PAC (CAFO PAC),,,,,,,,,,,,,,,,,
SB23,C00427427,SB23.4251,,,CCM,DAVIDSON FOR CONGRESS,,,,,,PO BOX 518,,TROY,OH,45373,P2023,,2023-06-13,500.00,,,,C00600718,,,,,,,,H,OH,08,,,,,,,,
SB23,C00427427,SB23.4253,,,CCM,GUY FOR CONGRESS,,,,,,P.O. BOX 23177,,PITTSBURGH,PA,15222,P2023,,2023-06-13,500.00,,,,C00657833,,,,,,,,H,PA,14,,,,,,,,
SB23,C00427427,SB23.4101,,,CCM,MIKE FLOOD FOR CONGRESS,,,,,,PO BOX 81041,,LINCOLN,NE,68501,P2023,,2023-05-18,4000.00,,,,C00801241,,,,,,,,H,NE,01,,,,,,,,
SB23,C00427427,SB23.4255,,,CCM,"STEIL FOR WISCONSIN, INC.",,,,,,1818 MILTON AVE,# 1448,JANESVILLE,WI,53545,P2023,,2023-06-13,500.00,,,,C00677286,,,,,,,,H,WI,01,,,,,,,,
