form_type,filer_committee_id_number,transaction_id_number,back_reference_tran_id_number,back_reference_sched_name,entity_type,payee_organization_name,payee_last_name,payee_first_name,payee_middle_name,payee_prefix,payee_suffix,payee_street_1,payee_street_2,payee_city,payee_state,payee_zip_code,election_code,election_other_description,expenditure_date,expenditure_amount,semi_annual_refunded_bundled_amt,expenditure_purpose_descrip,category_code,beneficiary_committee_fec_id,beneficiary_committee_name,beneficiary_candidate_fec_id,beneficiary_candidate_last_name,beneficiary_candidate_first_name,beneficiary_candidate_middle_name,beneficiary_candidate_prefix,beneficiary_candidate_suffix,beneficiary_candidate_office,beneficiary_candidate_state,beneficiary_candidate_district,conduit_name,conduit_street_1,conduit_street_2,conduit_city,conduit_state,conduit_zip_code,memo_code,memo_text_description,reference_to_si_or_sl_system_code_that_identifies_the_account
SB23,C00633354,SB23.5061,,,CCM,FRIENDS OF MARK WARNER,,,,,,1751 POTOMAC GREENS DRIVE,,ALEXANDRIA,VA,22314,P2024,,2023-05-15,5000.00,,Contribution to political campaign,011,C00438713,FRIENDS OF MARK WARNER,S6VA00093,WARNER,MARK ROBERT,,,,S,VA,00,,,,,,,,
SB23,C00633354,SB23.5062,,,CCM,IOWANS FOR ZACH NUNN,,,,,,PO BOX 11,,BONDURANT,IA,50035,P2024,,2023-05-15,1000.00,,Contribution to political campaign,011,C00784389,IOWANS FOR ZACH NUNN,H2IA03119,NUNN,ZACH,,,,H,IA,03,,,,,,,,
SB23,C00633354,SB23.5059,,,CCM,JOSH GOTTHEIMER FOR CONGRESS,,,,,,PO BOX 584,,RIDGEWOOD,NJ,07451,P2024,,2023-05-15,3500.00,,Contribution to poltiical campaign,011,C00573949,JOSH GOTTHEIMER FOR CONGRESS,H6NJ05171,GOTTHEIMER,JOSH,,,,H,NJ,05,,,,,,,,
SB23,C00633354,SB23.5063,,,CCM,SINEMA FOR ARIZONA,,,,,,PO BOX 7586,,PHOENIX,AZ,85011,G2024,,2023-05-15,4200.00,,Political contribution,011,C00508804,SINEMA FOR ARIZONA,S8AZ00197,SINEMA,KYRSTEN,,,,S,AZ,00,,,,,,,,
SB23,C00633354,SB23.5058,,,CCM,TINA SMITH FOR MINNESOTA,,,,,,P.O. BOX 14362,,SAINT PAUL,MN,55114,P2024,,2023-05-15,2000.00,,Contribution to political campaign,011,C00663781,TINA SMITH FOR MINNESOTA,S8MN00578,SMITH,TINA,,,,S,MN,00,,,,,,,,
SB23,C00633354,SB23.5060,,,CCM,VICENTE GONZALEZ FOR CONGRESS,,,,,,121 NORTH 10TH ST,,MCALLEN,TX,78501,P2024,,2023-05-15,2500.00,,Contribution to political campaign,011,C00592659,VICENTE GONZALEZ FOR CONGRESS,,Gonzalez,Vicente,,,,,,,,,,,,,,
