form_type,filer_committee_id_number,transaction_id_number,back_reference_tran_id_number,back_reference_sched_name,entity_type,payee_organization_name,payee_last_name,payee_first_name,payee_middle_name,payee_prefix,payee_suffix,payee_street_1,payee_street_2,payee_city,payee_state,payee_zip_code,election_code,election_other_description,expenditure_date,expenditure_amount,semi_annual_refunded_bundled_amt,expenditure_purpose_descrip,category_code,beneficiary_committee_fec_id,beneficiary_committee_name,beneficiary_candidate_fec_id,beneficiary_candidate_last_name,beneficiary_candidate_first_name,beneficiary_candidate_middle_name,beneficiary_candidate_prefix,beneficiary_candidate_suffix,beneficiary_candidate_office,beneficiary_candidate_state,beneficiary_candidate_district,conduit_name,conduit_street_1,conduit_street_2,conduit_city,conduit_state,conduit_zip_code,memo_code,memo_text_description,reference_to_si_or_sl_system_code_that_identifies_the_account
SB23,C00346288,B-11,,,PAC,NEW DEMOCRAT COALITION ACTION FUND,,,,,,600 PENNSYLVANIA AVE SE,,WASHINGTON,DC,20003,,,2023-01-25,5000.00,,Contribution,011,C00409730,NEW DEMOCRAT COALITION ACTION FUND,,,,,,,,,,,,,,,,,
SB23,C00346288,B-12,,,CCM,FRIENDS OF MARK WARNER,,,,,,1751 POTOMAC GREENS DRIVE,,ALEXANDRIA,VA,223146233,P2026,,2023-03-27,1000.00,,Contribution,011,C00438713,FRIENDS OF MARK WARNER,S6VA00093,Warner,Mark,Robert,,,S,VA,,,,,,,,,
SB23,C00346288,B-13,,,PTY,DSCC,,,,,,120 MARYLAND AVE NE,,WASHINGTON,DC,20002,,,2023-02-13,1000.00,,Contribution,011,C00042366,DSCC,,,,,,,,,,,,,,,,,
SB23,C00346288,B-14,,,PAC,REPUBLICAN GOVERNANCE GROUP/TUESDAY GROUP PAC,,,,,,610 S. BOULEVARD,,TAMPA,FL,33606,,,2023-01-25,5000.00,,Contribution,011,C00433060,REPUBLICAN GOVERNANCE GROUP/TUESDAY GROUP PAC,,,,,,,,,,,,,,,,,
SB23,C00346288,B-15,,,PAC,BUILDING BRIDGES PAC,,,,,,824 S MILLEDGE AVE STE 101,,ATHENS,GA,30605,,,2023-01-25,2500.00,,Contribution,011,C00693127,BUILDING BRIDGES PAC,,,,,,,,,,,,,,,,,
SB23,C00346288,B-16,,,CCM,DR. RAUL RUIZ FOR CONGRESS,,,,,,PO BOX 1566,,INDIO,CA,92202,P2024,,2023-03-10,1000.00,,Contribution,011,C00502575,DR. RAUL RUIZ FOR CONGRESS,H2CA36439,Ruiz,Raul,,Dr.,,H,CA,25,,,,,,,,
SB23,C00346288,B-17,,,PAC,ACROSS THE AISLE PAC,,,,,,611 PENNSYLVANIA AVENUE SE,SUITE 143,WASHINGTON,DC,20003,,,2023-01-25,2500.00,,Contribution,011,C00696591,ACROSS THE AISLE PAC,,,,,,,,,,,,,,,,,
