form_type,filer_committee_id_number,transaction_id_number,back_reference_tran_id_number,back_reference_sched_name,entity_type,payee_organization_name,payee_last_name,payee_first_name,payee_middle_name,payee_prefix,payee_suffix,payee_street_1,payee_street_2,payee_city,payee_state,payee_zip_code,election_code,election_other_description,expenditure_date,expenditure_amount,semi_annual_refunded_bundled_amt,expenditure_purpose_descrip,category_code,beneficiary_committee_fec_id,beneficiary_committee_name,beneficiary_candidate_fec_id,beneficiary_candidate_last_name,beneficiary_candidate_first_name,beneficiary_candidate_middle_name,beneficiary_candidate_prefix,beneficiary_candidate_suffix,beneficiary_candidate_office,beneficiary_candidate_state,beneficiary_candidate_district,conduit_name,conduit_street_1,conduit_street_2,conduit_city,conduit_state,conduit_zip_code,memo_code,memo_text_description,reference_to_si_or_sl_system_code_that_identifies_the_account
SB29,C00399444,B-49747,,,COM,Democratic Attorney General Association,,,,,,1350 I Street Northwest,,Washington,DC,20005,G2024,,2024-06-07,2000.00,0.00,Contribution,011,,Democratic Attorney General Association,,,,,,,,,,,,,,,,,
SB29,C00399444,B-49423,,,CCM,Jeff Jackson For Attorney General,,,,,,P.O. Box 470882,,Charlotte,NC,28226,G2024,,2024-04-05,2000.00,2000.00,Contribution,011,,Jeff Jackson For Attorney General,,Jackson,Jeff,,,,,NC,,,,,,,,,
SB29,C00399444,B-49750,,,CCM,Julia Parker for Idaho State Senate,,,,,,P.O. Box 8695,,Moscow,ID,834843,G2024,,2024-06-28,500.00,500.00,Contribution,011,,,,Parker,Julia,,,,,,,,,,,,,,
SB29,C00399444,B-49751,,,CCM,Kathy Dawes for Idaho,,,,,,1018 E Street,,Moscow,ID,83843,G2024,,2024-06-28,500.00,500.00,Contribution,011,,,,Dawes,Kathy,,,,,,,,,,,,,,
SB29,C00399444,B-49752,,,CCM,Mary For Idaho,,,,,,PO Box 2836,,Pocatello,ID,83206,G2024,,2024-06-28,500.00,500.00,Contribution,011,,Mary For Idaho,,Shea,Mary,,,,,,,,,,,,,,
SB29,C00399444,B-49754,,,PAC,The Sixteen Thirty Fund (nonprofit 501(c)(4)),,,,,,PO Box 38066,,Baltimore,MD,21297,G2024,,2024-06-19,1500.00,0.00,Contribution,011,,The Sixteen Thirty Fund (nonprofit 501(c)(4)),,,,,,,,,,,,,,,,,
