form_type,filer_committee_id_number,transaction_id_number,back_reference_tran_id_number,back_reference_sched_name,entity_type,payee_organization_name,payee_last_name,payee_first_name,payee_middle_name,payee_prefix,payee_suffix,payee_street_1,payee_street_2,payee_city,payee_state,payee_zip_code,election_code,election_other_description,expenditure_date,expenditure_amount,semi_annual_refunded_bundled_amt,expenditure_purpose_descrip,category_code,beneficiary_committee_fec_id,beneficiary_committee_name,beneficiary_candidate_fec_id,beneficiary_candidate_last_name,beneficiary_candidate_first_name,beneficiary_candidate_middle_name,beneficiary_candidate_prefix,beneficiary_candidate_suffix,beneficiary_candidate_office,beneficiary_candidate_state,beneficiary_candidate_district,conduit_name,conduit_street_1,conduit_street_2,conduit_city,conduit_state,conduit_zip_code,memo_code,memo_text_description,reference_to_si_or_sl_system_code_that_identifies_the_account
SB23,C00807644,SB23.4212,,,CCM,ELISSA SLOTKIN FOR MICHIGAN,,,,,,P.O. BOX 4145,,EAST LANSING,MI,48826,G2024,,2023-04-14,1000.00,,Contribution,,C00834218,ELISSA SLOTKIN FOR MICHIGAN,,,,,,,S,MI,00,,,,,,,,
SB23,C00807644,SB23.4214,,,CCM,FRIENDS OF DAVE JOYCE,,,,,,9856 ARCHER LN,,DUBLIN,OH,43017,G2024,,2023-04-13,1000.00,,Contribution,,C00527457,FRIENDS OF DAVE JOYCE,,,,,,,H,OH,14,,,,,,,,
SB23,C00807644,SB23.4216,,,CCM,LORI CHAVEZ-DEREMER FOR CONGRESS,,,,,,13203 SE 172ND AVE,STE 166 #399,HAPPY VALLEY,OR,97086,G2024,,2023-04-13,1000.00,,,,C00784520,LORI CHAVEZ-DEREMER FOR CONGRESS,,,,,,,H,OR,05,,,,,,,,
SB23,C00807644,SB23.4208,,,CCM,Mike Gallagher for Wisconsin,,,,,,PO Box 1027,,Green Bay,WI,54305,G2024,,2023-02-01,2000.00,,Contribution,,C00610212,Mike Gallagher for Wisconsin,,,,,,,H,WI,08,,,,,,,,
SB23,C00807644,SB23.4218,,,CCM,WOMACK FOR CONGRESS COMMITTEE,,,,,,PO BOX 508,,ROGERS,AR,72757,G2024,,2023-05-03,1000.00,,,,C00477745,WOMACK FOR CONGRESS COMMITTEE,,,,,,,H,AR,03,,,,,,,,
