form_type,filer_committee_id_number,transaction_id_number,back_reference_tran_id_number,back_reference_sched_name,entity_type,payee_organization_name,payee_last_name,payee_first_name,payee_middle_name,payee_prefix,payee_suffix,payee_street_1,payee_street_2,payee_city,payee_state,payee_zip_code,election_code,election_other_description,expenditure_date,expenditure_amount,semi_annual_refunded_bundled_amt,expenditure_purpose_descrip,category_code,beneficiary_committee_fec_id,beneficiary_committee_name,beneficiary_candidate_fec_id,beneficiary_candidate_last_name,beneficiary_candidate_first_name,beneficiary_candidate_middle_name,beneficiary_candidate_prefix,beneficiary_candidate_suffix,beneficiary_candidate_office,beneficiary_candidate_state,beneficiary_candidate_district,conduit_name,conduit_street_1,conduit_street_2,conduit_city,conduit_state,conduit_zip_code,memo_code,memo_text_description,reference_to_si_or_sl_system_code_that_identifies_the_account
SB29,C00046474,BCC2775E2AF81482DB7A,,,CCM,JESSE ARREGUIN FOR SENATE 2024 ID# 1458186,,,,,,1100 O St.,Suite 200,Sacramento,CA,958145711,G2024,,2024-10-16,2500.00,,Contribution to State Committee,,,,,,,,,,,,,,,,,,,,,
SB29,C00046474,BECD0AF62880D463C89D,,,CCM,Friends of David Gonzalez,,,,,,311 South Halsted,,Chicago Heights,IL,604118216,O2025,Cycle,2024-10-16,2000.00,,Contribution to State Committee,,,,,,,,,,,,,,,,,,,,,
SB29,C00046474,B371C4DBF40354631A5E,,,COM,Ford Motor Company Civic Action Fund -MO,,,,,,1201 N W Briacliff Pkwy,,Kansas City,MO,641161878,O2024,Other,2024-10-16,5000.00,,PAC to PAC Contribution,,,,,,,,,,,,,,,,,,,,,
SB29,C00046474,B935FBAA610414D4D80E,,,PTY,House Republican Majority,,,,,,1548 Bond Street,Suite 102,Naperville,IL,605636509,O2024,Other,2024-10-11,2500.00,,Contribution to State Committee,,,,,,,,,,,,,,,,,,,,,
SB29,C00046474,B5FD50A69CB80423C934,,,CCM,"Efstration for House, Inc.",,,,,,PO Box 1656,,Dacula,GA,300190028,G2024,,2024-10-11,500.00,,Contribution to State Committee,,,,,,,,,,,,,,,,,,,,,
