form_type,filer_committee_id_number,transaction_id_number,back_reference_tran_id_number,back_reference_sched_name,entity_type,payee_organization_name,payee_last_name,payee_first_name,payee_middle_name,payee_prefix,payee_suffix,payee_street_1,payee_street_2,payee_city,payee_state,payee_zip_code,election_code,election_other_description,expenditure_date,expenditure_amount,semi_annual_refunded_bundled_amt,expenditure_purpose_descrip,category_code,beneficiary_committee_fec_id,beneficiary_committee_name,beneficiary_candidate_fec_id,beneficiary_candidate_last_name,beneficiary_candidate_first_name,beneficiary_candidate_middle_name,beneficiary_candidate_prefix,beneficiary_candidate_suffix,beneficiary_candidate_office,beneficiary_candidate_state,beneficiary_candidate_district,conduit_name,conduit_street_1,conduit_street_2,conduit_city,conduit_state,conduit_zip_code,memo_code,memo_text_description,reference_to_si_or_sl_system_code_that_identifies_the_account
SB29,C00051979,11472971,,,COM,Citizens to Elect Mike McKay,,,,,,407 Washington Street,,Cumberland,MD,21502,,,2023-01-05,250.00,0.00,"Michael McKay, STATE SENATE 1st MD",011,,,,McKay,Michael,W.,MD Sen.,,,,,,,,,,,,"Michael McKay, STATE SENATE 1st MD"
SB29,C00051979,11473253,,,COM,Citizens for Adrienne Jones,,,,,,3314 Peddicoat Court,,Woodstock,MD,21163,,,2023-01-05,500.00,0.00,"Adrienne Jones, STATE HOUSE 10th MD",011,,,,Jones,Adrienne,A.,MD Del.,,,,,,,,,,,,"Adrienne Jones, STATE HOUSE 10th MD"
SB29,C00051979,11473262,,,COM,Citizens for Brian Feldman,,,,,,12517 Palatine Court,,Potomac,MD,20854,,,2023-01-05,500.00,0.00,"Brian Feldman, STATE SENATE 15th MD",011,,,,Feldman,Brian,J.,MD Sen.,,,,,,,,,,,,"Brian Feldman, STATE SENATE 15th MD"
SB29,C00051979,11473263,,,COM,Committee to Elect C.T. Wilson,,,,,,8963 Armor Court,,White Plains,MD,20695,,,2023-01-05,500.00,0.00,"C.T. Wilson, STATE HOUSE 28th MD",011,,,,Wilson,C.T.,,MD Del.,,,,,,,,,,,,"C.T. Wilson, STATE HOUSE 28th MD"
SB29,C00051979,11491328,,,COM,Brenner for Ohio,,,,,,102 W Lincoln Ave,,Delaware,OH,43015,,,2023-01-27,1000.00,0.00,"Andrew Brenner, STATE SENATE 19th OH",011,,,,Brenner,Andrew,O.,OH Sen.,,,,,,,,,,,,"Andrew Brenner, STATE SENATE 19th OH"
SB29,C00051979,11491334,,,COM,Hoagland for Ohio,,,,,,5751 Township Road 120,,Adena,OH,43901,,,2023-01-27,1000.00,0.00,"Frank Hoagland, STATE SENATE 30th OH",011,,,,Hoagland,Frank,B.,OH Sen.,,,,,,,,,,,,"Frank Hoagland, STATE SENATE 30th OH"
SB29,C00051979,11491336,,,COM,Kristina Daley Roegner for Ohio,,,,,,1556 East Hines Hill Rd,,Hudson,OH,44236,,,2023-01-27,1000.00,0.00,"Kristina Roegner, STATE SENATE 27th OH",011,,,,Roegner,Kristina,Daley,OH Sen.,,,,,,,,,,,,"Kristina Roegner, STATE SENATE 27th OH"
SB29,C00051979,11491338,,,COM,Citizens for Schuring Committee,,,,,,330 Third St NW,,Canton,OH,44702,,,2023-01-27,1000.00,0.00,"J. Kirk Schuring, STATE SENATE 29th OH",011,,,,Schuring,J. Kirk,,OH Sen.,,,,,,,,,,,,"J. Kirk Schuring, STATE SENATE 29th OH"
SB29,C00051979,11491339,,,COM,Steve Wilson for Ohio,,,,,,102 E Orchard Ave,,Lebanon,OH,45036,,,2023-01-27,1000.00,0.00,"Steven Wilson, STATE SENATE 7th OH",011,,,,Wilson,Steven,P.,OH Sen.,,,,,,,,,,,,"Steven Wilson, STATE SENATE 7th OH"
