form_type,filer_committee_id_number,transaction_id_number,back_reference_tran_id_number,back_reference_sched_name,entity_type,payee_organization_name,payee_last_name,payee_first_name,payee_middle_name,payee_prefix,payee_suffix,payee_street_1,payee_street_2,payee_city,payee_state,payee_zip_code,election_code,election_other_description,expenditure_date,expenditure_amount,semi_annual_refunded_bundled_amt,expenditure_purpose_descrip,category_code,beneficiary_committee_fec_id,beneficiary_committee_name,beneficiary_candidate_fec_id,beneficiary_candidate_last_name,beneficiary_candidate_first_name,beneficiary_candidate_middle_name,beneficiary_candidate_prefix,beneficiary_candidate_suffix,beneficiary_candidate_office,beneficiary_candidate_state,beneficiary_candidate_district,conduit_name,conduit_street_1,conduit_street_2,conduit_city,conduit_state,conduit_zip_code,memo_code,memo_text_description,reference_to_si_or_sl_system_code_that_identifies_the_account
SB29,C00236778,500066876,,,ORG,Fentrice Driskell for State House,,,,,,701 S. Howard Ave,#106-813,Tampa,FL,336062473,P2024,,2023-11-16,1000.00,0.00,Contribution to State Lawmaker - FL,011,,,,,,,,,,,,,,,,,,,Contribution made to FL state lawmaker
SB29,C00236778,500066875,,,COM,Friends of Jeff Waldstreicher,,,,,,1215 E Fort Ave,Ste 106,Baltimore,MD,212305276,P2026,,2023-11-14,2500.00,0.00,Contribution to Federal Candidate,011,,,,,,,,,,,,,,,,,,,11/29/23 event
SB29,C00236778,500066877,,,ORG,"Hillary Cassel, Democrat for State House District 101",,,,,,3475 Sheridan St,Ste 203,Hollywood,FL,330213659,P2024,,2023-11-17,1000.00,0.00,Contribution to FL State Lawmaker,011,,,,,,,,,,,,,,,,,,,Contribution to FL State Lawmaker
SB29,C00236778,500066880,,,ORG,"Jason Pizzo, Democrat for State Senate, District 37",,,,,,3475 Sheridan St,Ste 211,Hollywood,FL,330213659,P2026,,2023-11-17,1000.00,0.00,Contribution to FL State Lawmaker,011,,,,,,,,,,,,,,,,,,,Contribution to FL State Lawmaker
SB29,C00236778,500066879,,,ORG,"Tina Polsky, Democrat for State Senate, District 30",,,,,,5301 N Federal Hwy,Ste 135,Boca Raton,FL,334874908,P2026,,2023-11-20,1000.00,0.00,Contribution to FL State Lawmaker,011,,,,,,,,,,,,,,,,,,,Contribution to FL State Lawmaker
