form_type,filer_committee_id_number,transaction_id_number,back_reference_tran_id_number,back_reference_sched_name,entity_type,payee_organization_name,payee_last_name,payee_first_name,payee_middle_name,payee_prefix,payee_suffix,payee_street_1,payee_street_2,payee_city,payee_state,payee_zip_code,election_code,election_other_description,expenditure_date,expenditure_amount,semi_annual_refunded_bundled_amt,expenditure_purpose_descrip,category_code,beneficiary_committee_fec_id,beneficiary_committee_name,beneficiary_candidate_fec_id,beneficiary_candidate_last_name,beneficiary_candidate_first_name,beneficiary_candidate_middle_name,beneficiary_candidate_prefix,beneficiary_candidate_suffix,beneficiary_candidate_office,beneficiary_candidate_state,beneficiary_candidate_district,conduit_name,conduit_street_1,conduit_street_2,conduit_city,conduit_state,conduit_zip_code,memo_code,memo_text_description,reference_to_si_or_sl_system_code_that_identifies_the_account
SB23,C00433060,BBCCCAD9699ED4722855,,,CCM,Buddy Carter For Congress,,,,,,P. O. Box 10570,,Savannah,GA,31412,P2024,,2024-05-09,1000.00,,contribution-GA01,011,C00543967,Buddy Carter For Congress,H4GA01039,Carter,Earl Leroy,,,,H,GA,01,,,,,,,,,
SB23,C00433060,BE3D1149A89B2490595C,,,CCM,Mario Diaz-Balart for Congress,,,,,,"8724 S.W. 72nd Street, #420",,Miami,FL,33173,G2024,,2024-05-09,1000.00,,contribution-FL26,011,C00376087,Mario Diaz-Balart for Congress,H2FL25018,Diaz-Balart,Mario,,,,H,FL,26,,,,,,,,,
SB23,C00433060,B87A10406D4444FB19B7,,,CCM,Nicole for New York,,,,,,P. O. Box 60487,,Staten Island,NY,10306,G2024,,2024-05-09,1000.00,,contribution-NY11,011,C00694778,Nicole for New York,H0NY11078,Malliotakis,Nicole,,,,H,NY,11,,,,,,,,,
SB23,C00433060,BA0FCA7C873834F75A4D,,,CCM,"Steil for Wisconsin, Inc.",,,,,,"1818 Milton Avenue, #1448",,Janesville,WI,53545,G2024,,2024-05-09,1000.00,,contribution-WI01,011,C00677286,"Steil for Wisconsin, Inc.",H8WI01156,Steil,Bryan George,,,,H,WI,01,,,,,,,,,
SB23,C00433060,BC04E851321D14A3A819,,,PAC,Team America - Bringing America Together PAC,,,,,,P. O. Box 30844,,Bethesda,MD,20824,O2024,Annual,2024-05-09,1000.00,,contribution,011,C00647354,Team America - Bringing America Together PAC,,,,,,,,,,,,,,,,,,
