form_type,filer_committee_id_number,transaction_id_number,back_reference_tran_id_number,back_reference_sched_name,entity_type,payee_organization_name,payee_last_name,payee_first_name,payee_middle_name,payee_prefix,payee_suffix,payee_street_1,payee_street_2,payee_city,payee_state,payee_zip_code,election_code,election_other_description,expenditure_date,expenditure_amount,semi_annual_refunded_bundled_amt,expenditure_purpose_descrip,category_code,beneficiary_committee_fec_id,beneficiary_committee_name,beneficiary_candidate_fec_id,beneficiary_candidate_last_name,beneficiary_candidate_first_name,beneficiary_candidate_middle_name,beneficiary_candidate_prefix,beneficiary_candidate_suffix,beneficiary_candidate_office,beneficiary_candidate_state,beneficiary_candidate_district,conduit_name,conduit_street_1,conduit_street_2,conduit_city,conduit_state,conduit_zip_code,memo_code,memo_text_description,reference_to_si_or_sl_system_code_that_identifies_the_account
SB29,C00808998,501165180,,,ORG,Amalgamated Bank,,,,,,1825 K St NW,,Washington,DC,200061202,,,2024-04-26,12.00,0.00,Non-Contribution Account: Bank Fee,,,,,,,,,,,,,,,,,,,,
SB29,C00808998,501165181,,,ORG,Amalgamated Bank,,,,,,1825 K St NW,,Washington,DC,200061202,,,2024-04-26,32.00,0.00,Non-Contribution Account: Bank Fee,,,,,,,,,,,,,,,,,,,,
SB29,C00808998,501165182,,,ORG,Amalgamated Bank,,,,,,1825 K St NW,,Washington,DC,200061202,,,2024-04-26,12.00,0.00,Non-Contribution Account: Bank Fee,,,,,,,,,,,,,,,,,,,,
SB29,C00808998,501157545,,,ORG,Elias Law Group,,,,,,250 Massachusetts Ave NW,Ste 400,Washington,DC,200015825,,,2024-04-05,163.80,0.00,Non-Contribution Account: Legal Services,,,,,,,,,,,,,,,,,,,,
SB29,C00808998,501159136,,,ORG,"EveryAction, Inc.",,,,,,655 15th St NW,Ste 650,Washington,DC,200055738,,,2024-04-03,969.90,0.00,Non-Contribution Account: Database Software,,,,,,,,,,,,,,,,,,,,
SB29,C00808998,501157552,,,IND,,Jones,Sam,,,,110 Winooski Falls Way,Unit 406,Winooski,VT,054042285,,,2024-04-10,1000.00,0.00,Non-Contribution Account: Contracting Work,,,,,,,,,,,,,,,,,,,,
SB29,C00808998,501162690,,,ORG,MBA Consulting Group,,,,,,611 Pennsylvania Ave SE,Ste 143,Washington,DC,200034303,,,2024-04-16,2500.00,0.00,Non-Contribution Account: Compliance Services,,,,,,,,,,,,,,,,,,,,
