form_type,filer_committee_id_number,transaction_id_number,back_reference_tran_id_number,back_reference_sched_name,entity_type,payee_organization_name,payee_last_name,payee_first_name,payee_middle_name,payee_prefix,payee_suffix,payee_street_1,payee_street_2,payee_city,payee_state,payee_zip_code,election_code,election_other_description,expenditure_date,expenditure_amount,semi_annual_refunded_bundled_amt,expenditure_purpose_descrip,category_code,beneficiary_committee_fec_id,beneficiary_committee_name,beneficiary_candidate_fec_id,beneficiary_candidate_last_name,beneficiary_candidate_first_name,beneficiary_candidate_middle_name,beneficiary_candidate_prefix,beneficiary_candidate_suffix,beneficiary_candidate_office,beneficiary_candidate_state,beneficiary_candidate_district,conduit_name,conduit_street_1,conduit_street_2,conduit_city,conduit_state,conduit_zip_code,memo_code,memo_text_description,reference_to_si_or_sl_system_code_that_identifies_the_account
SB23,C00437244,18073574,,,CCM,Paul Tonko For Congress,,,,,,911 Central Avenue,# 221,Albany,NY,12206,P2024,,2024-03-04,1000.00,0.00,,011,C00450049,Paul Tonko For Congress,H8NY21203,Tonko,Paul,,Rep.,,H,NY,20,,,,,,,,
SB23,C00437244,18073575,,,CCM,Richard E Neal For Congress Committee,,,,,,76 Magnolia Terrace,,Springfield,MA,01108,P2024,,2024-03-04,2500.00,0.00,,011,C00226522,Richard E Neal For Congress Committee,H8MA02041,Neal,Richard,,Rep.,,H,MA,01,,,,,,,,
SB23,C00437244,18073577,,,CCM,John Curtis for Utah,,,,,,"370 East South Temple, Suite 580",,Salt Lake City,UT,84111,P2024,,2024-03-04,1500.00,0.00,,011,C00647339,John Curtis for Utah,H8UT03238,Curtis,John,,Rep.,,H,UT,03,,,,,,,,
SB23,C00437244,18073578,,,CCM,Friends Of Raja For Congress,,,,,,PO Box 681202,,Schaumburg,IL,60168,P2024,,2024-03-04,2500.00,0.00,,011,C00575092,Friends Of Raja For Congress,H6IL08147,Krishnamoorthi,Raja,,Rep.,,H,IL,08,,,,,,,,
SB23,C00437244,18073580,,,CCM,Nikki For Congress,,,,,,PO Box 5171,,Springfield,IL,62705,P2024,,2024-03-04,1000.00,0.00,,011,C00787812,Nikki For Congress,H2IL13153,Budzinski,Nikki,,Rep.,,H,IL,13,,,,,,,,
SB23,C00437244,18102247,,,CCM,Mikie Sherrill For Congress,,,,,,P.O. Box 43032,,Montclair,NJ,07043,P2024,,2024-03-13,250.00,0.00,,011,C00640003,Mikie Sherrill For Congress,H8NJ11142,Sherrill,Mikie,,Rep.,,H,NJ,11,,,,,,,,
SB23,C00437244,18105104,,,CCM,MARTIN HEINRICH FOR SENATE,,,,,,P.O. BOX 25763,,ALBUQUERQUE,NM,87125,G2024,,2024-03-25,1000.00,0.00,,011,C00434563,MARTIN HEINRICH FOR SENATE,S2NM00088,,,,,,S,NM,,,,,,,,,
