form_type,filer_committee_id_number,transaction_id_number,back_reference_tran_id_number,back_reference_sched_name,entity_type,payee_organization_name,payee_last_name,payee_first_name,payee_middle_name,payee_prefix,payee_suffix,payee_street_1,payee_street_2,payee_city,payee_state,payee_zip_code,election_code,election_other_description,expenditure_date,expenditure_amount,semi_annual_refunded_bundled_amt,expenditure_purpose_descrip,category_code,beneficiary_committee_fec_id,beneficiary_committee_name,beneficiary_candidate_fec_id,beneficiary_candidate_last_name,beneficiary_candidate_first_name,beneficiary_candidate_middle_name,beneficiary_candidate_prefix,beneficiary_candidate_suffix,beneficiary_candidate_office,beneficiary_candidate_state,beneficiary_candidate_district,conduit_name,conduit_street_1,conduit_street_2,conduit_city,conduit_state,conduit_zip_code,memo_code,memo_text_description,reference_to_si_or_sl_system_code_that_identifies_the_account
SB23,C00731414,11659674,,,CCM,Ken Calvert For Congress Committee,,,,,,PO Box 2438,,Corona,CA,92878,G2022,,2023-11-30,-1500.00,0.00,Void - Ken Calvert For Congress Committee; Orig Rpt 6/15/22,011,C00257337,Ken Calvert For Congress Committee,H2CA37023,Calvert,Ken,,Rep.,,H,CA,41,,,,,,,,Void - Ken Calvert For Congress Committee; Orig Rpt 6/15/22
SB23,C00731414,11659677,,,PAC,America's First PAC,,,,,,"8401 Excelsior Drive, #103",,Madison,WI,53717,,,2023-11-30,-2500.00,0.00,Void - America's First PAC; Orig Rpt 12/16/22,011,C00524314,,,,,,,,,,,,,,,,,,Void - America's First PAC; Orig Rpt 12/16/22
SB23,C00731414,11659678,,,CCM,Citizens For Turner,,,,,,120 W 2nd Street,Suite 1510,Dayton,OH,454021603,P2024,,2023-11-30,-500.00,0.00,Void - Citizens For Turner; Orig Rpt 3/23/23,011,C00373001,Citizens For Turner,H2OH03067,Turner,Mike,,Rep.,,H,OH,10,,,,,,,,Void - Citizens For Turner; Orig Rpt 3/23/23
SB23,C00731414,11662909,,,CCM,Michael Waltz For Congress,,,,,,"1235 Providence Blvd., Ste R",Pmb 502,Deltona,FL,32725,P2024,,2023-11-30,-2500.00,0.00,Void - Orig rep'd 6/21/23,011,C00666396,Michael Waltz For Congress,H8FL06148,Waltz,Mike,,Rep.,,H,FL,06,,,,,,,,Void - Orig rep'd 6/21/23
SB23,C00731414,11662910,,,CCM,Rob Wittman For Congress,,,,,,PO Box 427,,Alexandria,VA,22313,P2024,,2023-11-30,-2000.00,0.00,Void - Orig rep'd 6/21/23,011,C00441014,Rob Wittman For Congress,H8VA01147,Wittman,Rob,,Rep.,PhD,H,VA,01,,,,,,,,Void - Orig rep'd 6/21/23
SB23,C00731414,11662911,,,CCM,Rob Wittman For Congress,,,,,,PO Box 427,,Alexandria,VA,22313,P2024,,2023-11-30,-1000.00,0.00,Void - Orig rep'd 9/20/23,011,C00441014,Rob Wittman For Congress,H8VA01147,Wittman,Rob,,Rep.,PhD,H,VA,01,,,,,,,,Void - Orig rep'd 9/20/23
