form_type,filer_committee_id_number,transaction_id_number,back_reference_tran_id_number,back_reference_sched_name,entity_type,payee_organization_name,payee_last_name,payee_first_name,payee_middle_name,payee_prefix,payee_suffix,payee_street_1,payee_street_2,payee_city,payee_state,payee_zip_code,election_code,election_other_description,expenditure_date,expenditure_amount,semi_annual_refunded_bundled_amt,expenditure_purpose_descrip,category_code,beneficiary_committee_fec_id,beneficiary_committee_name,beneficiary_candidate_fec_id,beneficiary_candidate_last_name,beneficiary_candidate_first_name,beneficiary_candidate_middle_name,beneficiary_candidate_prefix,beneficiary_candidate_suffix,beneficiary_candidate_office,beneficiary_candidate_state,beneficiary_candidate_district,conduit_name,conduit_street_1,conduit_street_2,conduit_city,conduit_state,conduit_zip_code,memo_code,memo_text_description,reference_to_si_or_sl_system_code_that_identifies_the_account
SB23,C00110338,51134082,,,PAC,DAKOTA PAC,,,,,,1029 No. 5th Street,,Bismarck,ND,58501,,,2024-12-17,5000.00,0.00,,011,C00493072,,,,,,,,,,,,,,,,,,
SB23,C00110338,51138518,,,PAC,Defending Our Conservative Senate PAC (DOC's PAC),,,,,,2817 N Jefferson Street,,Arlington,VA,22207,,,2024-12-17,5000.00,0.00,,011,C00632323,,,,,,,,,,,,,,,,,,
SB23,C00110338,51138949,,,PAC,Electing Majority Making Effective Republicans (Emmer PAC),,,,,,,,,,,,,2024-12-17,5000.00,0.00,,011,,,,,,,,,,,,,,,,,,,
SB23,C00110338,51138966,,,CCM,Dr. Raul Ruiz For Congress,,,,,,PO Box 1566,,Indio,CA,92202,P2021,,2024-12-17,5000.00,0.00,,011,C00502575,Dr. Raul Ruiz For Congress,H2CA36439,Ruiz,Raul,,Rep.,M.D.,H,CA,25,,,,,,,,
SB23,C00110338,51138969,,,CCM,Sydney Kamlager-Dove For Congress,,,,,,777 S. Figueroa St.,Ste. 4050,Los Angeles,CA,90017,P2021,,2024-12-17,5000.00,0.00,,011,C00795823,Sydney Kamlager-Dove For Congress,H2CA37304,Kamlager-Dove,Sydney,,Rep.,,H,CA,37,,,,,,,,
SB23,C00110338,51139031,,,PAC,Badlands PAC,,,,,,PO Box 26141,,Alexandria,VA,22314,,,2024-12-17,5000.00,0.00,,011,C00543207,,,,,,,,,,,,,,,,,,
