form_type,filer_committee_id_number,transaction_id_number,back_reference_tran_id_number,back_reference_sched_name,entity_type,payee_organization_name,payee_last_name,payee_first_name,payee_middle_name,payee_prefix,payee_suffix,payee_street_1,payee_street_2,payee_city,payee_state,payee_zip_code,election_code,election_other_description,expenditure_date,expenditure_amount,semi_annual_refunded_bundled_amt,expenditure_purpose_descrip,category_code,beneficiary_committee_fec_id,beneficiary_committee_name,beneficiary_candidate_fec_id,beneficiary_candidate_last_name,beneficiary_candidate_first_name,beneficiary_candidate_middle_name,beneficiary_candidate_prefix,beneficiary_candidate_suffix,beneficiary_candidate_office,beneficiary_candidate_state,beneficiary_candidate_district,conduit_name,conduit_street_1,conduit_street_2,conduit_city,conduit_state,conduit_zip_code,memo_code,memo_text_description,reference_to_si_or_sl_system_code_that_identifies_the_account
SB23,C00545236,500287271,,,CCM,APRIL MCCLAIN DELANEY FOR CONGRESS,,,,,,PO Box 83940,,Gaithersburg,MD,208833940,G2024,,2024-04-18,500.00,0.00,Federal Candidate Committee Political Contribution,011,C00854471,,,DELANEY,APRIL,MCCLAIN,,,H,MD,06,,,,,,,,
SB23,C00545236,500287269,,,CCM,BONNIE WATSON COLEMAN FOR CONGRESS,,,,,,918 Pennsylvania Ave SE,,Washington,DC,200032140,G2024,,2024-05-29,1000.00,0.00,Federal Candidate Committee Contribution,011,C00558437,,,COLEMAN,BONNIE WATSON,,,,H,NJ,12,,,,,,,,
SB23,C00545236,500287267,,,CCM,EMILIA SYKES FOR CONGRESS,,,,,,PO Box 1347,,Akron,OH,443091347,G2024,,2024-06-06,2500.00,0.00,Federal Candidate Committee Contribution,011,C00801274,,,SYKES,EMILIA,,,,H,Oh,13,,,,,,,,
SB23,C00545236,500287264,,,CCM,LAMONICA MCIVER FOR CONGRESS,,,,,,PO Box 25585,,Newark,NJ,071017585,G2024,,2024-06-21,1500.00,0.00,Federal Candidate Committee Contribution,011,C00878603,,,MCIVER,LAMONICA,,,,H,NJ,10,,,,,,,,
SB23,C00545236,500287270,,,CCM,MENENDEZ FOR SENATE,,,,,,PO Box 32248,,Newark,NJ,071020648,G2024,,2024-05-29,1000.00,0.00,Federal Candidate Committee Political Contribution,011,C00264564,,,MENENDEZ,ROBERT,,,,S,NJ,00,,,,,,,,
SB23,C00545236,500287263,,,CCM,MONDAIRE FOR CONGRESS,,,,,,122 C St NW,Ste 360,Washington,DC,200012149,G2024,,2024-06-25,1500.00,0.00,Federal Candidate Committee Contribution,011,C00711150,,,JONES,MONDAIRE,,,,H,NY,10,,,,,,,,
SB23,C00545236,500317476,,,PAC,OHIO GRASSROOTS VICTORY FUND,,,,,,600 Pennsylvania Ave SE,Unit 15180,Washington,DC,200037508,G2024,,2024-06-27,5000.00,0.00,Federal Contribution,011,C00578609,OHIO GRASSROOTS VICTORY FUND,,,,,,,,,,,,,,,,,
SB23,C00545236,500287268,,,CCM,Sanford Bishop For Congress,,,,,,PO Box 909,,Columbus,GA,319020909,G2024,,2024-05-29,1000.00,0.00,Federal Candidate Committee Contribution,011,C00266940,,,Bishop,Sanford,,,,H,GA,02,,,,,,,,
