form_type,filer_committee_id_number,transaction_id_number,back_reference_tran_id_number,back_reference_sched_name,entity_type,payee_organization_name,payee_last_name,payee_first_name,payee_middle_name,payee_prefix,payee_suffix,payee_street_1,payee_street_2,payee_city,payee_state,payee_zip_code,election_code,election_other_description,expenditure_date,expenditure_amount,semi_annual_refunded_bundled_amt,expenditure_purpose_descrip,category_code,beneficiary_committee_fec_id,beneficiary_committee_name,beneficiary_candidate_fec_id,beneficiary_candidate_last_name,beneficiary_candidate_first_name,beneficiary_candidate_middle_name,beneficiary_candidate_prefix,beneficiary_candidate_suffix,beneficiary_candidate_office,beneficiary_candidate_state,beneficiary_candidate_district,conduit_name,conduit_street_1,conduit_street_2,conduit_city,conduit_state,conduit_zip_code,memo_code,memo_text_description,reference_to_si_or_sl_system_code_that_identifies_the_account
SB23,C00166355,EB421,,,COM,"Duarte for Congress, John",,,,,,9460 Tegner Road,,Hilmar,CA,95324,G2024,,2024-06-28,1000.00,,Political Contribution,011,C00808279,"Duarte for Congress, John",,Duarte,John,,,,H,CA,13,,,,,,,,
SB23,C00166355,EB381,,,COM,"Fong for Congress, Vince",,,,,,P.O. Box 11156,,Bakersfield,CA,93389,G2024,,2024-05-06,2500.00,,Political Contribution,011,C00859892,"Fong for Congress, Vince",,Fong,Vince,,,,H,CA,20,,,,,,,,
SB23,C00166355,EB420,,,COM,Friends of John Barrasso,,,,,,P.O. Box 52008,,Casper,WY,82605,G2024,,2024-06-28,2500.00,,Political Contribution,011,C00436386,Friends of John Barrasso,,Barrasso,John,,,,S,WY,,,,,,,,,
SB23,C00166355,EB417,,,COM,Great Lakes PAC,,,,,,328 Massachusetts Avenue NE,,Washington,DC,20002,,,2024-06-07,2500.00,,Political Contribution,011,C00375584,Great Lakes PAC,,,,,,,,,,,,,,,,,
SB23,C00166355,EB418,,,COM,"Panetta for Congress, Jimmy",,,,,,"412 First Street SE, Suite 100",,Washington,DC,20003,G2024,,2024-06-24,5000.00,,Political Contribution,011,C00592154,"Panetta for Congress, Jimmy",,Panetta,Jimmy,,,,H,CA,20,,,,,,,,
SB23,C00166355,EB419,,,COM,"Valadao for Congress, David",,,,,,"2201 Francisco Drive, Suite 140-18",,El Dorado Hills,CA,95762,G2024,,2024-06-24,5000.00,,Political Contribution,011,C00499392,"Valadao for Congress, David",,Valadao,David,,,,H,CA,21,,,,,,,,
