form_type,filer_committee_id_number,transaction_id_number,back_reference_tran_id_number,back_reference_sched_name,entity_type,payee_organization_name,payee_last_name,payee_first_name,payee_middle_name,payee_prefix,payee_suffix,payee_street_1,payee_street_2,payee_city,payee_state,payee_zip_code,election_code,election_other_description,expenditure_date,expenditure_amount,semi_annual_refunded_bundled_amt,expenditure_purpose_descrip,category_code,beneficiary_committee_fec_id,beneficiary_committee_name,beneficiary_candidate_fec_id,beneficiary_candidate_last_name,beneficiary_candidate_first_name,beneficiary_candidate_middle_name,beneficiary_candidate_prefix,beneficiary_candidate_suffix,beneficiary_candidate_office,beneficiary_candidate_state,beneficiary_candidate_district,conduit_name,conduit_street_1,conduit_street_2,conduit_city,conduit_state,conduit_zip_code,memo_code,memo_text_description,reference_to_si_or_sl_system_code_that_identifies_the_account
SB23,C00784959,500318080,,,CCM,Tammy Baldwin for Senate,,,,,,PO Box 696,,Madison,WI,537010696,P2024,,2023-06-27,2000.00,0.00,Contribution to Federal Committee,,C00326801,,,BALDWIN,TAMMY,,,,S,WI,00,,,,,,,,
SB23,C00784959,500307113,,,CCM,Tammy Baldwin for Senate,,,,,,PO Box 696,,Madison,WI,537010696,P2024,,2023-01-30,1000.00,0.00,Contribution to Federal Committee,,C00326801,,,BALDWIN,TAMMY,,,,S,WI,00,,,,,,,,
SB23,C00784959,500307114,,,CCM,Friends of Sherrod Brown,,,,,,600 Pennsylvania Ave SE,Unit 15180,Washington,DC,200037508,P2024,,2023-01-30,1000.00,0.00,Contribution to Federal Committee,,C00264697,,,BROWN,SHERROD,,,,S,OH,00,,,,,,,,
SB23,C00784959,500307115,,,CCM,Bob Casey for Senate Inc,,,,,,PO Box 58746,,Philadelphia,PA,191028746,P2024,,2023-01-30,1000.00,0.00,Contribution to Federal Committee,,C00431056,,,Casey,Bob,,,,S,PA,00,,,,,,,,
SB23,C00784959,500307116,,,CCM,Lauren Underwood for Congress,,,,,,13400 S Route 59,Unit 116,Plainfield,IL,605855830,P2024,,2023-01-31,1000.00,0.00,Contribution to Federal Committee,,C00652719,,,Underwood,Lauren,,,,H,IL,14,,,,,,,,
SB23,C00784959,500307509,,,PTY,DSCC,,,,,,120 Maryland Ave NE,,Washington,DC,200025610,,,2023-02-22,23795.55,0.00,Transfer of Recount Funds,,C00042366,DSCC,,,,,,,,,,,,,,,,,
