form_type,filer_committee_id_number,transaction_id_number,back_reference_tran_id_number,back_reference_sched_name,entity_type,payee_organization_name,payee_last_name,payee_first_name,payee_middle_name,payee_prefix,payee_suffix,payee_street_1,payee_street_2,payee_city,payee_state,payee_zip_code,election_code,election_other_description,expenditure_date,expenditure_amount,semi_annual_refunded_bundled_amt,expenditure_purpose_descrip,category_code,beneficiary_committee_fec_id,beneficiary_committee_name,beneficiary_candidate_fec_id,beneficiary_candidate_last_name,beneficiary_candidate_first_name,beneficiary_candidate_middle_name,beneficiary_candidate_prefix,beneficiary_candidate_suffix,beneficiary_candidate_office,beneficiary_candidate_state,beneficiary_candidate_district,conduit_name,conduit_street_1,conduit_street_2,conduit_city,conduit_state,conduit_zip_code,memo_code,memo_text_description,reference_to_si_or_sl_system_code_that_identifies_the_account
SB29,C00354290,B50638ED48CAE4A37B8A,,,COM,Tim Temple Campaign,,,,,,"7901 Wrenwood Avenue, Suite C",,Baton Rouge,LA,708091774,P2027,,2024-07-10,-1000.00,,VOID - Contribution to State Committee,,,,,,,,,,,,,,,,,,,,,
SB29,C00354290,B29E4ED00D5D44D4AA79,,,COM,JOE NEGUSE FOR CONGRESS,,,,,,"499 S Capitol St. SW,",Suite 420,Washington,DC,200034027,G2024,,2024-07-16,2000.00,,Contribution to Committee,,,,,,,,,,,,,,,,,,,,,
SB29,C00354290,B650E16D76B8443CFAA1,,,COM,Nevada Way PAC,,,,,,PO Box 751271,,Las Vegas,NV,891361271,O2024,Other,2024-07-17,2500.00,,Contribution to State Committee,,,,,,,,,,,,,,,,,,,,,
SB29,C00354290,BDF4F69E0CEFA4FB69EA,,,COM,Roger Niello for Senate 2026,,,,,,4204 H Street,,Sacramento,CA,958193425,P2026,,2024-07-30,1000.00,,Contribution to State Committee,,,,,,,,,,,,,,,,,,,,,
SB29,C00354290,B0491DBDF8A264A1C98E,,,COM,Rosilicie Ochoa Bogh for Senate 2024,,,,,,9460 Tegner Road,,Hilmar,CA,953249320,G2024,,2024-07-30,1000.00,,Contribution to State Committee,,,,,,,,,,,,,,,,,,,,,
