form_type,filer_committee_id_number,transaction_id_number,back_reference_tran_id_number,back_reference_sched_name,entity_type,payee_organization_name,payee_last_name,payee_first_name,payee_middle_name,payee_prefix,payee_suffix,payee_street_1,payee_street_2,payee_city,payee_state,payee_zip_code,election_code,election_other_description,expenditure_date,expenditure_amount,semi_annual_refunded_bundled_amt,expenditure_purpose_descrip,category_code,beneficiary_committee_fec_id,beneficiary_committee_name,beneficiary_candidate_fec_id,beneficiary_candidate_last_name,beneficiary_candidate_first_name,beneficiary_candidate_middle_name,beneficiary_candidate_prefix,beneficiary_candidate_suffix,beneficiary_candidate_office,beneficiary_candidate_state,beneficiary_candidate_district,conduit_name,conduit_street_1,conduit_street_2,conduit_city,conduit_state,conduit_zip_code,memo_code,memo_text_description,reference_to_si_or_sl_system_code_that_identifies_the_account
SB23,C00478743,SB23.4216,,,CCM,BRITTANY PETTERSEN FOR COLORADO,,,,,,PO BOX 150887,,LAKEWOOD,CO,80215,G2024,,2024-08-12,200.00,,Expenditure,,C00637215,BRITTANY PETTERSEN FOR COLORADO,,,,,,,H,CO,07,,,,,,,,
SB23,C00478743,SB23.4226,,,CCM,CARAVEO FOR CONGRESS,,,,,,PO BOX 953,,EASTLAKE,CO,80614,G2024,,2024-08-12,400.00,,Expenditure,,C00787788,CARAVEO FOR CONGRESS,,,,,,,H,CO,08,,,,,,,,
SB23,C00478743,SB23.4218,,,CCM,GABE VASQUEZ FOR CONGRESS,,,,,,DRAWER L,,MESILLA,NM,88046,G2024,,2024-08-12,200.00,,Expenditure,,C00789404,GABE VASQUEZ FOR CONGRESS,,,,,,,H,NM,02,,,,,,,,
SB23,C00478743,SB23.4196,,,CCM,JASON CROW FOR CONGRESS,,,,,,PO BOX 32145,,AURORA,CO,80041,G2024,,2024-08-12,200.00,,Expenditure,,C00637363,JASON CROW FOR CONGRESS,,,,,,,H,CO,06,,,,,,,,
SB23,C00478743,SB23.4197,,,CCM,JOE NEGUSE FOR CONGRESS,,,,,,PO BOX 7142,,BOULDER,CO,80306,G2024,,2024-08-12,200.00,,Expenditure,,C00648253,JOE NEGUSE FOR CONGRESS,,,,,,,H,CO,02,,,,,,,,
SB23,C00478743,SB23.4220,,,CCM,MARTIN HEINRICH FOR SENATE,,,,,,PO BOX 25763,,ALBUQUERQUE,NM,87125,G2024,,2024-08-12,200.00,,Expenditure,,C00434563,MARTIN HEINRICH FOR SENATE,,,,,,,S,NM,00,,,,,,,,
SB23,C00478743,SB23.4222,,,CCM,MELANIE FOR NEW MEXICO,,,,,,PO BOX 51493,,ALBUQUERQUE,NM,87181,G2024,,2024-08-12,200.00,,Expenditure,,C00765099,MELANIE FOR NEW MEXICO,,,,,,,H,NM,01,,,,,,,,
SB23,C00478743,SB23.4224,,,CCM,TERESA FOR ALL,,,,,,PO BOX 2675,,SANTA FE,NM,87504,G2024,,2024-08-12,200.00,,Expenditure,,C00704049,TERESA FOR ALL,,,,,,,H,NM,03,,,,,,,,
