form_type,filer_committee_id_number,transaction_id_number,back_reference_tran_id_number,back_reference_sched_name,entity_type,payee_organization_name,payee_last_name,payee_first_name,payee_middle_name,payee_prefix,payee_suffix,payee_street_1,payee_street_2,payee_city,payee_state,payee_zip_code,election_code,election_other_description,expenditure_date,expenditure_amount,semi_annual_refunded_bundled_amt,expenditure_purpose_descrip,category_code,beneficiary_committee_fec_id,beneficiary_committee_name,beneficiary_candidate_fec_id,beneficiary_candidate_last_name,beneficiary_candidate_first_name,beneficiary_candidate_middle_name,beneficiary_candidate_prefix,beneficiary_candidate_suffix,beneficiary_candidate_office,beneficiary_candidate_state,beneficiary_candidate_district,conduit_name,conduit_street_1,conduit_street_2,conduit_city,conduit_state,conduit_zip_code,memo_code,memo_text_description,reference_to_si_or_sl_system_code_that_identifies_the_account
SB23,C00163212,SB23.5493,,,CCM,DAN NEWHOUSE FOR CONGRESS,,,,,,PO BOX 10949,,YAKIMA,WA,98909,P2024,,2023-06-22,2000.00,,Contribution,,C00559393,DAN NEWHOUSE FOR CONGRESS,H4WA04104,NEWHOUSE,DANIEL MILTON,,,,H,WA,04,,,,,,,,
SB23,C00163212,SB23.5480,,,CCM,JOHN DUARTE FOR CONGRESS,,,,,,9460 TEGNER ROAD,,HILMAR,CA,95324,P2024,,2023-05-11,1000.00,,Contribution,,C00808279,JOHN DUARTE FOR CONGRESS,H2CA13131,DUARTE,JOHN,,,,H,CA,13,,,,,,,,
SB23,C00163212,SB23.5476,,,CCM,KAY GRANGER CAMPAIGN FUND,,,,,,1701 RIVER RUN,STE 308,FORT WORTH,TX,76107,P2024,,2023-04-13,5000.00,,Contribution,,C00310532,KAY GRANGER CAMPAIGN FUND,H6TX12060,GRANGER,KAY,,,,H,TX,12,,,,,,,,
SB23,C00163212,SB23.5490,,,CCM,MANCHIN FOR WEST VIRGINIA,,,,,,PO BOX 5202,,CHARLESTON,WV,25361,P2024,,2023-06-07,1000.00,,Contribution,,C00486563,MANCHIN FOR WEST VIRGINIA,S0WV00090,MANCHIN,JOE III,,,,S,WV,00,,,,,,,,
SB23,C00163212,SB23.5483,,,CCM,ROBERT ADERHOLT FOR CONGRESS,,,,,,P. O. BOX 1158,,HALEYVILLE,AL,35565,P2024,,2023-06-01,2500.00,,Contribution,,C00313247,ROBERT ADERHOLT FOR CONGRESS,H6AL04098,ADERHOLT,ROBERT B. REP.,,,,H,AL,04,,,,,,,,
SB23,C00163212,SB23.5479,,,CCM,SALAZAR FOR CONGRESS,,,,,,3725 WEST FLAGLER STREET,#281,MIAMI,FL,33134,P2024,,2023-05-08,2500.00,,Contribution,,C00714261,SALAZAR FOR CONGRESS,H8FL27185,SALAZAR,MARIA ELVIRA,,,,H,FL,27,,,,,,,,
SB23,C00163212,SB23.5486,,,CCM,VERONICA ESCOBAR FOR CONGRESS,,,,,,PO BOX 3961,,EL PASO,TX,79923,P2024,,2023-06-03,2000.00,,Contribution,,C00653923,VERONICA ESCOBAR FOR CONGRESS,H8TX16109,ESCOBAR,VERONICA,,,,H,TX,16,,,,,,,,
