form_type,filer_committee_id_number,transaction_id_number,back_reference_tran_id_number,back_reference_sched_name,entity_type,payee_organization_name,payee_last_name,payee_first_name,payee_middle_name,payee_prefix,payee_suffix,payee_street_1,payee_street_2,payee_city,payee_state,payee_zip_code,election_code,election_other_description,expenditure_date,expenditure_amount,semi_annual_refunded_bundled_amt,expenditure_purpose_descrip,category_code,beneficiary_committee_fec_id,beneficiary_committee_name,beneficiary_candidate_fec_id,beneficiary_candidate_last_name,beneficiary_candidate_first_name,beneficiary_candidate_middle_name,beneficiary_candidate_prefix,beneficiary_candidate_suffix,beneficiary_candidate_office,beneficiary_candidate_state,beneficiary_candidate_district,conduit_name,conduit_street_1,conduit_street_2,conduit_city,conduit_state,conduit_zip_code,memo_code,memo_text_description,reference_to_si_or_sl_system_code_that_identifies_the_account
SB29,C00027359,48453858,,,COM,Citizens for Day,,,,,,75A Lake Road,#311,Congers,NY,109202343,,,2023-02-22,500.00,0.00,"Ed Day, COUNTY EXECUTIVE  NY",011,,,,Day,Ed,,,,,,,,,,,,,,"Ed Day, COUNTY EXECUTIVE  NY"
SB29,C00027359,48453957,,,COM,Lander 2025,,,,,,C/O John Bartos,"515 E. 86th Street, Apt. 802",New York,NY,10028,,,2023-02-22,1000.00,0.00,"Brad Lander, CITY COMPTROLLER  NY",011,,,,Lander,Brad,,,,,,,,,,,,,,"Brad Lander, CITY COMPTROLLER  NY"
SB29,C00027359,48453965,,,COM,Friends of Dan Aussem,,,,,,1131 Post Street,,Ottawa,IL,61350,,,2023-02-22,4000.00,0.00,"Dan Aussem, CITY COMMISSIONER  IL",011,,,,Aussem,Dan,,,,,,,,,,,,,,"Dan Aussem, CITY COMMISSIONER  IL"
SB29,C00027359,48453967,,,COM,Citizens for Deborah Frank Feinen,,,,,,3305 Springview Lane,,Champaign,IL,618226179,,,2023-02-22,500.00,0.00,"Deborah Frank Feinen, MAYOR  IL",011,,,,Feinen,Deborah Frank,,,,,,,,,,,,,,"Deborah Frank Feinen, MAYOR  IL"
SB29,C00027359,48457307,,,COM,IW3 PAC,,,,,,2201 Liberty Avenue,,Pittsburgh,PA,15222,,,2023-02-23,2699.44,0.00,Contribution to State PAC,011,,,,,,,,,,,,,,,,,,,Contribution to State PAC
SB29,C00027359,48457314,,,COM,Rolison for NY,,,,,,P.O. Box 950,,Poughkeepsie,NY,12602,,,2023-02-27,550.00,0.00,"Rob Rolison, STATE SENATE 39th NY",011,,,,Rolison,Rob,,,,,,,,,,,,,,"Rob Rolison, STATE SENATE 39th NY"
SB29,C00027359,48457316,,,COM,Friends to Elect Harry Benton,,,,,,13250 Sunderlin Road,,Plainfield,IL,60585,,,2023-02-27,500.00,0.00,"Harry Benton, STATE HOUSE 97th IL",011,,,,Benton,Harry,,,,,,,,,,,,,,"Harry Benton, STATE HOUSE 97th IL"
