form_type,filer_committee_id_number,transaction_id_number,back_reference_tran_id_number,back_reference_sched_name,entity_type,payee_organization_name,payee_last_name,payee_first_name,payee_middle_name,payee_prefix,payee_suffix,payee_street_1,payee_street_2,payee_city,payee_state,payee_zip_code,election_code,election_other_description,expenditure_date,expenditure_amount,semi_annual_refunded_bundled_amt,expenditure_purpose_descrip,category_code,beneficiary_committee_fec_id,beneficiary_committee_name,beneficiary_candidate_fec_id,beneficiary_candidate_last_name,beneficiary_candidate_first_name,beneficiary_candidate_middle_name,beneficiary_candidate_prefix,beneficiary_candidate_suffix,beneficiary_candidate_office,beneficiary_candidate_state,beneficiary_candidate_district,conduit_name,conduit_street_1,conduit_street_2,conduit_city,conduit_state,conduit_zip_code,memo_code,memo_text_description,reference_to_si_or_sl_system_code_that_identifies_the_account
SB23,C00084871,49799557,,,CCM,Lisa Blunt Rochester for Senate,,,,,,PO Box 9767,,Wilmington,DE,19809,P2024,,2024-02-02,2500.00,0.00,Contribution,011,C00843391,Lisa Blunt Rochester for Senate,S4DE00060,Blunt Rochester,Lisa,,Rep.,,S,DE,,,,,,,,,Contribution
SB23,C00084871,49799558,,,PAC,Congressional Black Caucus PAC,,,,,,413 New Jersey Ave SE,,Washington,DC,20003,,,2024-02-02,5000.00,0.00,Contribution,011,C00147512,,,,,,,,,,,,,,,,,,Contribution
SB23,C00084871,49799559,,,PAC,New Democrat Coalition Action Fund,,,,,,"600 Pennsylvania Avenue SE, Suite",,Washington,DC,20003,,,2024-02-02,5000.00,0.00,Contribution,011,C00409730,,,,,,,,,,,,,,,,,,Contribution
SB23,C00084871,49799560,,,PAC,National Association of Manufacturers PAC (NAM-PAC),,,,,,"733 10th Street NW, Suite 700",,Washington,DC,20001,,,2024-02-02,5000.00,0.00,Contribution,011,C00541169,,,,,,,,,,,,,,,,,,Contribution
SB23,C00084871,49799561,,,PAC,American Chemistry Council PAC,,,,,,700 2nd Street NE,,Washington,DC,200028100,,,2024-02-04,5000.00,0.00,Contribution,011,C00252338,,,,,,,,,,,,,,,,,,Contribution
