form_type,filer_committee_id_number,transaction_id_number,back_reference_tran_id_number,back_reference_sched_name,entity_type,payee_organization_name,payee_last_name,payee_first_name,payee_middle_name,payee_prefix,payee_suffix,payee_street_1,payee_street_2,payee_city,payee_state,payee_zip_code,election_code,election_other_description,expenditure_date,expenditure_amount,semi_annual_refunded_bundled_amt,expenditure_purpose_descrip,category_code,beneficiary_committee_fec_id,beneficiary_committee_name,beneficiary_candidate_fec_id,beneficiary_candidate_last_name,beneficiary_candidate_first_name,beneficiary_candidate_middle_name,beneficiary_candidate_prefix,beneficiary_candidate_suffix,beneficiary_candidate_office,beneficiary_candidate_state,beneficiary_candidate_district,conduit_name,conduit_street_1,conduit_street_2,conduit_city,conduit_state,conduit_zip_code,memo_code,memo_text_description,reference_to_si_or_sl_system_code_that_identifies_the_account
SB29,C00344663,20445795,,,COM,Lacey Hull Campaign,,,,,,PO Box 19231,,Houston,TX,77224,,,2024-10-23,2500.00,0.00,"Lacey Hull, STATE HOUSE 138th TX",011,,,,Hull,Lacey,,TX Rep.,,,,,,,,,,,,"Lacey Hull, STATE HOUSE 138th TX"
SB29,C00344663,20450503,,,COM,Interhab Champion Fund,,,,,,"700 SW Jackson Street, Suite 1100",,Topeka,KS,66603,,,2024-10-28,250.00,0.00,,011,,,,,,,,,,,,,,,,,,,
SB29,C00344663,20450504,,,COM,Troy Waymaster for Kansas House,,,,,,3528 192nd Street,,Bunker Hill,KS,67626,,,2024-10-28,500.00,0.00,"Troy Waymaster, STATE HOUSE 109th KS",011,,,,Waymaster,Troy,,KS Rep.,,,,,,,,,,,,"Troy Waymaster, STATE HOUSE 109th KS"
SB29,C00344663,20450508,,,COM,Will Carpenter for Kansas House,,,,,,6965 SW 18th Street,,El Dorado,KS,67042,,,2024-10-28,500.00,0.00,"Will Carpenter, STATE HOUSE 75th KS",011,,,,Carpenter,Will,,KS Rep.,,,,,,,,,,,,"Will Carpenter, STATE HOUSE 75th KS"
SB29,C00344663,20450509,,,COM,Renee Erickson for Kansas Senate,,,,,,26 N Cypress Drive,,Wichita,KS,67206,,,2024-10-28,250.00,0.00,"Renee Erickson, STATE SENATE 30th KS",011,,,,Erickson,Renee,,KS Sen.,,,,,,,,,,,,"Renee Erickson, STATE SENATE 30th KS"
SB29,C00344663,20450557,,,COM,Rick Billinger Campaign Fund,,,,,,PO Box 594,,Goodland,KS,67735,,,2024-10-28,500.00,0.00,"Rick Billinger, STATE SENATE 40th KS",011,,,,Billinger,Rick,,KS Sen.,,,,,,,,,,,,"Rick Billinger, STATE SENATE 40th KS"
