form_type,filer_committee_id_number,transaction_id_number,back_reference_tran_id_number,back_reference_sched_name,entity_type,payee_organization_name,payee_last_name,payee_first_name,payee_middle_name,payee_prefix,payee_suffix,payee_street_1,payee_street_2,payee_city,payee_state,payee_zip_code,election_code,election_other_description,expenditure_date,expenditure_amount,semi_annual_refunded_bundled_amt,expenditure_purpose_descrip,category_code,beneficiary_committee_fec_id,beneficiary_committee_name,beneficiary_candidate_fec_id,beneficiary_candidate_last_name,beneficiary_candidate_first_name,beneficiary_candidate_middle_name,beneficiary_candidate_prefix,beneficiary_candidate_suffix,beneficiary_candidate_office,beneficiary_candidate_state,beneficiary_candidate_district,conduit_name,conduit_street_1,conduit_street_2,conduit_city,conduit_state,conduit_zip_code,memo_code,memo_text_description,reference_to_si_or_sl_system_code_that_identifies_the_account
SB23,C00275230,SB23-EX3707,,,CCM,Committee To Elect Don Ipson,,,,,,539 Diagonal Street,,St George,UT,84720,G2024,,2024-09-05,250.00,0.00,,011,,Committee To Elect Don Ipson,,,,,,,,,,,,,,,,,Political Contributions
SB23,C00275230,SB23-EX3781,,,CCM,David Hinkins Senate Campaign,,,,,,225 W 500 S,,Orangeville,UT,84537,G2024,,2024-09-18,250.00,0.00,,011,,David Hinkins Senate Campaign,,,,,,,,,,,,,,,,,Political Contributions
SB23,C00275230,SB23-EX3704,,,CCM,Committee to Elect Mike Mckell,,,,,,642 Kirby Lane,Suite 105,Spanish Fork,UT,84660,G2024,,2024-09-05,250.00,0.00,,011,,Committee to Elect Mike Mckell,,,,,,,,,,,,,,,,,Political Contributions
SB23,C00275230,SB23-EX3703,,,CCM,Committee To Elect Lincoln Fillmore,,,,,,10167 S. 1190 W.,,South Jordan,UT,84095,G2024,,2024-09-05,250.00,0.00,,011,,Committee To Elect Lincoln Fillmore,,,,,,,,,,,,,,,,,Political Contributions
SB23,C00275230,SB23-EX3694,,,CCM,Texans For Morgan Luttrell,,,,,,P.O. Box 1245,,Magnolia,TX,77353,G2024,,2024-08-26,2000.00,0.00,,011,,Texans For Morgan Luttrell,,,,,,,,,,,,,,,,,Political Contributions
SB23,C00275230,SB23-EX3697,,,CCM,Friends Of Chris Wilson,,,,,,1367 Cedarwood Ln,,Logan,UT,84341,G2024,,2024-09-05,250.00,0.00,,011,,Friends Of Chris Wilson,,,,,,,,,,,,,,,,,Political Contributions
SB23,C00275230,SB23-EX3699,,,CCM,Committee to Elect Todd Weiler,,,,,,1248 W 1900 S,,Woodscross,UT,84116,G2024,,2024-09-05,250.00,0.00,,011,,Committee to Elect Todd Weiler,,,,,,,,,,,,,,,,,Political Contributions
SB23,C00275230,SB23-EX3780,,,CCM,Riebe For Senate,,,,,,9040 S Greenhills Dr,,Cottonwood Heights,UT,84093,G2024,,2024-09-18,250.00,0.00,,011,,Riebe For Senate,,,,,,,,,,,,,,,,,Political Contributions
SB23,C00275230,SB23-EX3750,,,CCM,Utah Republican Senate Campaign Commitee,,,,,,P.O. Box 1949,,Layton,UT,84041,G2024,,2024-09-05,1000.00,0.00,,011,,Utah Republican Senate Campaign Commitee,,,,,,,,,,,,,,,,,Political Contributions
