form_type,filer_committee_id_number,transaction_id_number,back_reference_tran_id_number,back_reference_sched_name,entity_type,payee_organization_name,payee_last_name,payee_first_name,payee_middle_name,payee_prefix,payee_suffix,payee_street_1,payee_street_2,payee_city,payee_state,payee_zip_code,election_code,election_other_description,expenditure_date,expenditure_amount,semi_annual_refunded_bundled_amt,expenditure_purpose_descrip,category_code,beneficiary_committee_fec_id,beneficiary_committee_name,beneficiary_candidate_fec_id,beneficiary_candidate_last_name,beneficiary_candidate_first_name,beneficiary_candidate_middle_name,beneficiary_candidate_prefix,beneficiary_candidate_suffix,beneficiary_candidate_office,beneficiary_candidate_state,beneficiary_candidate_district,conduit_name,conduit_street_1,conduit_street_2,conduit_city,conduit_state,conduit_zip_code,memo_code,memo_text_description,reference_to_si_or_sl_system_code_that_identifies_the_account
SB23,C00820167,EB66,,,COM,CHC Bold PAC,,,,,,PO Box 33079,,Washington,DC,20033,,,2023-02-24,2500.00,,,011,C00365536,CHC Bold PAC,,,,,,,,,,,,,,,,,
SB23,C00820167,EB67,,,COM,Congressional Black Caucus PAC,,,,,,PO Box 33079,,Washington,DC,20033,,,2023-02-24,2500.00,,,011,C00147512,Congressional Black Caucus PAC,,,,,,,,,,,,,,,,,
SB23,C00820167,EB68,,,COM,Lisa Blunt Rochester for Congress,,,,,,PO Box 9767,,Wilmington,DE,19809,P2024,,2023-02-24,1000.00,,,011,C00590778,Lisa Blunt Rochester for Congress,,Rochester,Lisa Blunt,,,,H,DE,,,,,,,,,
SB23,C00820167,EB69,,,COM,New Democrat Coalition Action Fund,,,,,,"233 Pennsylvania Ave, SE",,Washington,DC,20003,,,2023-02-24,1000.00,,,011,C00409730,New Democrat Coalition Action Fund,,,,,,,,,,,,,,,,,
SB23,C00820167,EB70,,,COM,Republican Governance Group/Tuesday Group PAC,,,,,,610 S. Boulevard,,Tampa,FL,33606,,,2023-02-24,2500.00,,,011,C00433060,Republican Governance Group/Tuesday Group PAC,,,,,,,,,,,,,,,,,
SB23,C00820167,EB76,,,COM,DSCC,,,,,,"120 Maryland Ave, NE",,Washington,DC,20002,,,2023-04-21,2000.00,,,011,C00042366,DSCC,,,,,,,,,,,,,,,,,
SB23,C00820167,EB75,,,COM,Kevin Kiley for Congress,,,,,,9458 Treelake Road,,Granite Bay,CA,95746,P2024,,2023-04-21,1000.00,,,011,C00801985,Kevin Kiley for Congress,,Kiley,Kevin,,,,H,CA,03,,,,,,,,
SB23,C00820167,EB77,,,COM,Michelle Steel for Congress,,,,,,"9070 Irvine Center Drive, Ste. 150",,Irvine,CA,92618,P2024,,2023-06-21,1500.00,,,011,C00704981,Michelle Steel for Congress,,Steel,Michelle,,,,H,CA,45,,,,,,,,
