form_type,filer_committee_id_number,payee_organization_name,payee_last_name,payee_first_name,payee_middle_name,payee_prefix,payee_suffix,payee_street_1,payee_street_2,payee_city,payee_state,payee_zip_code,expenditure_date,expenditure_purpose_descrip,beneficiary_committee_name,beneficiary_candidate_last_name,beneficiary_candidate_first_name,beneficiary_candidate_middle_name,beneficiary_candidate_prefix,beneficiary_candidate_suffix,category_code,beneficiary_candidate_office,beneficiary_candidate_state,beneficiary_candidate_district,election_code,election_other_description,expenditure_amount,semi_annual_refunded_bundled_amt,memo_code,memo_text_description,image_number,beneficiary_committee_fec_id
SB21B,C00536722,"DOBBINS, DIANE L",,,,,,3415 HOTLAM RD,,REDDING,CA,96002,2023-09-26,REIMBURSE FOR POSTAGE FOR FEC MAILINGS,,,,,,,,,,,O,POSTAGE,19.30,,,,202401220300458257
SB21B,C00536722,SHASTA COUNTY DEMOCRATIC CENTRAL COMMITTEE,,,,,,900 LOCUST ST,,REDDING,CA,96001,2023-07-06,RENT FOR OFFICE/MEETING SPACE,,,,,,,,,,,O,RENT,150.00,,,,202401220300458257,C00530808
SB21B,C00536722,SHASTA COUNTY DEM CENTRAL COMMITTEE,,,,,,900 LOCUST ST,,REDDING,CA,96001,2023-11-14,RENT FOR OFFICE / MEETING SPACE,,,,,,,,,,,O,RENT,150.00,,,,202401220300458257,C00530808
SB21B,C00536722,"DOBBINS, DIANE L",,,,,,3415 HOTLAM RD,,REDDING,CA,96002,2023-10-12,REIMBURSE FOR POSTAGE FOR FEC FILING,,,,,,,,,,,O,REIMBURSEMENT,19.30,,,,202401220300458259
SB21B,C00536722,"CARCAMO, ELSA",,,,,,825 LOCUST ST,,REDDING,CA,96001,2023-10-12,REIMBURSEMENT FOR PO BOX RENTAL,,,,,,,,,,,O,,194.00,,,,202401220300458259
SB21B,C00536722,TRI-COUNTIES BANK,,,,,,,,,,,2023-10-01,BANK FEES FOR RETURNED STATEMENTS,,,,,,,,,,,,,10.00,,,,202401220300458259
