form_type,filer_committee_id_number,transaction_id_number,back_reference_tran_id_number,back_reference_sched_name,entity_type,payee_organization_name,payee_last_name,payee_first_name,payee_middle_name,payee_prefix,payee_suffix,payee_street_1,payee_street_2,payee_city,payee_state,payee_zip_code,election_code,election_other_description,expenditure_date,expenditure_amount,semi_annual_refunded_bundled_amt,expenditure_purpose_descrip,category_code,beneficiary_committee_fec_id,beneficiary_committee_name,beneficiary_candidate_fec_id,beneficiary_candidate_last_name,beneficiary_candidate_first_name,beneficiary_candidate_middle_name,beneficiary_candidate_prefix,beneficiary_candidate_suffix,beneficiary_candidate_office,beneficiary_candidate_state,beneficiary_candidate_district,conduit_name,conduit_street_1,conduit_street_2,conduit_city,conduit_state,conduit_zip_code,memo_code,memo_text_description,reference_to_si_or_sl_system_code_that_identifies_the_account
SB23,C00114702,15850489,,,CCM,Robert Aderholt For Congress,,,,,,P. O. Box 1158,940 Hwy 13,Haleyville,AL,35565,P2024,,2023-07-12,3000.00,0.00,,011,C00313247,Robert Aderholt For Congress,,Aderholt,Robert,B.,Rep.,,H,AL,04,,,,,,,,
SB23,C00114702,15860405,,,CCM,People For Derek Kilmer,,,,,,PO Box 1574,,Gig Harbor,WA,98335,P2024,,2023-09-12,3000.00,0.00,,011,C00514893,People For Derek Kilmer,H2WA06129,Kilmer,Derek,,Mr.,,H,WA,06,,,,,,,,
SB23,C00114702,15860406,,,CCM,Dan Newhouse For Congress,,,,,,PO Box 10949,,Yakima,WA,98909,P2024,,2023-09-12,3000.00,0.00,,011,C00559393,Dan Newhouse For Congress,H4WA04104,Newhouse,Dan,,Rep.,,H,WA,04,,,,,,,,
SB23,C00114702,15860407,,,CCM,Mark Pocan For Congress,,,,,,PO Box 327,,Madison,WI,53701,P2024,,2023-09-12,3000.00,0.00,,011,C00502179,Mark Pocan For Congress,H2WI02124,Pocan,Mark,,Rep.,,H,WI,02,,,,,,,,
SB23,C00114702,15860421,,,CCM,Van Orden For Congress,,,,,,PO Box 1836,,La Crosse,WI,54602,P2024,,2023-09-12,5000.00,0.00,,011,C00742007,Van Orden For Congress,H0WI03175,Van Orden,Derrick,,Rep.,,H,WI,03,,,,,,,,
SB23,C00114702,15860453,,,CCM,Tammy Baldwin For Senate,,,,,,P.O. Box 696,,Madison,WI,53701,P2024,,2023-09-12,2500.00,0.00,,011,C00326801,Tammy Baldwin For Senate,S2WI00219,Baldwin,Tammy,,Sen.,,S,WI,,,,,,,,,
SB23,C00114702,15860455,,,CCM,Tammy Baldwin For Senate,,,,,,P.O. Box 696,,Madison,WI,53701,G2024,,2023-09-12,2500.00,0.00,,011,C00326801,Tammy Baldwin For Senate,S2WI00219,Baldwin,Tammy,,Sen.,,S,WI,,,,,,,,,
SB23,C00114702,15860456,,,CCM,Friends Of Glenn Thompson,,,,,,400 N. Michael Street,,St. Marys,PA,15857,P2024,,2023-09-12,2500.00,0.00,,011,C00444620,Friends Of Glenn Thompson,H8PA05071,Thompson,Glenn,,Rep.,,H,PA,15,,,,,,,,
SB23,C00114702,15868774,,,CCM,The Bill Keating Committee,,,,,,P.O. Box 3065,,Buzzards Bay,MA,02532,P2024,,2023-09-26,3000.00,0.00,,011,C00479063,The Bill Keating Committee,H0MA10082,Keating,William,,Rep.,,H,MA,10,,,,,,,,
