form_type,filer_committee_id_number,transaction_id_number,back_reference_tran_id_number,back_reference_sched_name,entity_type,payee_organization_name,payee_last_name,payee_first_name,payee_middle_name,payee_prefix,payee_suffix,payee_street_1,payee_street_2,payee_city,payee_state,payee_zip_code,election_code,election_other_description,expenditure_date,expenditure_amount,semi_annual_refunded_bundled_amt,expenditure_purpose_descrip,category_code,beneficiary_committee_fec_id,beneficiary_committee_name,beneficiary_candidate_fec_id,beneficiary_candidate_last_name,beneficiary_candidate_first_name,beneficiary_candidate_middle_name,beneficiary_candidate_prefix,beneficiary_candidate_suffix,beneficiary_candidate_office,beneficiary_candidate_state,beneficiary_candidate_district,conduit_name,conduit_street_1,conduit_street_2,conduit_city,conduit_state,conduit_zip_code,memo_code,memo_text_description,reference_to_si_or_sl_system_code_that_identifies_the_account
SB29,C00762666,29-01-00849-01212,,,CCM,JD for Arlington,,,,,,PO Box 41964,,Arlington,VA,22204,,,2023-01-09,1000.00,,Contribution to Non-Federal Candidate,,,JD for Arlington,,,,,,,,,,,,,,,,,
SB29,C00762666,29-01-00866-01241,,,CCM,Sabina Covo for Miami Commissoiner,,,,,,1742 W. Flagler Street,,Miami,FL,33135,,,2023-02-17,1000.00,,Contribution to Non-Federal Candidate,,,Sabina Covo for Miami Commissoiner,,,,,,,,,,,,,,,,,
SB29,C00762666,29-01-00867-01242,,,CCM,Buddy Wheatley For Secretary Of State,,,,,,1003 Russell Street,,Covington,KY,41011,,,2023-02-19,2000.00,,Contribution to Non-Federal Candidate,,,Buddy Wheatley For Secretary Of State,,,,,,,,,,,,,,,,,
SB29,C00762666,29-01-00868-01243,,,CCM,Enlow for Ag Commissioner 2023,,,,,,7840 Bardstown Rd,,Hodgenville,KY,42748,,,2023-02-19,2000.00,,Contribution to Non-Federal Candidate,,,Enlow for Ag Commissioner 2023,,,,,,,,,,,,,,,,,
SB29,C00762666,29-01-00869-01244,,,CCM,Friends of Kim Reeder,,,,,,P.O. Box 1358,,Frankfort,KY,40602,,,2023-02-19,2000.00,,Contribution to Non-Federal Candidate,,,Friends of Kim Reeder,,,,,,,,,,,,,,,,,
SB29,C00762666,29-01-00870-01245,,,CCM,Michael Bowman for State Treasurer,,,,,,13503 Kinross Blvd,,Louisville,KY,40272,,,2023-02-19,2000.00,,Contribution to Non-Federal Candidate,,,Michael Bowman for State Treasurer,,,,,,,,,,,,,,,,,
SB29,C00762666,29-01-00932-01350,,,ORG,"National Security Leaders for America, Inc.",,,,,,8113 Saxony Drive,,Annandale,VA,22030,,,2023-05-25,30000.00,,Donation,,,,,,,,,,,,,,,,,,,,
SB29,C00762666,29-00-00198-00198,,,PAC,Honor Bound PAC,,,,,,PO Box 95,,Lexington,KY,40588,,,2023-06-27,60147.40,,Inkind: Offset Non-Contribution Account,,C00711549,Honor Bound PAC,,,,,,,,,,,,,,,,,
SB29,C00762666,29-00-00202-00202,,,PAC,Honor Bound PAC,,,,,,PO Box 95,,Lexington,KY,40588,,,2023-06-28,153974.08,,Inkind: Offset Non-Contribution Account,,C00711549,Honor Bound PAC,,,,,,,,,,,,,,,,,
