form_type,filer_committee_id_number,transaction_id_number,back_reference_tran_id_number,back_reference_sched_name,entity_type,payee_organization_name,payee_last_name,payee_first_name,payee_middle_name,payee_prefix,payee_suffix,payee_street_1,payee_street_2,payee_city,payee_state,payee_zip_code,election_code,election_other_description,expenditure_date,expenditure_amount,semi_annual_refunded_bundled_amt,expenditure_purpose_descrip,category_code,beneficiary_committee_fec_id,beneficiary_committee_name,beneficiary_candidate_fec_id,beneficiary_candidate_last_name,beneficiary_candidate_first_name,beneficiary_candidate_middle_name,beneficiary_candidate_prefix,beneficiary_candidate_suffix,beneficiary_candidate_office,beneficiary_candidate_state,beneficiary_candidate_district,conduit_name,conduit_street_1,conduit_street_2,conduit_city,conduit_state,conduit_zip_code,memo_code,memo_text_description,reference_to_si_or_sl_system_code_that_identifies_the_account
SB23,C00434811,18023777,,,PAC,Blue Dog Political Action Committee,,,,,,PO BOX 83142,,Gaithersburg,MD,20883,,,2024-02-06,5000.00,0.00,Contribution to federal committee,011,C00305318,,,,,,,,,,,,,,,,,,Contribution to federal committee
SB23,C00434811,18023778,,,CCM,Steve Daines For Montana,,,,,,PO Box 1598,,Helena,MT,596241598,P2026,,2024-02-06,2000.00,0.00,Contribution to federal candidate,011,C00491357,Steve Daines For Montana,S2MT00096,Daines,Steve,,Sen.,,S,MT,,,,,,,,,Contribution to federal candidate
SB23,C00434811,18023779,,,PAC,Congressional Black Caucus (CBCPAC),,,,,,1100 New Jersey Avenue SE #2410,,Washington,DC,20003,,,2024-02-06,5000.00,0.00,Contribution to a federal committee,011,,,,,,,,,,,,,,,,,,,Contribution to a federal committee
SB23,C00434811,18023780,,,PAC,Moderate Democrats PAC (ModSquad PAC),,,,,,c/o Benchmark Strategies,PO Box 70179,Washington,DC,20024,,,2024-02-06,5000.00,0.00,Contribution to federal committee,011,,,,,,,,,,,,,,,,,,,Contribution to federal committee
SB23,C00434811,18023781,,,CCM,People For Ben,,,,,,PO Box 25371,,Albuquerque,NM,87125,P2026,,2024-02-06,2000.00,0.00,Contribution to a federal candidate,011,C00443689,People For Ben,S0NM00058,Lujan,Ben Ray,,Sen.,Jr.,H,NM,02,,,,,,,,Contribution to a federal candidate
SB23,C00434811,18023782,,,PAC,Future Forum PAC,,,,,,PO Box 83142,,Gaithersburg,MD,20883,,,2024-02-06,5000.00,0.00,Contribution to a federal committee,011,C00625988,,,,,,,,,,,,,,,,,,Contribution to a federal committee
SB23,C00434811,18023783,,,CCM,Scott Peters For Congress,,,,,,PO Box 22074,,San Diego,CA,92192,P2024,,2024-02-06,1000.00,0.00,Contribution to federal candidate,011,C00503110,Scott Peters For Congress,H2CA52089,Peters,Scott,,Rep.,,H,CA,50,,,,,,,,Contribution to federal candidate
SB23,C00434811,18074382,,,CCM,Dr Kim Schrier For Congress,,,,,,PO Box 2728,,Issaquah,WA,98027,P2024,,2024-02-23,1000.00,0.00,Contribution to Federal Candidate,011,C00652628,Dr Kim Schrier For Congress,H8WA08189,Schrier,Kim,,Rep.,M.D.,H,WA,08,,,,,,,,Contribution to Federal Candidate
