form_type,filer_committee_id_number,transaction_id_number,back_reference_tran_id_number,back_reference_sched_name,entity_type,payee_organization_name,payee_last_name,payee_first_name,payee_middle_name,payee_prefix,payee_suffix,payee_street_1,payee_street_2,payee_city,payee_state,payee_zip_code,election_code,election_other_description,expenditure_date,expenditure_amount,semi_annual_refunded_bundled_amt,expenditure_purpose_descrip,category_code,beneficiary_committee_fec_id,beneficiary_committee_name,beneficiary_candidate_fec_id,beneficiary_candidate_last_name,beneficiary_candidate_first_name,beneficiary_candidate_middle_name,beneficiary_candidate_prefix,beneficiary_candidate_suffix,beneficiary_candidate_office,beneficiary_candidate_state,beneficiary_candidate_district,conduit_name,conduit_street_1,conduit_street_2,conduit_city,conduit_state,conduit_zip_code,memo_code,memo_text_description,reference_to_si_or_sl_system_code_that_identifies_the_account
SB23,C00240093,SB23.4997,,,PAC,ARKANSAS FOR LEADERSHIP POLITICAL ACTION COMMITTEE (ARKPAC),,,,,,PO BOX 1672,,ALEXANDRIA,VA,22313,G2024,,2024-01-26,1000.00,,,011,C00413948,ARKANSAS FOR LEADERSHIP POLITICAL ACTION COMMITTEE (ARKPAC),,,,,,,,,,,,,,,,,
SB23,C00240093,SB23.4996,,,CCM,FRIENDS OF MICHAEL GUEST,,,,,,POST OFFICE BOX 470,,BRANDON,MS,39043,G2024,,2024-01-26,1000.00,,,011,C00665752,FRIENDS OF MICHAEL GUEST,H8MS03125,GUEST,MICHAEL PATRICK,,,,H,MS,03,,,,,,,,
SB23,C00240093,SB23.4995,,,CCM,JOHN DUARTE FOR CONGRESS,,,,,,9460 TEGNER ROAD,,HILMAR,CA,95324,G2024,,2024-01-26,1000.00,,,011,C00808279,JOHN DUARTE FOR CONGRESS,H2CA13131,DUARTE,JOHN,,,,H,CA,13,,,,,,,,
SB23,C00240093,SB23.4998,,,CCM,MIKE JOHNSON FOR LOUISIANA,,,,,,2900 CLEARVIEW PKWY,SUITE 206,METAIRIE,LA,70006,G2024,,2024-03-06,1500.00,,,011,C00608695,MIKE JOHNSON FOR LOUISIANA,H6LA04138,JOHNSON,JAMES MICHAEL,,,,H,LA,04,,,,,,,,
SB23,C00240093,SB23.4993,,,CCM,NEHLS FOR CONGRESS,,,,,,15500 VOSS RD,STE 518,SUGAR LAND,TX,77498,G2024,,2024-01-26,5000.00,,,011,C00730150,NEHLS FOR CONGRESS,H0TX22302,NEHLS,TROY,,,,H,TX,22,,,,,,,,
SB23,C00240093,SB23.4994,,,CCM,WOMACK FOR CONGRESS COMMITTEE,,,,,,PO BOX 508,,ROGERS,AR,72757,G2024,,2024-01-26,1000.00,,,011,C00477745,WOMACK FOR CONGRESS COMMITTEE,H0AR03055,WOMACK,STEVE,,,,H,AR,03,,,,,,,,
