form_type,filer_committee_id_number,transaction_id_number,back_reference_tran_id_number,back_reference_sched_name,entity_type,payee_organization_name,payee_last_name,payee_first_name,payee_middle_name,payee_prefix,payee_suffix,payee_street_1,payee_street_2,payee_city,payee_state,payee_zip_code,election_code,election_other_description,expenditure_date,expenditure_amount,semi_annual_refunded_bundled_amt,expenditure_purpose_descrip,category_code,beneficiary_committee_fec_id,beneficiary_committee_name,beneficiary_candidate_fec_id,beneficiary_candidate_last_name,beneficiary_candidate_first_name,beneficiary_candidate_middle_name,beneficiary_candidate_prefix,beneficiary_candidate_suffix,beneficiary_candidate_office,beneficiary_candidate_state,beneficiary_candidate_district,conduit_name,conduit_street_1,conduit_street_2,conduit_city,conduit_state,conduit_zip_code,memo_code,memo_text_description,reference_to_si_or_sl_system_code_that_identifies_the_account
SB23,C00346726,EB6714,,,COM,DCCC,,,,,,"430 South Capitol Street SE, 2nd F",,Washington,DC,20003,,,2024-05-15,15000.00,,,011,C00000935,DCCC,,Party,Political,,,,,,,,,,,,,,
SB23,C00346726,EB6832,,,CCM,Ken Calvert for Congress Committee,,,,,,P.O. Box 2438,,Corona,CA,92878,G2024,,2024-05-10,1000.00,,,011,C00257337,Ken Calvert for Congress Committee,,Calvert,Ken,,,,H,CA,41,,,,,,,,
SB23,C00346726,EB6830,,,CCM,Lou Correa for Congress,,,,,,"3230 Arena Blvd., Ste. 245-416",,Sacramento,CA,95834,G2024,,2024-05-10,5000.00,,,011,C00578302,Lou Correa for Congress,,Correa,Lou,,,,H,CA,46,,,,,,,,
SB23,C00346726,EB6831,,,CCM,Mike Flood for Congress,,,,,,P.O. Box 81041,,Lincoln,NE,68501,P2024,,2024-05-10,1000.00,,,011,C00801241,Mike Flood for Congress,,Flood,Mike,,,,H,NE,01,,,,,,,,
SB23,C00346726,EB7004,,,CCM,Mike Flood for Congress,,,,,,P.O. Box 81041,,Lincoln,NE,68501,G2024,,2024-05-29,1000.00,,,011,C00801241,Mike Flood for Congress,,Flood,Mike,,,,H,NE,01,,,,,,,,
SB23,C00346726,EB6834,,,COM,NRCC,,,,,,320 First Street SE,,Washington,DC,20003,,,2024-05-10,15000.00,,,011,C00075820,NRCC,,Party,Political,,,,,,,,,,,,,,
SB23,C00346726,EB7005,,,CCM,Scott Baugh for Congress,,,,,,4040 MacArthur Blvd.,Suite 200,Newport Beach,CA,92660,G2024,,2024-05-29,1000.00,,,011,C00798322,Scott Baugh for Congress,,Baugh,Scott,,,,H,CA,47,,,,,,,,
SB23,C00346726,EB6833,,,CCM,William Timmons for Congress,,,,,,P.O. Box 3416,,Greenville,SC,29602,P2024,,2024-05-10,3500.00,,,011,C00668491,William Timmons for Congress,,Timmons,William,,,,H,SC,04,,,,,,,,
