form_type,filer_committee_id_number,transaction_id_number,back_reference_tran_id_number,back_reference_sched_name,entity_type,payee_organization_name,payee_last_name,payee_first_name,payee_middle_name,payee_prefix,payee_suffix,payee_street_1,payee_street_2,payee_city,payee_state,payee_zip_code,election_code,election_other_description,expenditure_date,expenditure_amount,semi_annual_refunded_bundled_amt,expenditure_purpose_descrip,category_code,beneficiary_committee_fec_id,beneficiary_committee_name,beneficiary_candidate_fec_id,beneficiary_candidate_last_name,beneficiary_candidate_first_name,beneficiary_candidate_middle_name,beneficiary_candidate_prefix,beneficiary_candidate_suffix,beneficiary_candidate_office,beneficiary_candidate_state,beneficiary_candidate_district,conduit_name,conduit_street_1,conduit_street_2,conduit_city,conduit_state,conduit_zip_code,memo_code,memo_text_description,reference_to_si_or_sl_system_code_that_identifies_the_account
SB23,C00089086,87589206,,,CCM,Steve Daines For Montana,,,,,,PO Box 1598,,Helena,MT,59624,P2024,,2023-10-02,-1500.00,0.00,,011,C00491357,Steve Daines For Montana,S2MT00096,Daines,Steve,,Sen.,,S,MT,,,,,,,,X,Re-designation on 10/02/2023
SB23,C00089086,87866096,,,CCM,Steve Daines For Montana,,,,,,PO Box 1598,,Helena,MT,59624,P2024,,2023-07-25,1500.00,0.00,campaign contribution Funds Reported On <Enter Report Name Here>,011,C00491357,Steve Daines For Montana,S2MT00096,Daines,Steve,,Sen.,,S,MT,,,,,,,,X,campaign contribution Funds Reported On <Enter Report Name Here>
SB23,C00089086,87866097,,,CCM,Steve Daines For Montana,,,,,,PO Box 1598,,Helena,MT,59624,P2026,,2023-10-02,1500.00,0.00,campaign contribution Re-designated funds for trans. dated 7/25/2023,011,C00491357,Steve Daines For Montana,S2MT00096,Daines,Steve,,Sen.,,S,MT,,,,,,,,X,campaign contribution Re-designated funds for trans. dated 7/25/2023
SB23,C00089086,87870026,,,CCM,Jason Smith For Congress,,,,,,PO Box 1324,,Cape Girardeau,MO,63702,G2024,,2023-10-03,5000.00,0.00,campaign contribution,011,C00541862,Jason Smith For Congress,H4MO08162,Smith,Jason,T.,Rep.,,H,MO,08,,,,,,,,campaign contribution
SB23,C00089086,87903586,,,CCM,Buddy Carter For Congress,,,,,,PO Box 10570,,Savannah,GA,31412,P2024,,2023-10-19,1000.00,0.00,campaign contribution,011,C00543967,Buddy Carter For Congress,H4GA01039,Carter,Buddy,,Rep.,,H,GA,01,,,,,,,,campaign contribution
SB23,C00089086,87903587,,,CCM,Doggett For Congress,,,,,,PO Box 5843,,Austin,TX,78763,P2024,,2023-10-19,2500.00,0.00,campaign contribution,011,C00286500,Doggett For Congress,H4TX10028,Doggett,Lloyd,,Rep.,,H,TX,35,,,,,,,,campaign contribution
SB23,C00089086,87903588,,,CCM,Texans For Jodey Arrington,,,,,,PO Box 6687,,Lubbock,TX,79493,P2024,,2023-10-19,1000.00,0.00,campaign contribution,011,C00588657,Texans For Jodey Arrington,H6TX19099,Arrington,Jodey,,Rep.,,H,TX,19,,,,,,,,campaign contribution
SB23,C00089086,87903589,,,CCM,Friends Of Mark Warner,,,,,,201 North Union Street,Suite 300,Alexandria,VA,22314,P2026,,2023-10-19,1000.00,0.00,campaign contribution,011,C00438713,Friends Of Mark Warner,S6VA00093,Warner,Mark,,,,S,VA,,,,,,,,,campaign contribution
