form_type,filer_committee_id_number,transaction_id_number,back_reference_tran_id_number,back_reference_sched_name,entity_type,payee_organization_name,payee_last_name,payee_first_name,payee_middle_name,payee_prefix,payee_suffix,payee_street_1,payee_street_2,payee_city,payee_state,payee_zip_code,election_code,election_other_description,expenditure_date,expenditure_amount,semi_annual_refunded_bundled_amt,expenditure_purpose_descrip,category_code,beneficiary_committee_fec_id,beneficiary_committee_name,beneficiary_candidate_fec_id,beneficiary_candidate_last_name,beneficiary_candidate_first_name,beneficiary_candidate_middle_name,beneficiary_candidate_prefix,beneficiary_candidate_suffix,beneficiary_candidate_office,beneficiary_candidate_state,beneficiary_candidate_district,conduit_name,conduit_street_1,conduit_street_2,conduit_city,conduit_state,conduit_zip_code,memo_code,memo_text_description,reference_to_si_or_sl_system_code_that_identifies_the_account
SB28a,C00797670,B390AED03FEAC419F8A3,,,IND,,Leifer,Alan,,,,86 Clements Rd,,Newton,MA,024582618,,,2024-10-07,3300.00,,Refunded Earmark for COMMITTEE TO ELECT JARED GOLDEN (C00653816),,,,,,,,,,,,,,,,,,,,,
SB28a,C00797670,B0291156F605943E5BC0,,,IND,,Levine,Andrew,,,,301 E 80th St,Apt 7C,New York,NY,100750758,,,2024-10-07,957.00,,Refunded Earmark for MEUSER FOR CONGRESS (C00654723),,,,,,,,,,,,,,,,,,,,,
SB28a,C00797670,B8D4E0C7DB3574DFDB20,,,IND,,Miller,Steve,,,,500 W Madison St,Ste 1000,Chicago,IL,606612559,,,2024-10-07,1700.00,,Refunded Earmark for JEFFRIES FOR CONGRESS (C00503052),,,,,,,,,,,,,,,,,,,,,
SB28a,C00797670,B9451EB25690F4C288EC,,,IND,,Kleinman,Alan,,,,16060 Ventura Blvd,# 300,Encino,CA,914362761,,,2024-10-08,1800.00,,Refunded Earmark for KEN CALVERT FOR CONGRESS COMMITTEE (C00257337),,,,,,,,,,,,,,,,,,,,,
SB28a,C00797670,B655BAB5016A34991BA6,,,IND,,Turk,Diana,,,,5918 Careybrook Dr,,Agoura,CA,913014430,,,2024-10-14,1000.00,,Refunded Earmark for FRIENDS OF DAVID SCHWEIKERT (C00540617),,,,,,,,,,,,,,,,,,,,,
SB28a,C00797670,B7C319AFD06134412929,,,IND,,Goodtree,David,,,,60 Colonial Rd,,Needham,MA,024921613,,,2024-10-09,3300.00,,Refunded Earmark for HOYER FOR CONGRESS (C00140715),,,,,,,,,,,,,,,,,,,,,
SB28a,C00797670,B410DA31C9A6B4AB0821,,,IND,,Risch,Frank,,,,3540 Colgate Ave,,Dallas,TX,752255009,,,2024-10-01,3300.00,,Refunded Earmark for MIKE ROGERS FOR CONGRESS (C00367862),,,,,,,,,,,,,,,,,,,,,
SB28a,C00797670,B2D6D7B21F01C45E6821,,,IND,,Tavakoli,Daniel,,,,150 E 77th St,,New York,NY,100751922,,,2024-10-16,500.00,,Refunded Earmark for COMMITTEE TO ELECT JARED GOLDEN (C00653816),,,,,,,,,,,,,,,,,,,,,
