form_type,filer_committee_id_number,transaction_id_number,back_reference_tran_id_number,back_reference_sched_name,entity_type,payee_organization_name,payee_last_name,payee_first_name,payee_middle_name,payee_prefix,payee_suffix,payee_street_1,payee_street_2,payee_city,payee_state,payee_zip_code,election_code,election_other_description,expenditure_date,expenditure_amount,semi_annual_refunded_bundled_amt,expenditure_purpose_descrip,category_code,beneficiary_committee_fec_id,beneficiary_committee_name,beneficiary_candidate_fec_id,beneficiary_candidate_last_name,beneficiary_candidate_first_name,beneficiary_candidate_middle_name,beneficiary_candidate_prefix,beneficiary_candidate_suffix,beneficiary_candidate_office,beneficiary_candidate_state,beneficiary_candidate_district,conduit_name,conduit_street_1,conduit_street_2,conduit_city,conduit_state,conduit_zip_code,memo_code,memo_text_description,reference_to_si_or_sl_system_code_that_identifies_the_account
SB29,C00516500,SB29.12690,,,ORG,Change Consulting LLC,,,,,,PO Box 10453,,Oakland,CA,94610,,,2024-01-30,13975.00,,Noncontribution. Fees for developing earned media strategy,001,,,,,,,,,,,,,,,,,,,
SB29,C00516500,SB29.12693,,,ORG,Change Consulting LLC,,,,,,PO Box 10453,,Oakland,CA,94610,,,2024-02-23,9000.00,,Noncontribution. Monthly consulting fee,001,,,,,,,,,,,,,,,,,,,
SB29,C00516500,SB29.12694,,,ORG,Change Consulting LLC,,,,,,PO Box 10453,,Oakland,CA,94610,,,2024-03-18,9000.00,,Noncontribution. Monthly consulting fees,001,,,,,,,,,,,,,,,,,,,
SB29,C00516500,SB29.12700,,,ORG,Fourth District Seniors Resource Center,,,,,,570 South 65th St,,San Diego,CA,92114,,,2024-03-25,725.00,,Noncontribution. Venue rental,007,,,,,,,,,,,,,,,,,,,
SB29,C00516500,SB29.12691,,,ORG,L. Norwood and Associates,,,,,,3200 E Guasti Rd. Suite 100,,Ontario,CA,91761,,,2024-02-22,4062.50,,Noncontribution. 50% deposit on So Cal event,007,,,,,,,,,,,,,,,,,,,
SB29,C00516500,SB29.12692,,,ORG,"Mandate Project Impact, Inc.",,,,,,3645 Ruffin Road Suite 200,,San Diego,CA,92123,,,2024-02-22,2500.00,,Noncontribution. Event social media consultant,007,,,,,,,,,,,,,,,,,,,
SB29,C00516500,SB29.12703,,,ORG,PEX Prepaid Debit Card,,,,,,462 - 7th Avenue,21st Floor,New York,NY,10018,,,2024-03-31,75.00,,Noncontribution. Monthly fees.,001,,,,,,,,,,,,,,,,,,,
