form_type,filer_committee_id_number,transaction_id_number,back_reference_tran_id_number,back_reference_sched_name,entity_type,payee_organization_name,payee_last_name,payee_first_name,payee_middle_name,payee_prefix,payee_suffix,payee_street_1,payee_street_2,payee_city,payee_state,payee_zip_code,election_code,election_other_description,expenditure_date,expenditure_amount,semi_annual_refunded_bundled_amt,expenditure_purpose_descrip,category_code,beneficiary_committee_fec_id,beneficiary_committee_name,beneficiary_candidate_fec_id,beneficiary_candidate_last_name,beneficiary_candidate_first_name,beneficiary_candidate_middle_name,beneficiary_candidate_prefix,beneficiary_candidate_suffix,beneficiary_candidate_office,beneficiary_candidate_state,beneficiary_candidate_district,conduit_name,conduit_street_1,conduit_street_2,conduit_city,conduit_state,conduit_zip_code,memo_code,memo_text_description,reference_to_si_or_sl_system_code_that_identifies_the_account
SB23,C00359539,27C39FCE702E7A786B9,,,PAC,First In Freedom PAC,,,,,,824 S Milledge Ave,Ste 101,Athens,GA,30605,O2024,Contribution,2024-11-26,2500.00,,2024 Contribution,011,C00540146,First In Freedom PAC,,,,,,,,,,,,,,,,,
SB23,C00359539,B6F46168D3D68B62326,,,PAC,Freedom Fund,,,,,,824 S Milledge Ave,Ste 101,Athens,GA,30605,O2024,Contribution,2024-11-26,2500.00,,2024 Contribution,011,C00390674,Freedom Fund,,,,,,,,,,,,,,,,,
SB23,C00359539,D0213228698235D309E,,,PAC,Making A Responsible Stand For Households In America PAC,,,,,,PO Box 3241,,Brentwood,TN,37024,O2024,Contribution,2024-12-10,2500.00,,2024 Contribution,011,C00409276,Making A Responsible Stand For Households In America PAC,,,,,,,,,,,,,,,,,
SB23,C00359539,76158A1A9D9117C19ED,,,PAC,Team America - Bringing America Together PAC,,,,,,PO Box 30844,,Bethesda,MD,20824,O2024,Contribution,2024-11-26,1500.00,,2024 Contribution,011,C00647354,Team America - Bringing America Together PAC,,,,,,,,,,,,,,,,,
SB23,C00359539,7D89662C61791800B56,,,PAC,The Eye Of The Tiger Political Action Committee,,,,,,PO Box 9891,,Arlington,VA,222190485,O2024,Contribution,2024-11-26,2500.00,,2024 Contribution,011,C00467431,The Eye Of The Tiger Political Action Committee,,,,,,,,,,,,,,,,,
