form_type,filer_committee_id_number,transaction_id_number,back_reference_tran_id_number,back_reference_sched_name,entity_type,payee_organization_name,payee_last_name,payee_first_name,payee_middle_name,payee_prefix,payee_suffix,payee_street_1,payee_street_2,payee_city,payee_state,payee_zip_code,election_code,election_other_description,expenditure_date,expenditure_amount,semi_annual_refunded_bundled_amt,expenditure_purpose_descrip,category_code,beneficiary_committee_fec_id,beneficiary_committee_name,beneficiary_candidate_fec_id,beneficiary_candidate_last_name,beneficiary_candidate_first_name,beneficiary_candidate_middle_name,beneficiary_candidate_prefix,beneficiary_candidate_suffix,beneficiary_candidate_office,beneficiary_candidate_state,beneficiary_candidate_district,conduit_name,conduit_street_1,conduit_street_2,conduit_city,conduit_state,conduit_zip_code,memo_code,memo_text_description,reference_to_si_or_sl_system_code_that_identifies_the_account
SB23,C00101592,BF47B2B6FA86F4DD3987,,,CCM,Adam Smith for Congress,,,,,,PO Box 578,,Renton,WA,980570578,P2024,,2024-06-17,2000.00,,Political Contribution,,C00304709,Adam Smith for Congress,H6WA09025,Smith,Adam,,,,H,WA,09,,,,,,,,,
SB23,C00101592,BACAFFA2CDD6A474F850,,,CCM,Adam Smith for Congress,,,,,,PO Box 578,,Renton,WA,980570578,G2024,,2024-06-17,2500.00,,Political Contribution,,C00304709,Adam Smith for Congress,H6WA09025,Smith,Adam,,,,H,WA,09,,,,,,,,,
SB23,C00101592,BA54660D6D0244BFFABA,,,PAC,AMERICAN GAS ASSOCIATION POLITICAL ACTION COMMITTEE,,,,,,"400 N. CAPITOL ST., N.W.",,Washington,DC,200011511,O2024,Other,2024-06-17,2500.00,,Political Contribution,,C00007450,AMERICAN GAS ASSOCIATION POLITICAL ACTION COMMITTEE,,,,,,,,,,,,,,,,,,
SB23,C00101592,B2344B5D156FD45FCB32,,,CCM,Citizens to Elect Rick Larsen,,,,,,PO Box 326,,Everett,WA,982060326,G2024,,2024-06-17,1000.00,,Political Contribution,,C00345546,Citizens to Elect Rick Larsen,H0WA02080,Larsen,Rick,,,,H,WA,02,,,,,,,,,
SB23,C00101592,BF68607E5E7574DDBB1F,,,CCM,Citizens to Elect Rick Larsen,,,,,,PO Box 326,,Everett,WA,982060326,P2024,,2024-06-17,1500.00,,Political Contribution,,C00345546,Citizens to Elect Rick Larsen,H0WA02080,Larsen,Rick,,,,H,WA,02,,,,,,,,,
SB23,C00101592,BDD14B4568AF14563936,,,CCM,Delbene For Congress,,,,,,PO Box 477,,Kirkland,WA,980830477,G2024,,2024-06-17,2500.00,,Political Contribution,,C00459099,Delbene For Congress,H0WA08046,DelBene,Suzan,,,,H,WA,01,,,,,,,,,
SB23,C00101592,BE0F98D47CD4542E280D,,,PAC,PowerPAC of Edison Electric Institute,,,,,,701 Pennsylavnia Ave NW,4th Floor,Washington,DC,20004,O2024,Other,2024-06-17,5000.00,,Political Contribution,,C00095869,PowerPAC of Edison Electric Institute,,,,,,,,,,,,,,,,,,
SB23,C00101592,B17FF94A8A5684942BA6,,,CCM,Strickland for Washington,,,,,,600 Pennsylvania Avenue SE,Suite 410,Washington,DC,200034350,G2024,,2024-06-17,2500.00,,Political Contribution,,C00732826,Strickland for Washington,H0WA10034,Strickland,Marilyn,,,,H,WA,10,,,,,,,,,
