form_type,filer_committee_id_number,transaction_id_number,back_reference_tran_id_number,back_reference_sched_name,entity_type,payee_organization_name,payee_last_name,payee_first_name,payee_middle_name,payee_prefix,payee_suffix,payee_street_1,payee_street_2,payee_city,payee_state,payee_zip_code,election_code,election_other_description,expenditure_date,expenditure_amount,semi_annual_refunded_bundled_amt,expenditure_purpose_descrip,category_code,beneficiary_committee_fec_id,beneficiary_committee_name,beneficiary_candidate_fec_id,beneficiary_candidate_last_name,beneficiary_candidate_first_name,beneficiary_candidate_middle_name,beneficiary_candidate_prefix,beneficiary_candidate_suffix,beneficiary_candidate_office,beneficiary_candidate_state,beneficiary_candidate_district,conduit_name,conduit_street_1,conduit_street_2,conduit_city,conduit_state,conduit_zip_code,memo_code,memo_text_description,reference_to_si_or_sl_system_code_that_identifies_the_account
SB23,C00177972,EB2309,,,CCM,Dan Crenshaw for Congress,,,,,,PO Box 430965,,Houston,TX,77243,P2024,,2023-03-08,1000.00,,Contribution,011,C00660795,Dan Crenshaw for Congress,,Crenshaw,Dan,,,,H,TX,02,,,,,,,,
SB23,C00177972,EB2310,,,COM,Mark Green for Congress,,,,,,PO Box 331046,,Nashville,TN,37206,P2024,,2023-03-09,1000.00,,Contribution,011,C00658385,Mark Green for Congress,,Green,Mark,,,,H,TN,07,,,,,,,,
SB23,C00177972,EB2311,,,CCM,Capito for West Virginia,,,,,,PO Box 11519,,Charleston,WV,25339,P2026,,2023-03-16,1000.00,,Contribution,011,C00539825,Capito for West Virginia,,Capito,Shelley,,,,S,WV,,,,,,,,,
SB23,C00177972,EB2312,,,CCM,Friends of Bennie Thompson,,,,,,P.O. Box 100,,Bolton,MS,39041,P2024,,2023-03-20,1500.00,,Contribution,011,C00279851,Friends of Bennie Thompson,,Thompson,Bennie,,,,H,MS,02,,,,,,,,
SB23,C00177972,EB2313,,,COM,Nikema for Congress,,,,,,PO Box 31193,,Atlanta,GA,31131,P2024,,2023-03-20,1000.00,,Contribution,011,C00752584,Nikema for Congress,,Williams,Nikema,,,,H,GA,05,,,,,,,,
SB23,C00177972,EB2314,,,COM,Brian Fitzpatrick for All of Us,,,,,,PO Box 939,,Langhorne,PA,19047,P2024,,2023-03-27,1500.00,,Contribution,011,C00607416,Brian Fitzpatrick for All of Us,,Fitzpatrick,Brian,,,,H,PA,01,,,,,,,,
SB23,C00177972,EB2315,,,COM,Peters for Michigan,,,,,,PO Box 226,,Bloomfield Hills,MI,48303,P2026,,2023-03-27,1000.00,,Contribution,011,C00437889,Peters for Michigan,,Peters,Gary,,,,S,MI,,,,,,,,,
SB23,C00177972,EB2316,,,COM,Haley Stevens for Congress,,,,,,"33717 Woodward Avenue, #539",,Birmingham,MI,48009,P2024,,2023-03-28,1000.00,,Contribution,011,C00638650,Haley Stevens for Congress,,Stevens,Haley,,,,H,MI,11,,,,,,,,
SB23,C00177972,EB2329,,,COM,Angus King for U.S. Senate Campaign,,,,,,PO Box 368,,Brunswick,ME,04011,P2024,,2023-03-31,-1000.00,,Void contribution orig. made 1/20/23.,011,C00516047,Angus King for U.S. Senate Campaign,,King,Angus,,,,S,ME,,,,,,,,,
