form_type,filer_committee_id_number,transaction_id_number,back_reference_tran_id_number,back_reference_sched_name,entity_type,payee_organization_name,payee_last_name,payee_first_name,payee_middle_name,payee_prefix,payee_suffix,payee_street_1,payee_street_2,payee_city,payee_state,payee_zip_code,election_code,election_other_description,expenditure_date,expenditure_amount,semi_annual_refunded_bundled_amt,expenditure_purpose_descrip,category_code,beneficiary_committee_fec_id,beneficiary_committee_name,beneficiary_candidate_fec_id,beneficiary_candidate_last_name,beneficiary_candidate_first_name,beneficiary_candidate_middle_name,beneficiary_candidate_prefix,beneficiary_candidate_suffix,beneficiary_candidate_office,beneficiary_candidate_state,beneficiary_candidate_district,conduit_name,conduit_street_1,conduit_street_2,conduit_city,conduit_state,conduit_zip_code,memo_code,memo_text_description,reference_to_si_or_sl_system_code_that_identifies_the_account
SB23,C00100107,D9C5E4C42489A965F24,,,PAC,Conservative Oppurtunity Leadership And Enterprise PAC (COLE PAC),,,,,,12176 Chancery Station Cir,,Reston,VA,20190,O2023,Contribution,2023-09-26,1000.00,,2023 Contribution,011,C00404392,Conservative Oppurtunity Leadership And Enterprise PAC (COLE PAC),,,,,,,,,,,,,,,,,
SB23,C00100107,C5325EE127F1EA45D60,,,CCM,David Rouzer For Congress,,,,,,PO Box 3142,,Wilmington,NC,284060142,P2024,,2023-09-26,1000.00,,2024 Primary,011,C00501643,,H2NC07096,Rouzer,David,Cheston,,,H,NC,07,,,,,,,,
SB23,C00100107,2E20B053E50D17EE582,,,PAC,"Defense, Economic Renewal, Education And Knowledge PAC",,,,,,401 2nd Ave S,Ste 303,Seattle,WA,98104,O2023,Contribution,2023-09-26,1500.00,,2023 Contribution,011,C00531632,"Defense, Economic Renewal, Education And Knowledge PAC",,,,,,,,,,,,,,,,,
SB23,C00100107,07ED5B520E02ED4C2C1,,,CCM,Don Bacon For Congress,,,,,,PO Box 391368,,Omaha,NE,68139,P2024,,2023-09-26,1000.00,,2024 Primary,011,C00575167,,H6NE02125,Bacon,Donald,John,,,H,NE,02,,,,,,,,
SB23,C00100107,52D1D2806C00219EC60,,,CCM,Hudson For Congress,,,,,,PO Box 1875,,Southern Pines,NC,28388,P2024,,2023-09-26,1000.00,,2024 Primary,011,C00504522,,H2NC08185,Hudson,Richard,Lane,,Jr.,H,NC,09,,,,,,,,
SB23,C00100107,0C432F438C9A9D22FCC,,,CCM,Kevin Kiley For Congress,,,,,,9458 Treelake Rd,,Granite Bay,CA,95746,P2024,,2023-09-26,1000.00,,2024 Primary,011,C00801985,,H2CA03157,Kiley,Kevin,,,,H,CA,03,,,,,,,,
SB23,C00100107,89E406A35CC59CE552D,,,CCM,Nevadans For Steven Horsford,,,,,,PO Box 336664,,North Las Vegas,NV,89033,P2024,,2023-09-26,2500.00,,2024 Primary,011,C00668228,,H2NV04011,Horsford,Steven,Alexzander,,,H,NV,04,,,,,,,,
