form_type,filer_committee_id_number,transaction_id_number,back_reference_tran_id_number,back_reference_sched_name,entity_type,payee_organization_name,payee_last_name,payee_first_name,payee_middle_name,payee_prefix,payee_suffix,payee_street_1,payee_street_2,payee_city,payee_state,payee_zip_code,election_code,election_other_description,expenditure_date,expenditure_amount,semi_annual_refunded_bundled_amt,expenditure_purpose_descrip,category_code,beneficiary_committee_fec_id,beneficiary_committee_name,beneficiary_candidate_fec_id,beneficiary_candidate_last_name,beneficiary_candidate_first_name,beneficiary_candidate_middle_name,beneficiary_candidate_prefix,beneficiary_candidate_suffix,beneficiary_candidate_office,beneficiary_candidate_state,beneficiary_candidate_district,conduit_name,conduit_street_1,conduit_street_2,conduit_city,conduit_state,conduit_zip_code,memo_code,memo_text_description,reference_to_si_or_sl_system_code_that_identifies_the_account
SB29,C00279455,BE003930B06EB466E9CA,,,COM,Campaign to Elect James Hoops,,,,,,195 OLD CREEK DRIVE,,Napoleon,OH,435459632,P2024,,2023-10-11,-500.00,,VOID of 7/28/2023 Contribution,,,,,,,,,,,,,,,,,,,,,
SB29,C00279455,B38951BC524DD4AD3A49,,,COM,Campaign to Elect James Hoops,,,,,,195 OLD CREEK DRIVE,,Napoleon,OH,435459632,P2024,,2023-10-17,500.00,,Contribution to a State Committee,,,,,,,,,,,,,,,,,,,,,
SB29,C00279455,B7690F61157A24C0D9D0,,,COM,Friends of Bonnie Cullison,,,,,,3404 Beret Lane,,Silver Spring,MD,209063026,P2026,,2023-10-19,1000.00,,Contribution to a State Committee,,,,,,,,,,,,,,,,,,,,,
SB29,C00279455,BE99D9986AE5548D79E8,,,COM,Friends of CT Wilson,,,,,,P.O. Box 618,,Bryans Road,MD,206160618,P2026,,2023-10-19,500.00,,Contribution to a State Committee,,,,,,,,,,,,,,,,,,,,,
SB29,C00279455,B6E8B4363ADF74ED6A32,,,COM,Friends of Joseline Pea-Melnyk,,,,,,P.O. Box 1251,,College Park,MD,207411251,P2026,,2023-10-19,1000.00,,Contribution to a State Committee,,,,,,,,,,,,,,,,,,,,,
