form_type,filer_committee_id_number,transaction_id_number,back_reference_tran_id_number,back_reference_sched_name,entity_type,payee_organization_name,payee_last_name,payee_first_name,payee_middle_name,payee_prefix,payee_suffix,payee_street_1,payee_street_2,payee_city,payee_state,payee_zip_code,election_code,election_other_description,expenditure_date,expenditure_amount,semi_annual_refunded_bundled_amt,expenditure_purpose_descrip,category_code,beneficiary_committee_fec_id,beneficiary_committee_name,beneficiary_candidate_fec_id,beneficiary_candidate_last_name,beneficiary_candidate_first_name,beneficiary_candidate_middle_name,beneficiary_candidate_prefix,beneficiary_candidate_suffix,beneficiary_candidate_office,beneficiary_candidate_state,beneficiary_candidate_district,conduit_name,conduit_street_1,conduit_street_2,conduit_city,conduit_state,conduit_zip_code,memo_code,memo_text_description,reference_to_si_or_sl_system_code_that_identifies_the_account
SB23,C00248047,SB23.10956,,,ORG,"Citizen's Committee for Children Services, The",,,,,,"Keith G. Malick, Treasurer",P.O.Box 7273,Akron,OH,44306,G2024,,2024-07-08,1000.00,,,,,,,,,,,,,,,,,,,,,,
SB23,C00248047,SB23.10964,,,CCM,Donnelly for Supreme Court,,,,,,"John T. Castle, Treasurer",545 East Town Street,Columbus,OH,43215,G2024,,2024-07-22,1000.00,,,,,,,,,,,,,,,,,,,,,,
SB23,C00248047,SB23.10970,,,ORG,Economic Growth Foundation,,,,,,1240 Huron Road,Suite 300,Cleveland,OH,441151722,,,2024-09-10,15000.00,,,012,,,,,,,,,,,,,,,,,,,
SB23,C00248047,SB23.10966,,,CCM,Forbes for Judge,,,,,,"Lynn Ann Gries, Treasurer",3130 Chadbourne Road,Shaker Heights,OH,44120,G2024,,2024-07-22,1000.00,,,,,,,,,,,,,,,,,,,,,,
SB23,C00248047,SB23.10968,,,ORG,Greater Akron Chamber Foundation,,,,,,388 South Main Street,Suite 205,Akron,OH,44311,,,2024-09-09,21069.83,,,012,,,,,,,,,,,,,,,,,,,
SB23,C00248047,SB23.10971,,,ORG,Greater Akron Chamber Foundation,,,,,,388 South Main Street,Suite 205,Akron,OH,44311,,,2024-09-10,10000.00,,,012,,,,,,,,,,,,,,,,,,,
SB23,C00248047,SB23.10965,,,CCM,Stewart for Ohio Supreme Court,,,,,,"Suzanne B. Blum, Treasurer",2 Bratenahl Place 15A,Cleveland,OH,44108,G2024,,2024-07-22,1000.00,,,,,,,,,,,,,,,,,,,,,,
SB23,C00248047,SB23.10967,,,ORG,Team NEO Foundation,,,,,,1111 Superior Avenue,Suite 1600,Cleveland,OH,44114,,,2024-09-09,10000.00,,,012,,,,,,,,,,,,,,,,,,,
SB23,C00248047,SB23.10969,,,ORG,Youngstown Warren Regional Chamber of Commerce Foundation,,,,,,"City Centre One, Suite 300",100 E. Federal Street,Youngstown,OH,44503,,,2024-09-09,10000.00,,,012,,,,,,,,,,,,,,,,,,,
