form_type,filer_committee_id_number,transaction_id_number,back_reference_tran_id_number,back_reference_sched_name,entity_type,payee_organization_name,payee_last_name,payee_first_name,payee_middle_name,payee_prefix,payee_suffix,payee_street_1,payee_street_2,payee_city,payee_state,payee_zip_code,election_code,election_other_description,expenditure_date,expenditure_amount,semi_annual_refunded_bundled_amt,expenditure_purpose_descrip,category_code,beneficiary_committee_fec_id,beneficiary_committee_name,beneficiary_candidate_fec_id,beneficiary_candidate_last_name,beneficiary_candidate_first_name,beneficiary_candidate_middle_name,beneficiary_candidate_prefix,beneficiary_candidate_suffix,beneficiary_candidate_office,beneficiary_candidate_state,beneficiary_candidate_district,conduit_name,conduit_street_1,conduit_street_2,conduit_city,conduit_state,conduit_zip_code,memo_code,memo_text_description,reference_to_si_or_sl_system_code_that_identifies_the_account
SB23,C00640086,500002916,,,CCM,CHRISTINA BOHANNAN FOR CONGRESS,,,,,,PO Box 722,,Iowa City,IA,522440722,G2024,,2024-05-21,1500.00,0.00,Political Contribution,011,C00787820,,,BOHANNAN,CHRISTINA,,,,H,IA,01,,,,,,,,
SB23,C00640086,500002918,,,CCM,EMILY BUSCH FOR CONGRESS,,,,,,PO Box 80744,,Rochester,MI,483080744,G2024,,2024-05-30,1500.00,0.00,Political Contribution,011,C00837971,,,BUSCH,EMILY,,,,H,MI,10,,,,,,,,
SB23,C00640086,500002946,,,ORG,"Everytown For Gun Safety Action Fund, Inc.",,,,,,PO Box 4184,,New York,NY,101634184,,,2024-05-15,141.53,0.00,Inkind: Staff Time,011,C00031054,MICHIGAN DEMOCRATIC STATE CENTRAL COMMITTEE,,,,,,,,,,,,,,,,,In-Kind
SB23,C00640086,500002950,,,ORG,"Everytown For Gun Safety Action Fund, Inc.",,,,,,PO Box 4184,,New York,NY,101634184,,,2024-05-18,392.16,0.00,Inkind: Travel Expenses and Staff Time,011,C00842104,FIGHT LIKE HELL PAC,,,,,,,,,,,,,,,,,In-Kind
SB23,C00640086,500002914,,,CCM,FRIENDS OF LUCY MCBATH,,,,,,885 Woodstock Rd,Ste Pm 430,Roswell,GA,300752211,G2024,,2024-05-14,5000.00,0.00,Political Contribution,011,C00672295,,,McBath,Lucia,K.,Ms.,,H,GA,06,,,,,,,,
