form_type,filer_committee_id_number,transaction_id_number,back_reference_tran_id_number,back_reference_sched_name,entity_type,payee_organization_name,payee_last_name,payee_first_name,payee_middle_name,payee_prefix,payee_suffix,payee_street_1,payee_street_2,payee_city,payee_state,payee_zip_code,election_code,election_other_description,expenditure_date,expenditure_amount,semi_annual_refunded_bundled_amt,expenditure_purpose_descrip,category_code,beneficiary_committee_fec_id,beneficiary_committee_name,beneficiary_candidate_fec_id,beneficiary_candidate_last_name,beneficiary_candidate_first_name,beneficiary_candidate_middle_name,beneficiary_candidate_prefix,beneficiary_candidate_suffix,beneficiary_candidate_office,beneficiary_candidate_state,beneficiary_candidate_district,conduit_name,conduit_street_1,conduit_street_2,conduit_city,conduit_state,conduit_zip_code,memo_code,memo_text_description,reference_to_si_or_sl_system_code_that_identifies_the_account
SB29,C00748418,500026221,,,ORG,Elias Law Group,,,,,,250 Massachusetts Ave NW,Ste 400,Washington,DC,200015825,,,2023-12-18,637.50,0.00,Non-Contribution Account: Legal Services,,,,,,,,,,,,,,,,,,,,
SB29,C00748418,500026341,,,COM,Democratic Party of Wisconsin,,,,,,15 N Pinckney St,,Madison,WI,537032883,,,2023-12-21,5000.00,0.00,Non-Contribution Account: Non-Federal Contribution,,,,,,,,,,,,,,,,,,,,
SB29,C00748418,500026342,,,ORG,Vote Rev,,,,,,611 Pennsylvania Ave SE,Num 143,Washington,DC,200034303,,,2023-12-26,21432.16,0.00,Non-Contribution Account: Non-Federal Contribution,,,,,,,,,,,,,,,,,,,,
SB29,C00748418,500025362,,,ORG,Elias Law Group,,,,,,250 Massachusetts Ave NW,Ste 400,Washington,DC,200015825,,,2023-10-16,952.00,0.00,Non-Contribution Account: Legal Services,,,,,,,,,,,,,,,,,,,,
SB29,C00748418,500026343,,,ORG,Vote Rev,,,,,,611 Pennsylvania Ave SE,Num 143,Washington,DC,200034303,,,2023-12-26,1372.50,0.00,Non-Federal Contribution from Contribution Account,,,,,,,,,,,,,,,,,,,,
SB29,C00748418,500025953,,,ORG,Collective Impact Action,,,,,,611 Pennsylvania Ave SE,Apt 143,Washington,DC,200034303,,,2023-11-27,939.00,0.00,Non-Contribution Account: Ad Production Reimbursement,,,,,,,,,,,,,,,,,,,,
SB29,C00748418,500025954,,,ORG,EveryAction,,,,,,655 15th St NW,Ste 650,Washington,DC,200055738,,,2023-11-28,353.25,0.00,Non-Contribution Account: Software Subscription,,,,,,,,,,,,,,,,,,,,
SB29,C00748418,500025955,,,ORG,EveryAction,,,,,,655 15th St NW,Ste 650,Washington,DC,200055738,,,2023-11-28,353.25,0.00,Non-Contribution Account: Software Subscription,,,,,,,,,,,,,,,,,,,,
