form_type,filer_committee_id_number,transaction_id_number,back_reference_tran_id_number,back_reference_sched_name,entity_type,payee_organization_name,payee_last_name,payee_first_name,payee_middle_name,payee_prefix,payee_suffix,payee_street_1,payee_street_2,payee_city,payee_state,payee_zip_code,election_code,election_other_description,expenditure_date,expenditure_amount,semi_annual_refunded_bundled_amt,expenditure_purpose_descrip,category_code,beneficiary_committee_fec_id,beneficiary_committee_name,beneficiary_candidate_fec_id,beneficiary_candidate_last_name,beneficiary_candidate_first_name,beneficiary_candidate_middle_name,beneficiary_candidate_prefix,beneficiary_candidate_suffix,beneficiary_candidate_office,beneficiary_candidate_state,beneficiary_candidate_district,conduit_name,conduit_street_1,conduit_street_2,conduit_city,conduit_state,conduit_zip_code,memo_code,memo_text_description,reference_to_si_or_sl_system_code_that_identifies_the_account
SB23,C00590471,SB23.16237,,,CCM,BILL FOSTER FOR CONGRESS,,,,,,P.O. BOX 9104,,AURORA,IL,60598,P2024,,2024-02-12,5000.00,,SUPPORT FOR PRIMARY CAMPAIGN,011,C00435099,BILL FOSTER FOR CONGRESS,,,,,,,H,IL,11,,,,,,,,
SB23,C00590471,SB23.16232,,,CCM,BUDWINSKI PAC,,,,,,"600 PENNSYLVANIA AVE, SE",UNIT 15180,WASHINGTON,DC,20003,G2024,,2024-02-06,5000.00,,SUPPORT PRO-LABOR CANDIDATES,011,,,,,,,,,H,IL,13,,,,,,,,
SB23,C00590471,SB23.16236,,,CCM,CHUY GARCIA FOR CONGRESS,,,,,,3520 SOUTH ARCHER AVENUE,,CHICAGO,IL,60609,P2024,,2024-02-12,5000.00,,SUPPORT FOR PRIMARY CAMPAIGN,011,C00661777,CHUY GARCIA FOR CONGRESS,,,,,,,H,IL,04,,,,,,,,
SB23,C00590471,SB23.16239,,,CCM,ERIC SORENSEN FOR ILLINOIS,,,,,,P.O. BOX 1172,,MONEE,IL,61265,G2024,,2024-02-12,5000.00,,SUPPORT FOR GENERAL ELECTION,011,C00793935,ERIC SORENSEN FOR ILLINOIS,,,,,,,H,IL,17,,,,,,,,
SB23,C00590471,SB23.16231,,,CCM,FRIENDS OF RAJA FOR CONGRESS,,,,,,PO BOX 681202,,SCHAUMBURG,IL,60168,G2024,,2024-02-06,5000.00,,SUPPORT FOR RE-ELECTION,011,C00575092,,,,,,,,H,IL,08,,,,,,,,
SB23,C00590471,SB23.16238,,,CCM,SCHAKOWSKY FOR CONGRESS,,,,,,P.O. BOX 5130,,EVANSTON,IL,60204,G2024,,2024-02-12,5000.00,,SUPPORT FOR GENERAL ELECTION,011,C00327023,SCHAKOWSKY FOR CONGRESS,,,,,,,H,IL,09,,,,,,,,
SB23,C00590471,SB23.16235,,,CCM,SCHNEIDER FOR CONGRESS,,,,,,P.O. BOX 1318,,DEERFIELD,IL,60015,P2024,,2024-02-12,5000.00,,SUPPORT FOR PRIMARY CAMPAIGN - 03/19/24,011,C00495952,SCHNEIDER FOR CONGRESS,,,,,,,H,IL,10,,,,,,,,
