form_type,filer_committee_id_number,transaction_id_number,back_reference_tran_id_number,back_reference_sched_name,entity_type,payee_organization_name,payee_last_name,payee_first_name,payee_middle_name,payee_prefix,payee_suffix,payee_street_1,payee_street_2,payee_city,payee_state,payee_zip_code,election_code,election_other_description,expenditure_date,expenditure_amount,semi_annual_refunded_bundled_amt,expenditure_purpose_descrip,category_code,beneficiary_committee_fec_id,beneficiary_committee_name,beneficiary_candidate_fec_id,beneficiary_candidate_last_name,beneficiary_candidate_first_name,beneficiary_candidate_middle_name,beneficiary_candidate_prefix,beneficiary_candidate_suffix,beneficiary_candidate_office,beneficiary_candidate_state,beneficiary_candidate_district,conduit_name,conduit_street_1,conduit_street_2,conduit_city,conduit_state,conduit_zip_code,memo_code,memo_text_description,reference_to_si_or_sl_system_code_that_identifies_the_account
SB23,C00042002,B8A373027E74B434DA9D,,,PAC,DAINES SENATE MAJORITY FUND,,,,,,228 S. WASHINGTON ST.,STE. 115,ALEXANDRIA,VA,22314,O2024,Other,2024-04-03,5000.00,,"100% allocated to Steve Daines for Montana, 2026 Primary",,C00571596,DAINES SENATE MAJORITY FUND,,,,,,,,,,,,,,,,,,
SB23,C00042002,B976728F86539444AADD,,,CCM,Friends Of Bennie Thompson,,,,,,P.O. Box 100,,Bolton,MS,390410100,G2024,,2024-04-25,1500.00,,Contribution to Committee,,C00279851           ,Friends Of Bennie Thompson,H4MS02068,Thompson,Bennie,G.,,,H,MS,02,,,,,,,,,
SB23,C00042002,BAB2A7FA765984040A03,,,CCM,Sanford Bishop For Congress,,,,,,"412 First Street, SE #100",,Washington,DC,200031804,G2024,,2024-04-25,5000.00,,Contribution to Committee,,C00266940           ,Sanford Bishop For Congress,H2GA02031,Bishop,Sanford,D.,,Jr.,H,GA,02,,,,,,,,,
SB23,C00042002,B073C084666FE4D77A93,,,CCM,TED CRUZ FOR SENATE,,,,,,815 A BRAZOS,PMB 550,AUSTIN,TX,78701,G2024,,2024-04-25,2500.00,,Contribution to Committee,,C00492785,TED CRUZ FOR SENATE,S2TX00312,Cruz,Ted,,,,S,TX,,,,,,,,,,
SB23,C00042002,BB9A305EF9EA440A0B18,,,CCM,Texans For Henry Cuellar Congressional Campaign,,,,,,1519 Washington Street,"Second Floor, Suite 200",Laredo,TX,780404412,G2024,,2024-04-25,1000.00,,Contribution to Committee,,C00371302           ,Texans For Henry Cuellar Congressional Campaign,H2TX23082,Cuellar,Henry,,,,H,TX,28,,,,,,,,,
SB23,C00042002,B8369899CDC274B348A7,,,CCM,TROY CARTER FOR CONGRESS,,,,,,PO BOX 50730,,NEW ORLEANS,LA,70150,P2024,,2024-04-25,2500.00,,Contribution to Committee,,C00763649,TROY CARTER FOR CONGRESS,H2LA02149,Carter,Troy,A,,SR,H,LA,02,,,,,,,,,
