form_type,filer_committee_id_number,transaction_id_number,back_reference_tran_id_number,back_reference_sched_name,entity_type,payee_organization_name,payee_last_name,payee_first_name,payee_middle_name,payee_prefix,payee_suffix,payee_street_1,payee_street_2,payee_city,payee_state,payee_zip_code,election_code,election_other_description,expenditure_date,expenditure_amount,semi_annual_refunded_bundled_amt,expenditure_purpose_descrip,category_code,beneficiary_committee_fec_id,beneficiary_committee_name,beneficiary_candidate_fec_id,beneficiary_candidate_last_name,beneficiary_candidate_first_name,beneficiary_candidate_middle_name,beneficiary_candidate_prefix,beneficiary_candidate_suffix,beneficiary_candidate_office,beneficiary_candidate_state,beneficiary_candidate_district,conduit_name,conduit_street_1,conduit_street_2,conduit_city,conduit_state,conduit_zip_code,memo_code,memo_text_description,reference_to_si_or_sl_system_code_that_identifies_the_account
SB29,C00851204,SB29.4280,,,IND,,Carroll,Terrance,,,,1600 Glenarm Pl.,#2804,Denver,CO,80202,,,2024-10-09,8000.00,,Non-Contribution Acct: Legal Services,,,,,,,,,,,,,,,,,,,,
SB29,C00851204,SB29.4285,,,ORG,Citibank,,,,,,"1218 Connecticut Ave., NW",,Washington,DC,20036,,,2024-10-09,17.00,,Non-Contribution Acct: Bank Service Fee,,,,,,,,,,,,,,,,,,,,
SB29,C00851204,SB29.4286,,,ORG,Citibank,,,,,,"1218 Connecticut Ave., NW",,Washington,DC,20036,,,2024-10-09,17.00,,Non-Contribution Acct: Bank Service Fee,,,,,,,,,,,,,,,,,,,,
SB29,C00851204,SB29.4283,,,ORG,Great Lake Strategy,,,,,,7 Court St.,Suite 330,Canfield,OH,44402,,,2024-10-09,10000.00,,Non-Contribution Acct: Digital Ad Consulting (for PAC),,,,,,,,,,,,,,,,,,,,
SB29,C00851204,SB29.4277,,,ORG,Independent Advantage LLC,,,,,,1610 Des Peres Rd.,,St. Louis,MO,63131,,,2024-10-15,2701.79,,Non-Contribution Acct: PAC Management/Consulting Services,,,,,,,,,,,,,,,,,,,,
SB29,C00851204,SB29.4281,,,ORG,Three Arbor Insurance,,,,,,2828 Old 280 Ct,Suite 126,Birmingham,AL,35243,,,2024-10-10,9359.20,,Non-Contribution Acct: General Liability Insurance,,,,,,,,,,,,,,,,,,,,
SB29,C00851204,SB29.4279,,,ORG,Torchlight Strategies,,,,,,882 Back River Rd,,Boothbay,ME,04537,,,2024-10-10,1845.00,,Non-Contribution Acct: Research/Communications Consulting (for PAC),,,,,,,,,,,,,,,,,,,,
