form_type,filer_committee_id_number,transaction_id_number,back_reference_tran_id_number,back_reference_sched_name,entity_type,payee_organization_name,payee_last_name,payee_first_name,payee_middle_name,payee_prefix,payee_suffix,payee_street_1,payee_street_2,payee_city,payee_state,payee_zip_code,election_code,election_other_description,expenditure_date,expenditure_amount,semi_annual_refunded_bundled_amt,expenditure_purpose_descrip,category_code,beneficiary_committee_fec_id,beneficiary_committee_name,beneficiary_candidate_fec_id,beneficiary_candidate_last_name,beneficiary_candidate_first_name,beneficiary_candidate_middle_name,beneficiary_candidate_prefix,beneficiary_candidate_suffix,beneficiary_candidate_office,beneficiary_candidate_state,beneficiary_candidate_district,conduit_name,conduit_street_1,conduit_street_2,conduit_city,conduit_state,conduit_zip_code,memo_code,memo_text_description,reference_to_si_or_sl_system_code_that_identifies_the_account
SB23,C00119354,B472D721B33744636BD2,,,CCM,DIANA FOR CONGRESS,,,,,,PO BOX 7208,,Kingsport,TN,376641208,P2024,,2023-05-18,1500.00,,Contribution to Committee,,C00741090,DIANA FOR CONGRESS,H0TN01118,Harshbarger,Diana,,Rep.,,H,TN,01,,,,,,,,,
SB23,C00119354,B6F80823AD61C44A78DF,,,CCM,TED CRUZ FOR SENATE,,,,,,PO BOX 25376,,HOUSTON,TX,77265,P2024,,2023-05-18,5000.00,,Contribution to Committee,,C00492785,TED CRUZ FOR SENATE,S2TX00312,Cruz,Ted,,Sen.,,S,TX,,,,,,,,,,
SB23,C00119354,B323FA66F848D4F51822,,,CCM,PETE AGUILAR FOR CONGRESS,,,,,,PO BOX 10954,,San Bernardino,CA,924230954,P2024,,2023-05-18,2500.00,,Contribution to Committee,,C00510461,PETE AGUILAR FOR CONGRESS,H2CA31125,Aguilar,Pete,,Rep.,,H,CA,33,,,,,,,,,
SB23,C00119354,B83AB96255D7B4913823,,,CCM,MARC VEASEY CONGRESSIONAL CAMPAIGN COMMITTEE,,,,,,PO BOX 50084,,Fort Worth,TX,761050084,P2024,,2023-05-18,2500.00,,Contribution to Committee,,C00506832,MARC VEASEY CONGRESSIONAL CAMPAIGN COMMITTEE,H2TX33073,Veasey,Marc,Allison,,,H,TX,33,,,,,,,,,
SB23,C00119354,BA5F05D4BE2FF468DAA2,,,PAC,REPUBLICAN GOVERNANCE GROUP/TUESDAY GROUP PAC,,,,,,610 S. BOULEVARD,,Tampa,FL,336062647,O2023,Other,2023-05-18,5000.00,,Contribution to Committee,,C00433060,REPUBLICAN GOVERNANCE GROUP/TUESDAY GROUP PAC,,,,,,,,,,,,,,,,,,
