form_type,filer_committee_id_number,transaction_id_number,back_reference_tran_id_number,back_reference_sched_name,entity_type,payee_organization_name,payee_last_name,payee_first_name,payee_middle_name,payee_prefix,payee_suffix,payee_street_1,payee_street_2,payee_city,payee_state,payee_zip_code,election_code,election_other_description,expenditure_date,expenditure_amount,semi_annual_refunded_bundled_amt,expenditure_purpose_descrip,category_code,beneficiary_committee_fec_id,beneficiary_committee_name,beneficiary_candidate_fec_id,beneficiary_candidate_last_name,beneficiary_candidate_first_name,beneficiary_candidate_middle_name,beneficiary_candidate_prefix,beneficiary_candidate_suffix,beneficiary_candidate_office,beneficiary_candidate_state,beneficiary_candidate_district,conduit_name,conduit_street_1,conduit_street_2,conduit_city,conduit_state,conduit_zip_code,memo_code,memo_text_description,reference_to_si_or_sl_system_code_that_identifies_the_account
SB29,C00370569,SB29.5727,,,CCM,Committee to Elect Christine Reuther,,,,,,PO Box 92,,Wallingford,PA,19086,P2023,,2023-01-25,500.00,,campaign contribution,011,,Committee to Elect Christine Reuther,,,,,,,,PA,,,,,,,,,
SB29,C00370569,SB29.5734,,,CCM,Friends of Arvind Venkat,,,,,,10675 Perry Hwy,PO Box 489,Wexford,PA,15090,P2023,,2023-03-03,500.00,,campaign contribution,011,,Friends of Arvind Venkat,,,,,,,,,,,,,,,,,
SB29,C00370569,SB29.5736,,,CCM,Friends of Bob Harvie,,,,,,346 Stratton Ct,,Langhorne,PA,19047,P2023,,2023-03-13,1000.00,,campaign contribution,011,,Friends of Bob Harvie,,,,,,,,,,,,,,,,,
SB29,C00370569,SB29.5731,,,CCM,Friends of Bryan Cutler,,,,,,PO Box 412,,Harrisburg,PA,17108,P2023,,2023-02-24,1000.00,,campaign contribution,011,,Friends of Bryan Cutler,,,,,,,,PA,,,,,,,,,
SB29,C00370569,SB29.5723,,,CCM,Friends of Jason Dawkins,,,,,,4612 Lesher St,,Philadelphia,PA,19124,P2023,,2023-01-11,1000.00,,campaign contribution,011,,Friends of Jason Dawkins,,,,,,,,,,,,,,,,,
SB29,C00370569,SB29.5730,,,CCM,Friends of Matt Bradford,,,,,,PO Box 349,,Norristown,PA,19404,P2023,,2023-02-24,2500.00,,campaign contribution,011,,Friends of Matt Bradford,,,,,,,,,,,,,,,,,
SB29,C00370569,SB29.5735,,,CCM,Friends of Sharif Street,,,,,,PO Box 28854,,Philadelphia,PA,19151,P2023,,2023-03-13,1000.00,,campaign contribution,011,,Friends of Sharif Street,,,,,,,,,,,,,,,,,
