form_type,filer_committee_id_number,transaction_id_number,back_reference_tran_id_number,back_reference_sched_name,entity_type,payee_organization_name,payee_last_name,payee_first_name,payee_middle_name,payee_prefix,payee_suffix,payee_street_1,payee_street_2,payee_city,payee_state,payee_zip_code,election_code,election_other_description,expenditure_date,expenditure_amount,semi_annual_refunded_bundled_amt,expenditure_purpose_descrip,category_code,beneficiary_committee_fec_id,beneficiary_committee_name,beneficiary_candidate_fec_id,beneficiary_candidate_last_name,beneficiary_candidate_first_name,beneficiary_candidate_middle_name,beneficiary_candidate_prefix,beneficiary_candidate_suffix,beneficiary_candidate_office,beneficiary_candidate_state,beneficiary_candidate_district,conduit_name,conduit_street_1,conduit_street_2,conduit_city,conduit_state,conduit_zip_code,memo_code,memo_text_description,reference_to_si_or_sl_system_code_that_identifies_the_account
SB23,C00599084,SB23.8045,,,CAN,,ARRINGTON,JODEY COOK,,,,4407 13TH ST,,LUBBOCK,TX,79416,P2024,,2023-04-14,5000.00,,PCGPAC contribution to Texans for Jodey Arrington,011,C00588657,TEXANS FOR JODEY ARRINGTON,,,,,,,H,TX,19,,,,,,,,
SB23,C00599084,SB23.8061,,,CAN,,BRITT,KATIE BOYD,,,,3147 THOMAS AVENUE,,MONTGOMERY,AL,36106,P2024,,2023-06-30,2500.00,,PCGPAC contribution to Katie Britt for Alabama,011,,Katie Britt for Alabama,,,,,,,S,AL,00,,,,,,,,
SB23,C00599084,SB23.8055,,,CAN,,CUELLAR,HENRY,,,,1519 WASHINGTON STREET,SUITE 200,LAREDO,TX,78040,P2024,,2023-04-26,5000.00,,PCGPAC contribution to Texans for Henry Cuellar,011,C00371302,TEXANS FOR HENRY CUELLAR CONGRESSIONAL CAMPAIGN,,,,,,,H,TX,28,,,,,,,,
SB23,C00599084,SB23.8049,,,CAN,,GONZALEZ,VICENTE MR.,,,,P.O. BOX 720603,,MCALLEN,TX,78504,P2024,,2023-04-25,5000.00,,PCGPAC contribution to Vicente Gonzalez for Congress,011,C00592659,VICENTE GONZALEZ FOR CONGRESS,,,,,,,H,TX,15,,,,,,,,
SB23,C00599084,SB23.8048,,,CAN,,JACKSON,RONNY LYNN,,,,PO BOX 53058,,AMARILLO,TX,79159,P2024,,2023-04-25,5000.00,,PCGPAC contribution to Team Ronny,011,C00754044,TEAM RONNY,,,,,,,,,,,,,,,,,
SB23,C00599084,SB23.8050,,,CAN,,LUJAN,BEN,,Mr.,,PO BOX 31129,,SANTA FE,NM,87594,P2024,,2023-04-25,5000.00,,PCGPAC contribution to People for Ben,011,C00443689,PEOPLE FOR BEN,,,,,,,H,NM,03,,,,,,,,
SB23,C00599084,SB23.8056,,,CAN,,SCOTT,JAMES AUSTIN,,,,621 MCLENDON ST,,ASHBURN,GA,31714,P2024,,2023-06-08,2500.00,,PCGPAC contribution to Austin Scott for Congress,011,C00482737,AUSTIN SCOTT FOR CONGRESS INC,,,,,,,H,GA,08,,,,,,,,
SB23,C00599084,SB23.8054,,,CAN,,VASQUEZ,GABRIEL,,,,DRAWER L,,MESILLA,NM,88046,P2024,,2023-04-25,5000.00,,PCGPAC contribution to Gabe Vasquez for Congreess,011,C00789404,GABE VASQUEZ FOR CONGRESS,,,,,,,H,NM,02,,,,,,,,
