form_type,filer_committee_id_number,transaction_id_number,back_reference_tran_id_number,back_reference_sched_name,entity_type,payee_organization_name,payee_last_name,payee_first_name,payee_middle_name,payee_prefix,payee_suffix,payee_street_1,payee_street_2,payee_city,payee_state,payee_zip_code,election_code,election_other_description,expenditure_date,expenditure_amount,semi_annual_refunded_bundled_amt,expenditure_purpose_descrip,category_code,beneficiary_committee_fec_id,beneficiary_committee_name,beneficiary_candidate_fec_id,beneficiary_candidate_last_name,beneficiary_candidate_first_name,beneficiary_candidate_middle_name,beneficiary_candidate_prefix,beneficiary_candidate_suffix,beneficiary_candidate_office,beneficiary_candidate_state,beneficiary_candidate_district,conduit_name,conduit_street_1,conduit_street_2,conduit_city,conduit_state,conduit_zip_code,memo_code,memo_text_description,reference_to_si_or_sl_system_code_that_identifies_the_account
SB23,C00122101,SB23.34231,,,CCM,CLIFF BENTZ FOR CONGRESS,,,,,,660 MORGAN AVE,,ONTARIO,OR,97914,P2024,,2024-05-22,2500.00,,,,C00725465,CLIFF BENTZ FOR CONGRESS,H0OR02127,BENTZ,CLIFF,,,,H,OR,02,,,,,,,,
SB23,C00122101,SB23.34238,,,CCM,FRIENDS OF JOHN BARRASSO,,,,,,PO BOX 52008,,CASPER,WY,82605,P2024,,2024-05-22,1500.00,,,,C00436386,FRIENDS OF JOHN BARRASSO,S6WY00068,BARRASSO,JOHN A,,,,S,WY,00,,,,,,,,
SB23,C00122101,SB23.34240,,,CCM,Friends of Scott Desjarlais,,,,,,PO Box 90133,,Nashville,TN,372090133,P2024,,2024-05-29,5000.00,,,,,"DESJARLAIS, SCOTT HON.",,,,,,,H,TN,04,,,,,,,,
SB23,C00122101,SB23.34232,,,CCM,HAGEMAN FOR WYOMING,,,,,,P.O. BOX 4157,,CHEYENNE,WY,82003,P2024,,2024-05-22,2500.00,,,,C00788943,HAGEMAN FOR WYOMING,H2WY00166,HAGEMAN,HARRIET,,,,H,WY,00,,,,,,,,
SB23,C00122101,SB23.34239,,,CCM,JOHN ROSE FOR TENNESSEE,,,,,,PO BOX 2404,,COOKEVILLE,TN,38502,P2024,,2024-05-29,5000.00,,,,C00652743,JOHN ROSE FOR TENNESSEE,H8TN06094,ROSE,JOHN W.,,,,H,TN,06,,,,,,,,
SB23,C00122101,SB23.34226,,,CCM,LEW WEBB FOR CONGRESS,,,,,,"10 TOWN PLAZA, #69",,DURANGO,CO,81301,P2024,,2024-05-22,5000.00,,,,C00869990,LEW WEBB FOR CONGRESS,H4CO03464,WEBB,LEW,,,,H,CO,03,,,,,,,,
SB23,C00122101,SB23.34237,,,CCM,PETE STAUBER FOR CONGRESS VOLUNTEER COMMITTEE,,,,,,23 CENTRAL ENTRANCE,BOX 333,DULUTH,MN,55811,P2024,,2024-05-22,2500.00,,,,C00650697,PETE STAUBER FOR CONGRESS VOLUNTEER COMMITTEE,H8MN08043,STAUBER,PETE,,,,H,MN,08,,,,,,,,
SB23,C00122101,SB23.34236,,,CCM,ROB WITTMAN FOR CONGRESS,,,,,,PO BOX 999,,MONTROSS,VA,22520,P2024,,2024-05-22,2500.00,,,,C00441014,ROB WITTMAN FOR CONGRESS,H8VA01147,WITTMAN,ROBERT J MR.,,,,H,VA,01,,,,,,,,
SB23,C00122101,SB23.34235,,,CCM,"TIFFANY FOR WISCONSIN, INC.",,,,,,PO BOX 1007,,WAUSAU,WI,54402,P2024,,2024-05-22,2500.00,,,,C00718635,"TIFFANY FOR WISCONSIN, INC.",H0WI07101,TIFFANY,TOM,,,,H,WI,07,,,,,,,,
