form_type,filer_committee_id_number,transaction_id_number,back_reference_tran_id_number,back_reference_sched_name,entity_type,payee_organization_name,payee_last_name,payee_first_name,payee_middle_name,payee_prefix,payee_suffix,payee_street_1,payee_street_2,payee_city,payee_state,payee_zip_code,election_code,election_other_description,expenditure_date,expenditure_amount,semi_annual_refunded_bundled_amt,expenditure_purpose_descrip,category_code,beneficiary_committee_fec_id,beneficiary_committee_name,beneficiary_candidate_fec_id,beneficiary_candidate_last_name,beneficiary_candidate_first_name,beneficiary_candidate_middle_name,beneficiary_candidate_prefix,beneficiary_candidate_suffix,beneficiary_candidate_office,beneficiary_candidate_state,beneficiary_candidate_district,conduit_name,conduit_street_1,conduit_street_2,conduit_city,conduit_state,conduit_zip_code,memo_code,memo_text_description,reference_to_si_or_sl_system_code_that_identifies_the_account
SB29,C00890954,EB12,,,PAC,Casey Eure Campaign,,,,,,11839 Sleeping Deer Ln,,Saucier,MS,39574,P2027,,2024-10-31,5000.00,,,011,,Casey Eure Campaign,,,,,,,,,,,,,,,,,
SB29,C00890954,EB13,,,PAC,Committee to Elect Briggs Hopson,,,,,,1007 Mission Park Drive,,Vicksburg,MS,39180,P2027,,2024-10-31,2500.00,,,011,,Committee to Elect Briggs Hopson,,,,,,,,,,,,,,,,,
SB29,C00890954,EB15,,,PAC,Committee to Elect Hank Zuber,,,,,,503 Minor Lane,,Ocean Springs,MS,39564,P2027,,2024-10-31,1000.00,,,011,,Committee to Elect Hank Zuber,,,,,,,,,,,,,,,,,
SB29,C00890954,EB16,,,PAC,David Blount Committee,,,,,,PO Box 641,,Jackson,MS,39205,P2027,,2024-10-31,2500.00,,,011,,David Blount Committee,,,,,,,,,,,,,,,,,
SB29,C00890954,EB14,,,PAC,Friends of Jay McKnight,,,,,,22160 Highway 53,,Gulfport,MS,39503,P2027,,2024-10-31,1000.00,,,011,,Friends of Jay McKnight,,,,,,,,,,,,,,,,,
SB29,C00890954,EB17,,,PAC,Mississippi House Leadership Fund,,,,,,1080 Augusta Drive,,Oxford,MS,38655,,,2024-10-31,9000.00,,,011,,Mississippi House Leadership Fund,,,,,,,,,,,,,,,,,
