form_type,filer_committee_id_number,transaction_id_number,back_reference_tran_id_number,back_reference_sched_name,entity_type,payee_organization_name,payee_last_name,payee_first_name,payee_middle_name,payee_prefix,payee_suffix,payee_street_1,payee_street_2,payee_city,payee_state,payee_zip_code,election_code,election_other_description,expenditure_date,expenditure_amount,semi_annual_refunded_bundled_amt,expenditure_purpose_descrip,category_code,beneficiary_committee_fec_id,beneficiary_committee_name,beneficiary_candidate_fec_id,beneficiary_candidate_last_name,beneficiary_candidate_first_name,beneficiary_candidate_middle_name,beneficiary_candidate_prefix,beneficiary_candidate_suffix,beneficiary_candidate_office,beneficiary_candidate_state,beneficiary_candidate_district,conduit_name,conduit_street_1,conduit_street_2,conduit_city,conduit_state,conduit_zip_code,memo_code,memo_text_description,reference_to_si_or_sl_system_code_that_identifies_the_account
SB29,C00691790,EB2067,,,PAC,Beau McFarland for Chino Valley USD Board of Education 2024,,,,,,4228 Rushmore Court,,Chino,CA,91710,,,2024-08-07,1000.00,,Non-Federal Contribution,011,,Beau McFarland for Chino Valley USD Board of Education 2024,,,,,,,,,,,,,,,,,
SB29,C00691790,EB2065,,,PAC,Francesca Wernish for the School Board of PBC District 1,,,,,,P.O. Box 14322,,North Palm Beach,FL,33408,,,2024-08-07,1000.00,,Non-Federal Contribution,011,,Francesca Wernish for the School Board of PBC District 1,,,,,,,,,,,,,,,,,
SB29,C00691790,EB2081,,,PAC,Kassandra Wilson Trustee for Etiwanda School Dist. Area 5 - 2024,,,,,,"9668 Milliken Avenue, #104-208",,Rancho Cucamonga,CA,91730,,,2024-08-23,750.00,,Non-Federal Contribution,011,,Kassandra Wilson Trustee for Etiwanda School Dist. Area 5 - 2024,,,,,,,,,,,,,,,,,
SB29,C00691790,EB2082,,,PAC,Neva Parker for Assembly 2024,,,,,,P.O. Box 1518,,Roseville,CA,95678,,,2024-08-23,1000.00,,Non-Federal Contribution,011,,Neva Parker for Assembly 2024,,,,,,,,,,,,,,,,,
SB29,C00691790,EB2066,,,PAC,Sahi for New Haven Unified School District Trustee 2024,,,,,,111 Marjoram Loop,,Union City,CA,94587,,,2024-08-07,750.00,,Non-Federal Contribution,011,,Sahi for New Haven Unified School District Trustee 2024,,,,,,,,,,,,,,,,,
SB29,C00691790,EB2064,,,ORG,We Are Somebody,,,,,,P.O. Box 91956,,Cleveland,OH,44101,,,2024-08-07,2500.00,,Donation,012,,,,,,,,,,,,,,,,,,,
