form_type,filer_committee_id_number,transaction_id_number,back_reference_tran_id_number,back_reference_sched_name,entity_type,payee_organization_name,payee_last_name,payee_first_name,payee_middle_name,payee_prefix,payee_suffix,payee_street_1,payee_street_2,payee_city,payee_state,payee_zip_code,election_code,election_other_description,expenditure_date,expenditure_amount,semi_annual_refunded_bundled_amt,expenditure_purpose_descrip,category_code,beneficiary_committee_fec_id,beneficiary_committee_name,beneficiary_candidate_fec_id,beneficiary_candidate_last_name,beneficiary_candidate_first_name,beneficiary_candidate_middle_name,beneficiary_candidate_prefix,beneficiary_candidate_suffix,beneficiary_candidate_office,beneficiary_candidate_state,beneficiary_candidate_district,conduit_name,conduit_street_1,conduit_street_2,conduit_city,conduit_state,conduit_zip_code,memo_code,memo_text_description,reference_to_si_or_sl_system_code_that_identifies_the_account
SB23,C00640433,SB23.11589,,,CCM,DAVE MIN FOR CONGRESS,,,,,,PO BOX 5959,,IRVINE,CA,92616,G2024,,2024-07-12,2400.00,,Campaign Contribution,011,C00831537,DAVE MIN FOR CONGRESS,,,,,,,H,CA,47,,,,,,,,
SB23,C00640433,SB23.11716,,,CCM,DEREK TRAN FOR CONGRESS,,,,,,"10441 STANFORD AVENUE, #395",,GARDEN GROVE,CA,92842,G2024,,2024-08-24,2000.00,,Campaign Contribution,011,C00851790,DEREK TRAN FOR CONGRESS,,,,,,,H,CA,45,,,,,,,,
SB23,C00640433,SB23.11718,,,CCM,GEORGE WHITESIDES FOR CONGRESS,,,,,,P.O. BOX 221776,,NEWHALL,CA,91322,G2024,,2024-08-24,2000.00,,Campaign Contribution,011,C00834028,GEORGE WHITESIDES FOR CONGRESS,,,,,,,H,CA,27,,,,,,,,
SB23,C00640433,SB23.11587,,,CCM,Joe Kerr for Congress,,,,,,P.O. Box 5012,,Orange,CA,92863,G2024,,2024-07-12,2400.00,,Campaign Contribution,011,C00840041,Joe Kerr for Congress,,,,,,,H,CA,40,,,,,,,,
SB23,C00640433,SB23.11588,,,CCM,MIKE LEVIN FOR CONGRESS,,,,,,PO BOX 2112,STE 400,CAPISTRANO BEACH,CA,92624,G2024,,2024-07-12,2400.00,,Campaign Contribution,011,C00634253,MIKE LEVIN FOR CONGRESS,,,,,,,H,CA,49,,,,,,,,
SB23,C00640433,SB23.11719,,,CCM,WILL ROLLINS FOR CONGRESS,,,,,,PO BOX 6282,414 W GRAND BLVD,CORONA,CA,92878,G2024,,2024-08-24,2000.00,,Campaign Contribution,011,C00792507,WILL ROLLINS FOR CONGRESS,,,,,,,H,CA,41,,,,,,,,
