form_type,filer_committee_id_number,transaction_id_number,back_reference_tran_id_number,back_reference_sched_name,entity_type,payee_organization_name,payee_last_name,payee_first_name,payee_middle_name,payee_prefix,payee_suffix,payee_street_1,payee_street_2,payee_city,payee_state,payee_zip_code,election_code,election_other_description,expenditure_date,expenditure_amount,semi_annual_refunded_bundled_amt,expenditure_purpose_descrip,category_code,beneficiary_committee_fec_id,beneficiary_committee_name,beneficiary_candidate_fec_id,beneficiary_candidate_last_name,beneficiary_candidate_first_name,beneficiary_candidate_middle_name,beneficiary_candidate_prefix,beneficiary_candidate_suffix,beneficiary_candidate_office,beneficiary_candidate_state,beneficiary_candidate_district,conduit_name,conduit_street_1,conduit_street_2,conduit_city,conduit_state,conduit_zip_code,memo_code,memo_text_description,reference_to_si_or_sl_system_code_that_identifies_the_account
SB29,C00390161,SB29.7810,,,CCM,Anna Coriddi-Meza for CNUSD School Board 2024,,,,,,1085 Regina Way,,Corona,CA,92882,,,2024-10-15,500.00,,Local Political Contribution,011,,,,,,,,,,,,,,,,,,,
SB29,C00390161,SB29.7812,,,CCM,Elect Jami Merchant for CNUSD School Board 202410/15,,,,,,2807 Breezy Meadow Lane,,Corona,CA,92883,,,2024-10-15,500.00,,Local Political Contribution,011,,,,,,,,,,,,,,,,,,,
SB29,C00390161,SB29.7830,,,ORG,Fix USA,,,,,,800 Kimberton Road,Unit M13,Phoenixville,PA,19460,,,2024-10-11,5000.00,,"Reissue of Returned Check from 6/12, Charitable Donation",012,,,,,,,,,,,,,,,,,,,
SB29,C00390161,SB29.7806,,,CCM,Gerald Pfohl for Judge,,,,,,3649  Mission Inn Ave,2nd Floor,Riversitde,CA,92501,G2024,,2024-10-09,-1000.00,,"VOID Local Political Contribution, Lost Check, Reissued 10/9",011,,,,,,,,,,,,,,,,,,,
SB29,C00390161,SB29.7807,,,CCM,Gerald Pfohl for Judge,,,,,,3649  Mission Inn Ave,2nd Floor,Riversitde,CA,92501,G2024,,2024-10-09,1000.00,,Reissue of Local Political Contribution,011,,,,,,,,,,,,,,,,,,,
