form_type,filer_committee_id_number,transaction_id_number,back_reference_tran_id_number,back_reference_sched_name,entity_type,payee_organization_name,payee_last_name,payee_first_name,payee_middle_name,payee_prefix,payee_suffix,payee_street_1,payee_street_2,payee_city,payee_state,payee_zip_code,election_code,election_other_description,expenditure_date,expenditure_amount,semi_annual_refunded_bundled_amt,expenditure_purpose_descrip,category_code,beneficiary_committee_fec_id,beneficiary_committee_name,beneficiary_candidate_fec_id,beneficiary_candidate_last_name,beneficiary_candidate_first_name,beneficiary_candidate_middle_name,beneficiary_candidate_prefix,beneficiary_candidate_suffix,beneficiary_candidate_office,beneficiary_candidate_state,beneficiary_candidate_district,conduit_name,conduit_street_1,conduit_street_2,conduit_city,conduit_state,conduit_zip_code,memo_code,memo_text_description,reference_to_si_or_sl_system_code_that_identifies_the_account
SB29,C00827808,SB29.4225,,,CAN,,Austin Schauer for ND House,(Austin),,,,110 West Beaton Drive,,West Fargo,ND,58078,,,2024-02-01,250.00,,,011,,,,Austin Schauer for ND House,(Austin),,,,,,,,,,,,,,
SB29,C00827808,SB29.4219,,,CAN,,Brandy Pyle for ND House,(Brandy),,,,3512 154th Avenue SE,PO Box 337,Casselton,ND,58012,,,2024-02-01,250.00,,,011,,,,Brandy Pyle for ND House,(Brandy),,,,H,ND,22,,,,,,,,
SB29,C00827808,SB29.4229,,,CAN,,Kelly Armstrong,for ND Governor,,,,1515 Burnt Boat Drive,Suite C Box 112,Bismarck,ND,58503,,,2024-03-18,1000.00,,,011,,,,Kelly Armstrong,for ND Governor,,,,,,,,,,,,,,
SB29,C00827808,SB29.4215,,,CAN,,Mark Weber for ND Senate,(Mark),,,,641 Langer Avenue S,PO Box 231,Casselton,ND,580123619,,,2024-02-01,250.00,,,011,,,,Mark Weber for ND Senate,(Mark),,,,S,ND,22,,,,,,,,
SB29,C00827808,SB29.4213,,,CAN,,Mike Nathe for ND House,(Mike),,,,1899 Bonn Blvd,,Bismarck,ND,58504,,,2024-02-01,500.00,,,011,,,,Mike Nathe for ND House,(Mike),,,,H,ND,30,,,,,,,,
