form_type,filer_committee_id_number,transaction_id_number,back_reference_tran_id_number,back_reference_sched_name,entity_type,payee_organization_name,payee_last_name,payee_first_name,payee_middle_name,payee_prefix,payee_suffix,payee_street_1,payee_street_2,payee_city,payee_state,payee_zip_code,election_code,election_other_description,expenditure_date,expenditure_amount,semi_annual_refunded_bundled_amt,expenditure_purpose_descrip,category_code,beneficiary_committee_fec_id,beneficiary_committee_name,beneficiary_candidate_fec_id,beneficiary_candidate_last_name,beneficiary_candidate_first_name,beneficiary_candidate_middle_name,beneficiary_candidate_prefix,beneficiary_candidate_suffix,beneficiary_candidate_office,beneficiary_candidate_state,beneficiary_candidate_district,conduit_name,conduit_street_1,conduit_street_2,conduit_city,conduit_state,conduit_zip_code,memo_code,memo_text_description,reference_to_si_or_sl_system_code_that_identifies_the_account
SB21B,C00508440,500500817,,,ORG,Human Rights Campaign,,,,,,1640 Rhode Island Ave NW,,Washington,DC,200363200,,,2023-08-05,833.00,0.00,Fundraising Event Expense,,,,,,,,,,,,,,,,,,,,"Original Vendor: Dana Goldberg, 465 N. Curson LA CA 90036"
SB21B,C00508440,500500824,,,ORG,Human Rights Campaign,,,,,,1640 Rhode Island Ave NW,,Washington,DC,200363200,,,2023-08-05,1909.74,0.00,Fundraising Event Expense,,,,,,,,,,,,,,,,,,,,"Original Vendor: Marriott, 101 Bowie St, San Antonio TX 78205"
SB21B,C00508440,500500818,,,ORG,Human Rights Campaign,,,,,,1640 Rhode Island Ave NW,,Washington,DC,200363200,,,2023-08-12,833.00,0.00,Fundraising Event Expense,,,,,,,,,,,,,,,,,,,,Original Vendor: Dana Goldberg 465 N. Curson LA CA 90036
SB21B,C00508440,500500821,,,ORG,Human Rights Campaign,,,,,,1640 Rhode Island Ave NW,,Washington,DC,200363200,,,2023-08-12,450.00,0.00,Fundraising Event Expense,,,,,,,,,,,,,,,,,,,,"Original Vendor: Double Angels, 21860 Burbank Blvd, Westwood CA 91364"
SB21B,C00508440,500500823,,,ORG,Human Rights Campaign,,,,,,1640 Rhode Island Ave NW,,Washington,DC,200363200,,,2023-08-12,3408.27,0.00,Fundraising Event Expense,,,,,,,,,,,,,,,,,,,,"Original Vendor: Grant Hotel, 326 Broadway, San Diego CA 92101"
SB21B,C00508440,500500825,,,ORG,Human Rights Campaign,,,,,,1640 Rhode Island Ave NW,,Washington,DC,200363200,,,2023-08-26,2029.68,0.00,Fundraising Event Expense,,,,,,,,,,,,,,,,,,,,"Original Vendor: Intercontinental, 9801 Carnegie Ave, Cleveland OH 44106"
SB21B,C00508440,4597365I,4597365,SA11AI,ORG,Human Rights Campaign,,,,,,1640 Rhode Island Ave NW,,Washington,DC,200363200,,,2023-08-31,587.18,0.00,Administrative Support,,,,,,,,,,,,,,,,,,,,* In-Kind Received
SB21B,C00508440,500515082,,,ORG,Human Rights Campaign,,,,,,1640 Rhode Island Ave NW,,Washington,DC,200363200,,,2023-08-31,87.50,0.00,Legal Fees,,,,,,,,,,,,,,,,,,,,"Trister, Ross, Schadler, Gold 1666 Conn Ave NW, WDC 20009"
