form_type,filer_committee_id_number,transaction_id_number,back_reference_tran_id_number,back_reference_sched_name,entity_type,payee_organization_name,payee_last_name,payee_first_name,payee_middle_name,payee_prefix,payee_suffix,payee_street_1,payee_street_2,payee_city,payee_state,payee_zip_code,election_code,election_other_description,expenditure_date,expenditure_amount,semi_annual_refunded_bundled_amt,expenditure_purpose_descrip,category_code,beneficiary_committee_fec_id,beneficiary_committee_name,beneficiary_candidate_fec_id,beneficiary_candidate_last_name,beneficiary_candidate_first_name,beneficiary_candidate_middle_name,beneficiary_candidate_prefix,beneficiary_candidate_suffix,beneficiary_candidate_office,beneficiary_candidate_state,beneficiary_candidate_district,conduit_name,conduit_street_1,conduit_street_2,conduit_city,conduit_state,conduit_zip_code,memo_code,memo_text_description,reference_to_si_or_sl_system_code_that_identifies_the_account
SB23,C00019653,EB248595,,,COM,DEFEND THE DREAM,,,,,,"777 S. FIGUEROA ST., STE. 4050",,LOS ANGELES,CA,90017,,,2024-01-30,5000.00,,,011,C00771238,DEFEND THE DREAM,,,,,,,,,,,,,,,,,
SB23,C00019653,EB248594,,,COM,DEMOCRATS RESHAPING AMERICA (DREAMPAC),,,,,,P.O. BOX 83142,,GAITHERSBURG,MD,20883,,,2024-01-30,2500.00,,,011,C00423079,DEMOCRATS RESHAPING AMERICA (DREAMPAC),,,,,,,,,,,,,,,,,
SB23,C00019653,EB248593,,,CCM,JUDY CHU FOR CONGRESS,,,,,,"16633 VENTURA BLVD., #1008",,ENCINO,CA,91436,P2024,,2024-01-30,1000.00,,,011,C00458125,JUDY CHU FOR CONGRESS,,CHU,JUDY,,,,H,CA,28,,,,,,,,
SB23,C00019653,EB248597,,,CCM,LUZ RIVAS FOR CONGRESS,,,,,,P.O. BOX 341533,,ARLETA,CA,91334,P2024,,2024-01-30,1000.00,,,011,C00857417,LUZ RIVAS FOR CONGRESS,,RIVAS,LUZ,,,,H,CA,29,,,,,,,,
SB23,C00019653,EB248599,,,CCM,NORMA TORRES FOR CONGRESS,,,,,,728 W EDNA PLACE,,COVINA,CA,91722,P2024,,2024-01-30,1000.00,,,011,C00557652,NORMA TORRES FOR CONGRESS,,TORRES,NORMA,,,,H,CA,35,,,,,,,,
SB23,C00019653,EB248598,,,CCM,SHERMAN FOR CONGRESS,,,,,,"777 S. FIGUEROA ST., STE. 4050",,LOS ANGELES,CA,90017,P2024,,2024-01-30,1000.00,,,011,C00308742,SHERMAN FOR CONGRESS,,SHERMAN,BRAD,,,,H,CA,32,,,,,,,,
SB23,C00019653,EB248596,,,CCM,SYDNEY KAMLAGER-DOVE FOR CONGRESS,,,,,,"600 PENNSYLVANIA AVE., SE, #15180",,WASHINGTON,DC,20003,P2024,,2024-01-30,1000.00,,,011,C00795823,SYDNEY KAMLAGER-DOVE FOR CONGRESS,,KAMLAGER-DOVE,SYDNEY,,,,H,CA,37,,,,,,,,
SB23,C00019653,EB248600,,,CCM,VALADAO FOR CONGRESS,,,,,,"5132 N. PALM AVE., #227",,FRESNO,CA,93704,P2024,,2024-01-30,1500.00,,,011,C00499392,VALADAO FOR CONGRESS,,VALADAO,DAVID,,,,H,CA,22,,,,,,,,
SB23,C00019653,EB248601,,,COM,VIBE PAC (VICTORY BY INVESTING BUILDING EMPOWERING),,,,,,"122 C STREET, NW, STE. 360",,WASHINGTON,DC,20001,,,2024-01-30,2500.00,,,011,C00570101,VIBE PAC (VICTORY BY INVESTING BUILDING EMPOWERING),,,,,,,,,,,,,,,,,
