form_type,filer_committee_id_number,transaction_id_number,back_reference_tran_id_number,back_reference_sched_name,entity_type,payee_organization_name,payee_last_name,payee_first_name,payee_middle_name,payee_prefix,payee_suffix,payee_street_1,payee_street_2,payee_city,payee_state,payee_zip_code,election_code,election_other_description,expenditure_date,expenditure_amount,semi_annual_refunded_bundled_amt,expenditure_purpose_descrip,category_code,beneficiary_committee_fec_id,beneficiary_committee_name,beneficiary_candidate_fec_id,beneficiary_candidate_last_name,beneficiary_candidate_first_name,beneficiary_candidate_middle_name,beneficiary_candidate_prefix,beneficiary_candidate_suffix,beneficiary_candidate_office,beneficiary_candidate_state,beneficiary_candidate_district,conduit_name,conduit_street_1,conduit_street_2,conduit_city,conduit_state,conduit_zip_code,memo_code,memo_text_description,reference_to_si_or_sl_system_code_that_identifies_the_account
SB23,C00206136,BA67C861088704D5EB0E,,,CCM,Robin Kelly for Congress,,,,,,"413 New Jersey Ave., SE",,Washington,DC,200034007,P2024,,2023-06-23,1500.00,,Contribution to committee,,C00539866,Robin Kelly for Congress,H2IL02172,Kelly,Robin,,Rep.,,H,IL,02,,,,,,,,,
SB23,C00206136,BB4C79F5C65C34012A7F,,,CCM,Friends of Jim Clyburn,,,,,,"499 S. Capitol St., SW",Suite 420,Washington,DC,200034027,P2024,,2023-06-09,1000.00,,Political Contribution,,C00255562,Friends of Jim Clyburn,H2SC02042,Clyburn,James,E.,Rep.,,H,SC,06,,,,,,,,,
SB23,C00206136,B0E4CCF325F284346BC8,,,CCM,Friends Of Bennie Thompson,,,,,,PO Box 100,,Bolton,MS,390410100,P2024,,2023-06-09,1000.00,,Political Contribution,,C00279851,Friends Of Bennie Thompson,H4MS02068,Thompson,Bennie,G.,Rep.,,H,MS,02,,,,,,,,,
SB23,C00206136,B818FD61AD203428BBA3,,,CCM,Walberg for Congress,,,,,,PO Box 1362,,Jackson,MI,492041362,P2024,,2023-06-09,1000.00,,Political Contribution,,C00390724,Walberg for Congress,H4MI07103,Walberg,Tim,,Rep.,,H,MI,05,,,,,,,,,
SB23,C00206136,B4FBDACB034524FB9BF5,,,CCM,ERIC BURLISON FOR CONGRESS,,,,,,411 First St. SE c/o Blair Wilson,,Washington,DC,200031827,P2024,,2023-06-23,1000.00,,Contribution to committee,,C00788414,ERIC BURLISON FOR CONGRESS,H2MO07143,Burlison,Eric,,Rep.,,H,MO,07,,,,,,,,,
SB23,C00206136,BA4EF8F21A4CC48449C7,,,CCM,Mike Bost for Congress,,,,,,PO Box 1212,,Murphysboro,IL,629661212,P2024,,2023-06-09,1000.00,,Political Contribution,,C00546499,Mike Bost for Congress,H4IL12060,Bost,Mike,,Rep.,,H,IL,12,,,,,,,,,
SB23,C00206136,BADC8725FDC5C42AAB51,,,CCM,Blaine For Congress,,,,,,3410 Alabama Avenue,,Alexandria,VA,223051736,P2024,,2023-06-23,1000.00,,Contribution to committee,,C00458679,Blaine For Congress,H8MO09153,Luetkemeyer,Blaine,,Rep.,,H,MO,03,,,,,,,,,
SB23,C00206136,B5E99557344624202946,,,CCM,Mary Miller for Congress,,,,,,411 First St SE,,Washington,DC,20003,P2024,,2023-06-09,1000.00,,Contribution to committee,,C00723916,Mary Miller for Congress,H0IL15129,Miller,Mary,,Rep.,,H,IL,15,,,,,,,,,
SB23,C00206136,BDA509D27172C42FA8BC,,,PAC,EMMER VICTORY COMMITTEE DBA REPUBLICAN CONGRESSIONAL VICTORY COMMITTEE,,,,,,5827 Colfax Ave.,,Alexandria,VA,223111013,O2023,Other,2023-06-09,1000.00,,Political Contribution - Emmer for Congress,,C00573444,EMMER VICTORY COMMITTEE DBA REPUBLICAN CONGRESSIONAL VICTORY COMMITTEE,,,,,,,,,,,,,,,,,,
