form_type,filer_committee_id_number,transaction_id_number,back_reference_tran_id_number,back_reference_sched_name,entity_type,payee_organization_name,payee_last_name,payee_first_name,payee_middle_name,payee_prefix,payee_suffix,payee_street_1,payee_street_2,payee_city,payee_state,payee_zip_code,election_code,election_other_description,expenditure_date,expenditure_amount,semi_annual_refunded_bundled_amt,expenditure_purpose_descrip,category_code,beneficiary_committee_fec_id,beneficiary_committee_name,beneficiary_candidate_fec_id,beneficiary_candidate_last_name,beneficiary_candidate_first_name,beneficiary_candidate_middle_name,beneficiary_candidate_prefix,beneficiary_candidate_suffix,beneficiary_candidate_office,beneficiary_candidate_state,beneficiary_candidate_district,conduit_name,conduit_street_1,conduit_street_2,conduit_city,conduit_state,conduit_zip_code,memo_code,memo_text_description,reference_to_si_or_sl_system_code_that_identifies_the_account
SB23,C00046474,B5BBAAD49335F4D0BA2B,,,CCM,GABE VASQUEZ FOR CONGRESS,,,,,,DRAWER L,,Mesilla,NM,880464612,P2024,,2024-01-17,1000.00,,Contribution to Committee,,C00789404,GABE VASQUEZ FOR CONGRESS,H2NM02191,Vasquez,Gabe,,Rep.,,H,NM,02,,,,,,,,,
SB23,C00046474,B13639B4896424E76A90,,,CCM,Robin Kelly For Congress,,,,,,P.O. Box 3411,,Chicago,IL,606540381,P2024,,2024-01-17,2500.00,,Contribution to Committee,,C00539866,Robin Kelly For Congress,H2IL02172,Kelly,Robin,,Rep.,,H,IL,02,,,,,,,,,
SB23,C00046474,BA0A26910506B4185BE4,,,PTY,Democratic Senatorial Campaign Committee,,,,,,120 Maryland Avenue Northeast,,Washington,DC,200025610,O2024,Other,2024-01-17,15000.00,,Contribution to Committee,,C00042366,Democratic Senatorial Campaign Committee,,,,,,,,,,,,,,,,,,
SB23,C00046474,B2BA7CAD16EA14E9DB28,,,PTY,National Republican Congressional Cmte,,,,,,320 First Street,,Washington,DC,200031838,O2024,Other,2024-01-17,15000.00,,Contribution to Committee,,C00075820,National Republican Congressional Cmte,,,,,,,,,,,,,,,,,,
SB23,C00046474,B6E48D0A4541743A484E,,,PTY,National Republican Senatorial Committee,,,,,,425 2nd St NE,,Washington,DC,200024914,O2024,Other,2024-01-17,15000.00,,Contribution to Committee,,C00027466,National Republican Senatorial Committee,,,,,,,,,,,,,,,,,,
SB23,C00046474,B14E5A0B292104DB0ADD,,,PTY,Democratic Congressional Campaign Cmte,,,,,,430 S Capitol St SE Fl 2,,Washington,DC,200034024,O2024,Other,2024-01-17,15000.00,,Contribution to Committee,,C00046474,Democratic Congressional Campaign Cmte,,,,,,,,,,,,,,,,,,
SB23,C00046474,B7EFD9B8A5D31438082B,,,CCM,Huizenga For Congress,,,,,,PO Box 254,,Zeeland,MI,494640254,P2024,,2024-01-17,1500.00,,Contribution to Committee,,C00459297,Huizenga For Congress,H0MI02094,Huizenga,Bill,,Rep.,,H,MI,04,,,,,,,,,
SB23,C00046474,B39442D4FDDF848B1B89,,,PAC,JOHNSON LEADERSHIP FUND,,,,,,C/O 228 S. WASHINGTON ST.,STE. 115,Alexandria,VA,22314,P2024,,2024-01-17,10000.00,,"JFC Contri: Mike Johnson, American Revival PAC",,C00771246,JOHNSON LEADERSHIP FUND,H6LA04138,Johnson,Mike,,Rep.,,H,LA,04,,,,,,,,,
