form_type,filer_committee_id_number,transaction_id_number,back_reference_tran_id_number,back_reference_sched_name,entity_type,payee_organization_name,payee_last_name,payee_first_name,payee_middle_name,payee_prefix,payee_suffix,payee_street_1,payee_street_2,payee_city,payee_state,payee_zip_code,election_code,election_other_description,expenditure_date,expenditure_amount,semi_annual_refunded_bundled_amt,expenditure_purpose_descrip,category_code,beneficiary_committee_fec_id,beneficiary_committee_name,beneficiary_candidate_fec_id,beneficiary_candidate_last_name,beneficiary_candidate_first_name,beneficiary_candidate_middle_name,beneficiary_candidate_prefix,beneficiary_candidate_suffix,beneficiary_candidate_office,beneficiary_candidate_state,beneficiary_candidate_district,conduit_name,conduit_street_1,conduit_street_2,conduit_city,conduit_state,conduit_zip_code,memo_code,memo_text_description,reference_to_si_or_sl_system_code_that_identifies_the_account
SB21B,C00508440,500680109,,,ORG,Human Rights Campaign,,,,,,1640 Rhode Island Ave NW,,Washington,DC,200363200,,,2024-09-07,9410.34,0.00,Fundraising Event Expense,,,,,,,,,,,,,,,,,,,,"Original Vendor: Washington Conv. Ctr., 801 Mt Vernon Pl NW DC 20001"
SB21B,C00508440,500680110,,,ORG,Human Rights Campaign,,,,,,1640 Rhode Island Ave NW,,Washington,DC,200363200,,,2024-09-07,833.00,0.00,Fundraising Event Expense,,,,,,,,,,,,,,,,,,,,Original Vendor: Dana Goldberg 465 N. Curson LA CA 90036
SB21B,C00508440,500683017,,,ORG,Human Rights Campaign,,,,,,1640 Rhode Island Ave NW,,Washington,DC,200363200,,,2024-09-21,2608.53,0.00,Fundraising Event Expense,,,,,,,,,,,,,,,,,,,,"Original Vendor: Hyatt, 1300 Nicollet Mall, Minneapolis MN 55403"
SB21B,C00508440,500683018,,,ORG,Human Rights Campaign,,,,,,1640 Rhode Island Ave NW,,Washington,DC,200363200,,,2024-09-28,2029.86,0.00,Fundraising Event Expense,,,,,,,,,,,,,,,,,,,,"Original Vendor: Huntington Convention Ctr, 300 Lakeside, Cleveland OH 44113"
SB21B,C00508440,5652730I,5652730,SA11AI,ORG,Human Rights Campaign,,,,,,1640 Rhode Island Ave NW,,Washington,DC,200363200,,,2024-09-30,864.58,0.00,Administrative Support,,,,,,,,,,,,,,,,,,,,* In-Kind Received
