form_type,filer_committee_id_number,transaction_id_number,back_reference_tran_id_number,back_reference_sched_name,entity_type,payee_organization_name,payee_last_name,payee_first_name,payee_middle_name,payee_prefix,payee_suffix,payee_street_1,payee_street_2,payee_city,payee_state,payee_zip_code,election_code,election_other_description,expenditure_date,expenditure_amount,semi_annual_refunded_bundled_amt,expenditure_purpose_descrip,category_code,beneficiary_committee_fec_id,beneficiary_committee_name,beneficiary_candidate_fec_id,beneficiary_candidate_last_name,beneficiary_candidate_first_name,beneficiary_candidate_middle_name,beneficiary_candidate_prefix,beneficiary_candidate_suffix,beneficiary_candidate_office,beneficiary_candidate_state,beneficiary_candidate_district,conduit_name,conduit_street_1,conduit_street_2,conduit_city,conduit_state,conduit_zip_code,memo_code,memo_text_description,reference_to_si_or_sl_system_code_that_identifies_the_account
SB23,C00649772,500347942,,,PAC,CONGRESSIONAL BLACK CAUCUS PAC,,,,,,PO Box 75357,,Washington,DC,200130357,,,2024-05-21,5000.00,0.00,Contribution,,C00147512,CONGRESSIONAL BLACK CAUCUS PAC,,,,,,,,,,,,,,,,,
SB23,C00649772,500348764,,,CCM,CLARENCE LAM FOR CONGRESS,,,,,,PO Box 891,,Columbia,MD,210440891,P2024,,2024-05-20,1501.00,0.00,"Contribution - The donation was made via Amex on May 2nd, Paid off from bank account on May 20th",,C00858589,,,LAM,CLARENCE,,,,H,MD,03,,,,,,,,
SB23,C00649772,500347464,,,PAC,PRAIRIE POLITICAL ACTION COMMITTEE,,,,,,PO Box 2002,,Springfield,IL,627052002,,,2024-05-15,5000.00,0.00,Contribution,,C00347195,PRAIRIE POLITICAL ACTION COMMITTEE,,,,,,,,,,,,,,,,,
SB23,C00649772,500348765,,,CCM,SCHAKOWSKY FOR CONGRESS,,,,,,PO Box 5130,,Evanston,IL,602045130,G2024,,2024-05-20,1000.00,0.00,"Contribution - The donation was made via Amex on May 9th, Paid off from bank account on May 20th",,C00327023,,,SCHAKOWSKY,JANICE,D,,,H,IL,09,,,,,,,,
SB23,C00649772,500347465,,,CCM,Strickland For Washington,,,,,,1625 E 72Nd St,Ste Pm 700,Tacoma,WA,984045455,P2024,,2024-05-16,1501.00,0.00,Contribution,,C00732826,,,STRICKLAND,MARILYN,,,,H,WA,10,,,,,,,,
