form_type,filer_committee_id_number,transaction_id_number,back_reference_tran_id_number,back_reference_sched_name,entity_type,payee_organization_name,payee_last_name,payee_first_name,payee_middle_name,payee_prefix,payee_suffix,payee_street_1,payee_street_2,payee_city,payee_state,payee_zip_code,election_code,election_other_description,expenditure_date,expenditure_amount,semi_annual_refunded_bundled_amt,expenditure_purpose_descrip,category_code,beneficiary_committee_fec_id,beneficiary_committee_name,beneficiary_candidate_fec_id,beneficiary_candidate_last_name,beneficiary_candidate_first_name,beneficiary_candidate_middle_name,beneficiary_candidate_prefix,beneficiary_candidate_suffix,beneficiary_candidate_office,beneficiary_candidate_state,beneficiary_candidate_district,conduit_name,conduit_street_1,conduit_street_2,conduit_city,conduit_state,conduit_zip_code,memo_code,memo_text_description,reference_to_si_or_sl_system_code_that_identifies_the_account
SB23,C00547356,SB23.5969,,,PTY,California Democratic Party,,,,,,1830 9th St.,,Sacramento,CA,95811,,,2024-09-24,5000.00,,Contribution,,C00105668,,,,,,,,,,,,,,,,,,
SB23,C00547356,SB23.5945,,,CCM,Committee to Elect Shomari Figures for Congress,,,,,,PO Box 40910,907 Spring Hill Ave,Mobile,AL,36604,G2024,,2024-09-20,1000.00,,Contribution,,C00856237,Committee to Elect Shomari Figures for Congress,H4AL02170,Figures,Shomari,C.,,,H,AL,02,,,,,,,,
SB23,C00547356,SB23.5940,,,CCM,Emily Randall for Congress,,,,,,PO Box 1883,,Port Orchard,WA,98366,G2024,,2024-09-12,2500.00,,Contribution,,C00857094,Emily Randall for Congress,H4WA06117,Randall,Emily,,,,H,WA,06,,,,,,,,
SB23,C00547356,SB23.5967,,,CCM,Emily Randall for Congress,,,,,,PO Box 1883,,Port Orchard,WA,98366,G2024,,2024-09-24,2500.00,,Contribution,,C00857094,Emily Randall for Congress,H4WA06117,Randall,Emily,,,,H,WA,06,,,,,,,,
SB23,C00547356,SB23.5971,,,PAC,Emily Randall Victory Fund,,,,,,401 2nd Ave S,Suite 303,Seattle,WA,98104,,,2024-09-24,5000.00,,Contribution,,C00887646,,,,,,,,,,,,,,,,,,
SB23,C00547356,SB23.5941,,,CCM,Evan Low for Congress,,,,,,1700 Tribute Rd,Suite 201,Sacramento,CA,95815,G2024,,2024-09-10,5000.00,,Contribution,,C00858969,Evan Low for Congress,H4CA16239,Low,Evan,,,,H,CA,16,,,,,,,,
SB23,C00547356,SB23.5942,,,CCM,Gabe Vasquez for Congress,,,,,,Drawer L,,Mesilla,NM,88046,G2024,,2024-09-20,1000.00,,Contribution,,C00789404,Gabe Vasquez for Congress,H2NM02191,Vasquez,Gabriel,,,,H,NM,02,,,,,,,,
SB23,C00547356,SB23.5968,,,CCM,Mark Takano for Congress,,,,,,PO Box 5214,,Riverside,CA,92517,G2024,,2024-09-24,5000.00,,Contribution,,C00498667,Mark Takano for Congress,H2CA43245,Takano,Mark,,,,H,CA,41,,,,,,,,
SB23,C00547356,SB23.5976,,,CCM,Will Rollins for Congress,,,,,,31500 Grape St,Suite 3-452,Lake Elsinore,CA,92532,G2024,,2024-09-30,5000.00,,Contribution,,C00792507,Will Rollins for Congress,H2CA42205,Rollins,Will,,,,H,CA,41,,,,,,,,
