form_type,filer_committee_id_number,transaction_id_number,back_reference_tran_id_number,back_reference_sched_name,entity_type,payee_organization_name,payee_last_name,payee_first_name,payee_middle_name,payee_prefix,payee_suffix,payee_street_1,payee_street_2,payee_city,payee_state,payee_zip_code,election_code,election_other_description,expenditure_date,expenditure_amount,semi_annual_refunded_bundled_amt,expenditure_purpose_descrip,category_code,beneficiary_committee_fec_id,beneficiary_committee_name,beneficiary_candidate_fec_id,beneficiary_candidate_last_name,beneficiary_candidate_first_name,beneficiary_candidate_middle_name,beneficiary_candidate_prefix,beneficiary_candidate_suffix,beneficiary_candidate_office,beneficiary_candidate_state,beneficiary_candidate_district,conduit_name,conduit_street_1,conduit_street_2,conduit_city,conduit_state,conduit_zip_code,memo_code,memo_text_description,reference_to_si_or_sl_system_code_that_identifies_the_account
SB23,C00774497,BF9E7C667457F47699D6,,,CCM,GARBARINO FOR CONGRESS,,,,,,PO BOX 101,,BAYPORT,NY,117050101,G2024,,2024-10-15,1000.00,,POLITICAL CONTRIBUTION,,C00729954,GARBARINO FOR CONGRESS,H0NY02234,GARBARINO,ANDREW,,REP.,,H,NY,02,,,,,,,,,
SB23,C00774497,B24863C34631E4CE986B,,,CCM,CHRISSY HOULAHAN FOR CONGRESS,,,,,,PO BOX 222,,DEVON,PA,19333,G2024,,2024-10-15,2000.00,,POLITICAL CONTRIBUTION,,C00637371,CHRISSY HOULAHAN FOR CONGRESS,H8PA06087,HOULAHAN,CHRISSY,,REP.,,H,PA,06,,,,,,,,,
SB23,C00774497,BF2AAF012A04C4AB19DC,,,CCM,COMMITTEE TO ELECT JARED GOLDEN,,,,,,PO BOX 7108,,LEWISTON,ME,04240,O2024,OTHER,2024-10-09,1000.00,,EARMARKED FROM GRANT COUCH,,C00653816,COMMITTEE TO ELECT JARED GOLDEN,H8ME02185,GOLDEN,JARED,,REP.,,H,ME,02,,,,,,,,EARMARKED FROM GRANT COUCH. TRANSMITTED BY CHECK/EFT,
SB23,C00774497,B2704967098BE431FBE7,,,PAC,SIX PAC,,,,,,PO BOX 183,,HUDSON,WI,54016,O2024,OTHER,2024-10-01,3000.00,,POLITICAL CONTRIBUTION,,C00770255,SIX PAC,,,,,,,,,,,,,,,,,,
SB23,C00774497,B8DF156ECCD9E4C8F909,,,PAC,ELECT MORE DEMOCRATS PAC,,,,,,918 PENNSYLVANIA AVE SE,,WASHINGTON,DC,200032140,O2024,OTHER,2024-10-10,5000.00,,POLITICAL CONTRIBUTION,,C00695395,ELECT MORE DEMOCRATS PAC,,,,,,,,,,,,,,,,,,
