form_type,filer_committee_id_number,transaction_id_number,back_reference_tran_id_number,back_reference_sched_name,entity_type,payee_organization_name,payee_last_name,payee_first_name,payee_middle_name,payee_prefix,payee_suffix,payee_street_1,payee_street_2,payee_city,payee_state,payee_zip_code,election_code,election_other_description,expenditure_date,expenditure_amount,semi_annual_refunded_bundled_amt,expenditure_purpose_descrip,category_code,beneficiary_committee_fec_id,beneficiary_committee_name,beneficiary_candidate_fec_id,beneficiary_candidate_last_name,beneficiary_candidate_first_name,beneficiary_candidate_middle_name,beneficiary_candidate_prefix,beneficiary_candidate_suffix,beneficiary_candidate_office,beneficiary_candidate_state,beneficiary_candidate_district,conduit_name,conduit_street_1,conduit_street_2,conduit_city,conduit_state,conduit_zip_code,memo_code,memo_text_description,reference_to_si_or_sl_system_code_that_identifies_the_account
SB29,C00115527,23227206,,,COM,Committee to Elect Janelle Bynum,,,,,,3321 SE 20th Avenue,,Portland,OR,97202,,,2024-12-17,-500.00,0.00,Void - Committee to Elect Janelle Bynum,011,,,,Bynum,Janelle,,OR Rep.,,,,,,,,,,,,Void - Committee to Elect Janelle Bynum
SB29,C00115527,23260036,,,COM,Shapiro for Pennsylvania,,,,,,P.O. Box 22635,,Philadelphia,PA,19110,,,2024-12-13,1000.00,0.00,"Joshua Shapiro, GOVERNOR  PA",011,,,,Shapiro,Joshua,,Governor,,,,,,,,,,,,"Joshua Shapiro, GOVERNOR  PA"
SB29,C00115527,23260040,,,COM,Citizens for Omar Sabir,,,,,,7300 City Line Avenue,,Philadelphia,PA,19151,,,2024-12-17,1000.00,0.00,"Omar Sabir, LOCAL  PA",011,,,,Sabir,Omar,,Councilman,,,,,,,,,,,,"Omar Sabir, LOCAL  PA"
SB29,C00115527,23260041,,,COM,Judge Dugan for DA,,,,,,PO Box 6066,,Philadelphia,PA,19154,,,2024-12-17,5000.00,0.00,"Patrick Dugan, LOCAL  PA",011,,,,Dugan,Patrick,,,,,,,,,,,,,,"Patrick Dugan, LOCAL  PA"
SB29,C00115527,23260045,,,COM,Citizens of Mary Lehman,,,,,,P.O. Box 376,,Laurel,MD,20725,,,2024-12-10,500.00,0.00,"Mary Lehman, STATE HOUSE 21st MD",011,,,,Lehman,Mary,,Delegate,,,,,,,,,,,,"Mary Lehman, STATE HOUSE 21st MD"
SB29,C00115527,23260084,,,ORG,Int'l Association of Heat & Frost Insulators and Allied Workers,,,,,,"9602 Martin Luther King, Jr. Hwy.",,Lanham,MD,20706,,,2024-12-18,77.34,0.00,Reimburse Worldwide Express Inv #2412061964,001,,,,,,,,,,,,,,,,,,,Reimburse Worldwide Express Inv #2412061964
SB29,C00115527,23260085,,,ORG,Int'l Association of Heat & Frost Insulators and Allied Workers,,,,,,"9602 Martin Luther King, Jr. Hwy.",,Lanham,MD,20706,,,2024-12-04,1.38,0.00,Reimbursement for November Postage,001,,,,,,,,,,,,,,,,,,,Reimbursement for November Postage
