form_type,filer_committee_id_number,transaction_id_number,back_reference_tran_id_number,back_reference_sched_name,entity_type,payee_organization_name,payee_last_name,payee_first_name,payee_middle_name,payee_prefix,payee_suffix,payee_street_1,payee_street_2,payee_city,payee_state,payee_zip_code,election_code,election_other_description,expenditure_date,expenditure_amount,semi_annual_refunded_bundled_amt,expenditure_purpose_descrip,category_code,beneficiary_committee_fec_id,beneficiary_committee_name,beneficiary_candidate_fec_id,beneficiary_candidate_last_name,beneficiary_candidate_first_name,beneficiary_candidate_middle_name,beneficiary_candidate_prefix,beneficiary_candidate_suffix,beneficiary_candidate_office,beneficiary_candidate_state,beneficiary_candidate_district,conduit_name,conduit_street_1,conduit_street_2,conduit_city,conduit_state,conduit_zip_code,memo_code,memo_text_description,reference_to_si_or_sl_system_code_that_identifies_the_account
SB23,C99002396,SB23.203271,,,CCM,BERNIE MORENO FOR SENATE,,,,,,PO BOX 340797,,COLUMBUS,OH,43234,G2024,,2024-08-01,5000.00,,Contribution,,C00837484,BERNIE MORENO FOR SENATE,,,,,,,S,OH,00,,,,,,,,
SB23,C99002396,SB23.203274,,,CCM,DAVE MCCORMICK FOR US SENATE,,,,,,PO BOX 23537,,PITTSBURGH,PA,15222,G2024,,2024-08-01,5000.00,,Contribution,,C00800623,DAVE MCCORMICK FOR US SENATE,,,,,,,S,PA,00,,,,,,,,
SB23,C99002396,SB23.203276,,,CCM,KARI LAKE FOR SENATE,,,,,,PO BOX 34341,,PHOENIX,AZ,85067,G2024,,2024-08-01,5000.00,,Contribution,,C00852343,KARI LAKE FOR SENATE,,,,,,,S,AZ,00,,,,,,,,
SB23,C99002396,SB23.203280,,,CCM,ROGERS FOR SENATE,,,,,,PO BOX 132,,SAINT JOSEPH,MI,49085,G2024,,2024-08-13,5000.00,,contribution,,C00849810,ROGERS FOR SENATE,,,,,,,S,MI,00,,,,,,,,
SB23,C99002396,SB23.203278,,,CCM,SAM BROWN FOR NEVADA,,,,,,PO BOX 750844,,LAS VEGAS,NV,89136,G2024,,2024-08-01,5000.00,,contribution,,C00845032,SAM BROWN FOR NEVADA,,,,,,,S,NV,00,,,,,,,,
SB23,C99002396,SB23.203272,,,CCM,TIM SHEEHY FOR MONTANA,,,,,,PO BOX 7209,,HELENA,MT,59604,G2024,,2024-08-01,5000.00,,Contribution,,C00844159,TIM SHEEHY FOR MONTANA,,,,,,,S,MT,00,,,,,,,,
