form_type,filer_committee_id_number,transaction_id_number,back_reference_tran_id_number,back_reference_sched_name,entity_type,payee_organization_name,payee_last_name,payee_first_name,payee_middle_name,payee_prefix,payee_suffix,payee_street_1,payee_street_2,payee_city,payee_state,payee_zip_code,election_code,election_other_description,expenditure_date,expenditure_amount,semi_annual_refunded_bundled_amt,expenditure_purpose_descrip,category_code,beneficiary_committee_fec_id,beneficiary_committee_name,beneficiary_candidate_fec_id,beneficiary_candidate_last_name,beneficiary_candidate_first_name,beneficiary_candidate_middle_name,beneficiary_candidate_prefix,beneficiary_candidate_suffix,beneficiary_candidate_office,beneficiary_candidate_state,beneficiary_candidate_district,conduit_name,conduit_street_1,conduit_street_2,conduit_city,conduit_state,conduit_zip_code,memo_code,memo_text_description,reference_to_si_or_sl_system_code_that_identifies_the_account
SB23,C00122499,BAC439ADCE2E94AB3B44,,,CCM,AARON BEAN FOR CONGRESS,,,,,,2640A MITCHAM DRIVE,,TALLAHASSEE,FL,32308,G2024,,2024-02-29,1000.00,,2024 PR ELECT REP. AARON BEAN,,C00816983,AARON BEAN FOR CONGRESS,H2FL04211,Bean,Aaron,,,,H,FL,04,,,,,,,,,
SB23,C00122499,BD71565A83AD942F59FE,,,CCM,"ANDY BARR FOR CONGRESS, INC.",,,,,,PO BOX 2059,,LEXINGTON,KY,40588,G2024,,2024-03-19,1000.00,,2024 general election of Rep. Andy Barr,,C00467571,"ANDY BARR FOR CONGRESS, INC.",H0KY06104,Barr,Andy,,,IV,H,KY,06,,,,,,,,,
SB23,C00122499,B7A3B3B3677054DA0928,,,CCM,BERGMAN FOR CONGRESS,,,,,,"3585 BUNKER HILL RD, #434",,Acme,MI,496105004,P2024,,2024-02-07,2500.00,,2024 PR RE-EL REP. JACK BERMAN,,C00614214,BERGMAN FOR CONGRESS,H6MI01226,Bergman,Jack,,,,H,MI,01,,,,,,,,,
SB23,C00122499,B0ECF4AEBE6944216B6A,,,CCM,BILIRAKIS FOR CONGRESS,,,,,,PO BOX 606,,Tarpon Springs,FL,346880606,P2024,,2024-02-07,1000.00,,2024 PR EL REP GUS BILIRAKIS,,C00408534,BILIRAKIS FOR CONGRESS,H6FL09070,Bilirakis,Gus,,,,H,FL,12,,,,,,,,,
SB23,C00122499,BE00A5AFBF88E42EC966,,,CCM,BOBBY SCOTT FOR CONGRESS,,,,,,POST OFFICE BOX 251,,NEWPORT NEWS,VA,23607,G2024,,2024-03-19,2500.00,,2024 general election of Rep. Bobby Scott,,C00204669,BOBBY SCOTT FOR CONGRESS,H6VA01117,Scott,Bobby,,,,H,VA,03,,,,,,,,,
SB23,C00122499,B5E8A89CF2C8247A38A5,,,CCM,CITIZENS FOR BOYLE,,,,,,PO BOX 11545,,PHILADELPHIA,PA,19116,G2024,,2024-03-19,1000.00,,2024 general election of Rep. Brendan Boyle,,C00543363,CITIZENS FOR BOYLE,H4PA13199,Boyle,Brendan,,,,H,PA,02,,,,,,,,,
SB23,C00122499,B2165C5B2FEA9452192B,,,PAC,Democratic Congressional Campaign Committee,,,,,,"430 South Capitol Street, SE",2nd floor,Washington,DC,200034024,G2024,,2024-01-19,5000.00,,PAC CONT 2024,,C00000935,Democratic Congressional Campaign Committee,,,,,,,,,,,,,,,,,,
SB23,C00122499,BD255B0B43BFA4965ABC,,,CCM,DR KIM SCHRIER FOR CONGRESS,,,,,,PO BOX 2728,,ISSAQUAH,WA,98027,P2024,,2024-02-07,1000.00,,2024 PRIMARY OF REP. KIM SCHRIER,,C00652628,DR KIM SCHRIER FOR CONGRESS,H8WA08189,Schrier,Kim,,,,H,WA,08,,,,,,,,,
SB23,C00122499,B0996F68390544C0FBDC,,,PAC,DSCC,,,,,,120 MARYLAND AVE NE,.,Washington,DC,200025610,G2024,,2024-01-19,15000.00,,PAC CONT 2024,,C00042366,DSCC,,,,,,,,,,,,,,,,,,
SB23,C00122499,B36A7393D2CDA4C25927,,,CCM,FRIENDS OF DAVE JOYCE,,,,,,320 KENARDEN DRIVE,,Cleveland,OH,441433710,G2024,,2024-03-19,1000.00,,2024 general election of Rep. Dave Joyce,,C00527457,FRIENDS OF DAVE JOYCE,H2OH14064,Joyce,Dave,,,,H,OH,14,,,,,,,,,
SB23,C00122499,B551241E20F7F4EA6925,,,CCM,FRIENDS OF SHERROD BROWN,,,,,,PO BOX 76187,,Washington,DC,200136187,P2024,,2024-02-07,500.00,,2024 PR EL SEN. SHERROD BROWN,,C00264697,FRIENDS OF SHERROD BROWN,S6OH00163,Brown,Sherrod,,,,S,OH,,,,,,,,,,
SB23,C00122499,B0A82E95E16A84596811,,,CCM,GUTHRIE FOR CONGRESS,,,,,,PO Box 9639,,Bowling Green,KY,421029639,P2024,,2024-02-07,1000.00,,2024 PR EL REP. BRETT GUTHRIE,,C00445023,GUTHRIE FOR CONGRESS,H8KY02031,Guthrie,Brett,,,,H,KY,02,,,,,,,,,
SB23,C00122499,BE272E9DE46EE478FA42,,,CCM,JASON SMITH FOR CONGRESS,,,,,,PO BOX 1324,,Cape Girardeau,MO,637021324,G2024,,2024-03-19,2500.00,,2024 general election of Rep. Jason Smith,,C00541862,JASON SMITH FOR CONGRESS,H4MO08162,Smith,Jason,,,,H,MO,08,,,,,,,,,
SB23,C00122499,BE8305370FB4E4E6FB70,,,CCM,KAINE FOR VIRGINIA,,,,,,1751 POTOMAC GREENS DRIVE,,ALEXANDRIA,VA,22314,P2024,,2024-02-07,2500.00,,2024 PR SEN TIM KAINE,,C00495358,KAINE FOR VIRGINIA,S2VA00142,Kaine,Tim,,,,S,VA,,,,,,,,,,
SB23,C00122499,B6C2F0C7B5022492F89D,,,CCM,KLOBUCHAR FOR MINNESOTA,,,,,,PO BOX 4146,,Saint Paul,MN,551040146,P2024,,2024-02-29,2500.00,,2024 PR. RE-ELECT SEN AMY KLOBUCHAR,,C00431353,KLOBUCHAR FOR MINNESOTA,S6MN00267,Klobuchar,Amy,,,,S,MN,,,,,,,,,,
SB23,C00122499,BEB181D23E1E64628947,,,CCM,"LAUREL LEE FOR CONGRESS, INC.",,,,,,P.O. BOX 47556,,TAMPA,FL,33646,G2024,,2024-03-19,1000.00,,2024 general election of Rep. Laurel Lee,,C00815373,"LAUREL LEE FOR CONGRESS, INC.",H2FL15241,Lee,Laurel,,,,H,FL,15,,,,,,,,,
SB23,C00122499,BFB3CA45A275D409EBE1,,,CCM,MOORE FOR CONGRESS,,,,,,PO BOX 16646,,Milwaukee,WI,532160646,P2024,,2024-02-07,1000.00,,2024 PR REP. GWEN MOORE,,C00397505,MOORE FOR CONGRESS,H4WI04183,Moore,Gwen,,,,H,WI,04,,,,,,,,,
SB23,C00122499,B21D4EFD68E8240B98BE,,,PTY,National Republican Congressional Committee,,,,,,320 1st St SE,,Washington,DC,200031838,G2024,,2024-01-19,5000.00,,PAC CONT 2024,,C00075820,National Republican Congressional Committee,,,,,,,,,,,,,,,,,,
SB23,C00122499,BB7A72A786B054E81B98,,,PAC,NEW DEMOCRAT COALITION ACTION FUND,,,,,,233 PENNSYLVANIA AVE SE,,WASHINGTON,DC,20003,G2024,,2024-01-19,5000.00,,PAC CONT 2024,,C00409730,NEW DEMOCRAT COALITION ACTION FUND,,,,,,,,,,,,,,,,,,
SB23,C00122499,BD271128192114615B07,,,PAC,NRSC,,,,,,425 2ND STREET NE,,Washington,DC,200024914,G2024,,2024-01-19,15000.00,,PAC CONT 2024,,C00027466,NRSC,,,,,,,,,,,,,,,,,,
SB23,C00122499,B2424B219A2C043A09D2,,,CCM,PAT RYAN FOR CONGRESS,,,,,,PO BOX 2113,,KINGSTON,NY,12402,P2024,,2024-02-29,1000.00,,2024 PR REP PAT RYAN,,C00815290,PAT RYAN FOR CONGRESS,H8NY19223,Ryan,Patrick,,,,H,NY,18,,,,,,,,,
SB23,C00122499,B81850B4A7AB64C45A11,,,CCM,PAUL TONKO FOR CONGRESS,,,,,,911 CENTRAL AVENUE,,Albany,NY,122061350,P2024,,2024-02-07,2500.00,,2024-PR EL REP. PAUL TONKO,,C00450049,PAUL TONKO FOR CONGRESS,H8NY21203,Tonko,Paul,D.,,,H,NY,20,,,,,,,,,
SB23,C00122499,BC2F6C7F88B524314A45,,,PAC,REPUBLICAN GOVERNANCE GROUP/TUESDAY GROUP PAC,,,,,,610 S. BOULEVARD,,Tampa,FL,336062647,G2024,,2024-01-19,5000.00,,PAC CONT 2024,,C00433060,REPUBLICAN GOVERNANCE GROUP/TUESDAY GROUP PAC,,,,,,,,,,,,,,,,,,
SB23,C00122499,BA271A6918B2E48729D4,,,CCM,RICK SCOTT FOR FLORIDA,,,,,,PO BOX 130708,,TAMPA,FL,33681,G2024,,2024-03-19,1500.00,,2024 general election of Sen. Rick Scott,,C00676965,RICK SCOTT FOR FLORIDA,S8FL00273,Scott,Rick,Sen,,,S,FL,,,,,,,,,,
SB23,C00122499,B99E88DC215BC442DBFD,,,CCM,SUSAN WILD FOR CONGRESS,,,,,,1636 N CEDAR CREST BLVD,#183,Allentown,PA,181042318,P2024,,2024-02-29,1000.00,,2024 PR REP SUSAN WILD,,C00658567,SUSAN WILD FOR CONGRESS,H8PA15229,Wild,Susan,,,,H,PA,07,,,,,,,,,
SB23,C00122499,B21262BA088E347F4A21,,,CCM,TERRI SEWELL FOR CONGRESS,,,,,,P.O. BOX 1964,,Birmingham,AL,352011964,G2024,,2024-02-29,1000.00,,2024 GENERAL REP TERRI SEWELL,,C00458976,TERRI SEWELL FOR CONGRESS,H0AL07086,Sewell,Terri,,,,H,AL,07,,,,,,,,,
SB23,C00122499,B947B3BE75EE349E898E,,,CCM,WALBERG FOR CONGRESS,,,,,,PO Box 1362,,Jackson,MI,492041362,P2024,,2024-02-29,1000.00,,2024 PR REP TIM WALBERG,,C00390724,WALBERG FOR CONGRESS,H4MI07103,Walberg,Tim,,,,H,MI,05,,,,,,,,,
