form_type,filer_committee_id_number,transaction_id_number,back_reference_tran_id_number,back_reference_sched_name,entity_type,payee_organization_name,payee_last_name,payee_first_name,payee_middle_name,payee_prefix,payee_suffix,payee_street_1,payee_street_2,payee_city,payee_state,payee_zip_code,election_code,election_other_description,expenditure_date,expenditure_amount,semi_annual_refunded_bundled_amt,expenditure_purpose_descrip,category_code,beneficiary_committee_fec_id,beneficiary_committee_name,beneficiary_candidate_fec_id,beneficiary_candidate_last_name,beneficiary_candidate_first_name,beneficiary_candidate_middle_name,beneficiary_candidate_prefix,beneficiary_candidate_suffix,beneficiary_candidate_office,beneficiary_candidate_state,beneficiary_candidate_district,conduit_name,conduit_street_1,conduit_street_2,conduit_city,conduit_state,conduit_zip_code,memo_code,memo_text_description,reference_to_si_or_sl_system_code_that_identifies_the_account
SB29,C00686287,B87A2C9F3751345F2B7F,,,COM,The Honorable Jarvis Johnson,,,,,,1051 Cottage Oak,,Houston,TX,770915619,O2024,Primary Runoff,2024-03-26,2000.00,,Contribution to State Committee,,,,,,,,,,,,,,,,,,,,,
SB29,C00686287,B560BCD0731894343A3B,,,COM,The Honorable DeWayne C. Burns,,,,,,703 Stonelake Dr.,,Cleburne,TX,760334545,O2024,Primary Runoff,2024-03-26,2000.00,,Contribution to State Committee,,,,,,,,,,,,,,,,,,,,,
SB29,C00686287,B5E5BA868EF564BC5A6B,,,COM,The Honorable Stephanie D. Klick,,,,,,P.O. Box 7592,,Fort Worth,TX,761110592,O2024,Primary Runoff,2024-03-26,1000.00,,Contribution to State Committee,,,,,,,,,,,,,,,,,,,,,
SB29,C00686287,B380B0F7372F04A8BA1E,,,COM,The Honorable John L. Kuempel,,,,,,902 E. College St.,,Seguin,TX,781553222,O2024,Primary Runoff,2024-03-26,1000.00,,Contribution to State Committee,,,,,,,,,,,,,,,,,,,,,
SB29,C00686287,B1D98C7FD8AC845A28E5,,,COM,The Honorable Lynn D. Stucky,,,,,,P.O. Box 464,,Denton,TX,762020464,O2024,Primary Runoff,2024-03-26,1000.00,,Contribution to State Committee,,,,,,,,,,,,,,,,,,,,,
SB29,C00686287,B9EF6748A364E48109A6,,,COM,The Honorable Matthew M. Dade Phelan,,,,,,Post Office Box 848,,Nederland,TX,776270848,O2024,Primary Runoff,2024-03-26,2000.00,,Contribution to State Committee,,,,,,,,,,,,,,,,,,,,,
SB29,C00686287,B933CC85ACDFF4052AA5,,,COM,The Honorable Gary W. VanDeaver,,,,,,PO Box 866,,New Boston,TX,755700866,O2024,Primary Runoff,2024-03-26,1000.00,,Contribution to State Committee,,,,,,,,,,,,,,,,,,,,,
SB29,C00686287,B0A2F8AC790DE4BFCB3C,,,COM,Associated Republicans of Texas Campaign Fund,,,,,,"807 Brazos, Ste. 601",,Austin,TX,787012526,O2024,Other,2024-03-26,3000.00,,Contribution to State Committee,,,,,,,,,,,,,,,,,,,,,
