form_type,filer_committee_id_number,transaction_id_number,back_reference_tran_id_number,back_reference_sched_name,entity_type,payee_organization_name,payee_last_name,payee_first_name,payee_middle_name,payee_prefix,payee_suffix,payee_street_1,payee_street_2,payee_city,payee_state,payee_zip_code,election_code,election_other_description,expenditure_date,expenditure_amount,semi_annual_refunded_bundled_amt,expenditure_purpose_descrip,category_code,beneficiary_committee_fec_id,beneficiary_committee_name,beneficiary_candidate_fec_id,beneficiary_candidate_last_name,beneficiary_candidate_first_name,beneficiary_candidate_middle_name,beneficiary_candidate_prefix,beneficiary_candidate_suffix,beneficiary_candidate_office,beneficiary_candidate_state,beneficiary_candidate_district,conduit_name,conduit_street_1,conduit_street_2,conduit_city,conduit_state,conduit_zip_code,memo_code,memo_text_description,reference_to_si_or_sl_system_code_that_identifies_the_account
SB23,C00451757,BC79F5AEB95634777AF6,,,CCM,Citizens For John Rutherford,,,,,,2308 Mount Vernon Avenue #337,,Alexandria,VA,223011328,P2024,,2024-03-15,2500.00,,Contribution to Committee,,C00615294,Citizens For John Rutherford,H6FL04105,Rutherford,John,,Rep.,,H,FL,05,,,,,,,,,
SB23,C00451757,B3F0BD0DDB005420E810,,,CCM,Sanford Bishop For Congress,,,,,,"412 First Street, SE Suite 100",,Washington,DC,200031804,P2024,,2024-03-20,2500.00,,Contribution to Committee,,C00266940,Sanford Bishop For Congress,H2GA02031,Bishop,Sanford,D.,Rep.,Jr.,H,GA,02,,,,,,,,,
SB23,C00451757,B6735E183FE874D1FB5E,,,CCM,Rick Scott for Florida,,,,,,PO Box 130708,,Tampa,FL,336810708,P2024,,2024-03-20,1500.00,,Contribution to Committee,,C00676965,Rick Scott for Florida,S8FL00273,Scott,Rick,,Sen.,,S,FL,,,,,,,,,,
SB23,C00451757,B756902F2A46E4DAEB59,,,CCM,Rick Scott for Florida,,,,,,PO Box 130708,,Tampa,FL,336810708,G2024,,2024-03-20,1000.00,,Contribution to Committee,,C00676965,Rick Scott for Florida,S8FL00273,Scott,Rick,,Sen.,,S,FL,,,,,,,,,,
SB23,C00451757,B1F6D1EC1BD5F4B289B3,,,CCM,Buddy Carter For Congress,,,,,,411 First Street SE,,Washington,DC,200031827,P2024,,2024-03-15,2500.00,,Contribution to Committee,,C00543967,Buddy Carter For Congress,H4GA01039,Carter,Buddy,,Rep.,,H,GA,01,,,,,,,,,
SB23,C00451757,BBF2B5FCA4E114EFBB17,,,CCM,AARON BEAN FOR CONGRESS,,,,,,"439 New Jersey Ave, SE",,Washington,DC,200034034,P2024,,2024-03-15,2500.00,,Contribution to Committee,,C00816983,AARON BEAN FOR CONGRESS,H2FL04211,Bean,Aaron,,Rep.,,H,FL,04,,,,,,,,,
