form_type,filer_committee_id_number,transaction_id_number,back_reference_tran_id_number,back_reference_sched_name,entity_type,payee_organization_name,payee_last_name,payee_first_name,payee_middle_name,payee_prefix,payee_suffix,payee_street_1,payee_street_2,payee_city,payee_state,payee_zip_code,election_code,election_other_description,expenditure_date,expenditure_amount,semi_annual_refunded_bundled_amt,expenditure_purpose_descrip,category_code,beneficiary_committee_fec_id,beneficiary_committee_name,beneficiary_candidate_fec_id,beneficiary_candidate_last_name,beneficiary_candidate_first_name,beneficiary_candidate_middle_name,beneficiary_candidate_prefix,beneficiary_candidate_suffix,beneficiary_candidate_office,beneficiary_candidate_state,beneficiary_candidate_district,conduit_name,conduit_street_1,conduit_street_2,conduit_city,conduit_state,conduit_zip_code,memo_code,memo_text_description,reference_to_si_or_sl_system_code_that_identifies_the_account
SB23,C00092247,SB23.42436,,,CCM,ALTMAN FOR CONGRESS,,,,,,PO BOX 267,,LAMBERTVILLE,NJ,08530,P2024,,2024-05-08,1000.00,,Contribution,,C00841643,ALTMAN FOR CONGRESS,,,,,,,H,NJ,07,,,,,,,,
SB23,C00092247,SB23.42425,,,CCM,BONNIE WATSON COLEMAN FOR CONGRESS,,,,,,600 PENNSYLVANIA AVE SE,#15180,WASHINGTON,DC,20003,P2024,,2024-05-08,1000.00,,Contribution,,C00558437,BONNIE WATSON COLEMAN FOR CONGRESS,,,,,,,H,NJ,12,,,,,,,,
SB23,C00092247,SB23.42428,,,CCM,KAREN BAKER FOR THE 9TH DISTRICT VA,,,,,,214 W. MAIN ST.,,FLOYD,VA,24091,P2024,,2024-05-08,1000.00,,Contribution,,C00870071,KAREN BAKER FOR THE 9TH DISTRICT VA,,,,,,,H,VA,09,,,,,,,,
SB23,C00092247,SB23.42431,,,CCM,PAULA COLLINS FOR CONGRESS,,,,,,LAW OFFICE OF PAULA COLLINS,251 W. 30TH STREET FIFTH FLOOR,NEW YORK,NY,10001,P2024,,2024-05-08,1000.00,,Contribution,,C00869123,PAULA COLLINS FOR CONGRESS,,,,,,,H,NY,21,,,,,,,,
SB23,C00092247,SB23.42439,,,CCM,TIM ALEXANDER FOR CONGRESS - 2024,,,,,,P.O. BOX 818,,OCEANVILLE,NJ,08231,P2024,,2024-05-08,1000.00,,Contribution,,C00839696,TIM ALEXANDER FOR CONGRESS - 2024,,,,,,,H,NJ,02,,,,,,,,
