form_type,filer_committee_id_number,transaction_id_number,back_reference_tran_id_number,back_reference_sched_name,entity_type,payee_organization_name,payee_last_name,payee_first_name,payee_middle_name,payee_prefix,payee_suffix,payee_street_1,payee_street_2,payee_city,payee_state,payee_zip_code,election_code,election_other_description,expenditure_date,expenditure_amount,semi_annual_refunded_bundled_amt,expenditure_purpose_descrip,category_code,beneficiary_committee_fec_id,beneficiary_committee_name,beneficiary_candidate_fec_id,beneficiary_candidate_last_name,beneficiary_candidate_first_name,beneficiary_candidate_middle_name,beneficiary_candidate_prefix,beneficiary_candidate_suffix,beneficiary_candidate_office,beneficiary_candidate_state,beneficiary_candidate_district,conduit_name,conduit_street_1,conduit_street_2,conduit_city,conduit_state,conduit_zip_code,memo_code,memo_text_description,reference_to_si_or_sl_system_code_that_identifies_the_account
SB29,C00029447,500016975,,,ORG,Georgetown Firefighters for Responsible Government,,,,,,2233 Dale Ln,,Dale,TX,786162849,,,2023-10-19,7500.00,0.00,Non-Federal Contribution,,,,,,,,,,,,,,,,,,,,
SB29,C00029447,500016970,,,ORG,Heith Good for Viking Nation,,,,,,4165 Fosnaugh School Rd SW,,Amanda,OH,431029707,,,2023-10-12,1000.00,0.00,Non-Federal Contribution,,,,,,,,,,,,,,,,,,,,
SB29,C00029447,500016979,,,ORG,International Association of Fire Fighters,,,,,,1750 New York Ave NW,Ste 300,Washington,DC,200065301,,,2023-10-05,204.88,0.00,Transfer of Canadian FIREPAC Contributions Inadvertently Deposited Into Federal PAC Account,,,,,,,,,,,,,,,,,,,,
SB29,C00029447,500016969,,,ORG,People for Wayne Fournier,,,,,,PO Box 950,,Tenino,WA,985890950,,,2023-10-12,1000.00,0.00,Non-Federal Contribution,,,,,,,,,,,,,,,,,,,,
SB29,C00029447,500016976,,,ORG,Professional Fire Fighters of South Carolina FIREPAC,,,,,,117 Royal Dr,,Williamston,SC,296972046,,,2023-10-20,1500.00,0.00,Non-Federal Contribution,,,,,,,,,,,,,,,,,,,,
SB29,C00029447,500016977,,,ORG,Simpson 4 Eagle Fire Commissioner,,,,,,1040 E Pastoral Ct,,Eagle,ID,836167017,,,2023-10-19,1000.00,0.00,Non-Federal Contribution,,,,,,,,,,,,,,,,,,,,
SB29,C00029447,500016972,,,ORG,South Carolina Republican House Caucus,,,,,,518 Blatt,Bldg,Columbia,SC,29211,,,2023-10-12,3500.00,0.00,Non-Federal Contribution,,,,,,,,,,,,,,,,,,,,
SB29,C00029447,500016971,,,ORG,Weslaco Firefighters Association PAC,,,,,,807 Ric Mar St,,Edinburg,TX,785419337,,,2023-10-12,3000.00,0.00,Non-Federal Contribution,,,,,,,,,,,,,,,,,,,,
